title,year,is_relevant,has_phenomenon,has_metrics,mitigation_methods,reasoning,abstract,publication_venue,related_score,type,domain,tagging_reasoning
State over Tokens: Characterizing the Role of Reasoning Tokens,2025,True,True,False,,论文揭示了CoT的不忠实现象，并提出了State over Tokens框架来解释这一现象。,"Large Language Models (LLMs) can generate reasoning tokens before their final answer to boost performance on complex tasks. While these sequences seem like human thought processes, empirical evidence reveals that they are not a faithful explanation of the model's actual reasoning process. To address this gap between appearance and function, we introduce the State over Tokens (SoT) conceptual framework. SoT reframes reasoning tokens not as a linguistic narrative, but as an externalized computational state -- the sole persistent information carrier across the model's stateless generation cycles. This explains how the tokens can drive correct reasoning without being a faithful explanation when read as text and surfaces previously overlooked research questions on these tokens. We argue that to truly understand the process that LLMs do, research must move beyond reading the reasoning tokens as text and focus on decoding them as state.",,2,White-box,General,该论文明确研究CoT（推理标记）是否忠实反映模型的实际推理过程，揭示了推理标记并非真实解释的现象，并提出了新的框架（SoT）来理解这些标记作为计算状态的角色。这直接符合Faithfulness的核心定义，尤其是关于Post-hoc Rationalization和Causal proxy的讨论。
Thought Branches: Interpreting LLM Reasoning Requires Resampling,2025,True,True,True,"Interpretability & Internal Mechanisms, Consistency & Ensembling",论文探讨了CoT的忠实性问题，提出了通过重采样进行因果分析的方法，并讨论了不忠实现象。,"Most work interpreting reasoning models studies only a single chain-of-thought (CoT), yet these models define distributions over many possible CoTs. We argue that studying a single sample is inadequate for understanding causal influence and the underlying computation. Though fully specifying this distribution is intractable, it can be understood by sampling. We present case studies using resampling to investigate model decisions. First, when a model states a reason for its action, does that reason actually cause the action? In""agentic misalignment""scenarios, we resample specific sentences to measure their downstream effects. Self-preservation sentences have small causal impact, suggesting they do not meaningfully drive blackmail. Second, are artificial edits to CoT sufficient for steering reasoning? These are common in literature, yet take the model off-policy. Resampling and selecting a completion with the desired property is a principled on-policy alternative. We find off-policy interventions yield small and unstable effects compared to resampling in decision-making tasks. Third, how do we understand the effect of removing a reasoning step when the model may repeat it post-edit? We introduce a resilience metric that repeatedly resamples to prevent similar content from reappearing downstream. Critical planning statements resist removal but have large effects when eliminated. Fourth, since CoT is sometimes""unfaithful"", can our methods teach us anything in these settings? Adapting causal mediation analysis, we find that hints that have a causal effect on the output without being explicitly mentioned exert a subtle and cumulative influence on the CoT that persists even if the hint is removed. Overall, studying distributions via resampling enables reliable causal analysis, clearer narratives of model reasoning, and principled CoT interventions.",arXiv.org,2,White-box,General,该论文明确研究 CoT 是否是模型预测的真实原因（Causal role），通过重采样方法探讨模型决策的因果影响。论文还讨论了 CoT 的'不忠实性'（unfaithful）现象，并提出了测量 Faithfulness 的指标（如 resilience metric 和 causal mediation analysis）。这些内容直接符合 Faithfulness 的核心定义。
Can Aha Moments Be Fake? Identifying True and Decorative Thinking Steps in Chain-of-Thought,2025,True,True,True,Interpretability & Internal Mechanisms,论文揭示了CoT中存在真假思考步骤的现象，并提出了度量指标TTS和白盒干预方法。,"Recent large language models (LLMs) can generate long Chain-of-Thought (CoT) at test time, enabling them to solve complex tasks. These reasoning steps in CoT are often assumed as a faithful reflection of the model's internal thinking process, and used to monitor unsafe intentions. However, we find many reasoning steps don't truly contribute to LLMs'prediction. We measure the step-wise causal influence of each reasoning step on the model's final prediction with a proposed True Thinking Score (TTS). We reveal that LLMs often interleave between true-thinking steps (which are genuinely used to produce the final output) and decorative-thinking steps (which only give the appearance of reasoning but have minimal causal impact). Notably, only a small subset of the total reasoning steps have a high TTS that causally drive the model's prediction: e.g., for the AIME dataset, only an average of 2.3% of reasoning steps in CoT have a TTS>= 0.7 (range: 0-1) under the Qwen-2.5 model. Furthermore, we identify a TrueThinking direction in the latent space of LLMs. By steering along or against this direction, we can force the model to perform or disregard certain CoT steps when computing the final result. Finally, we highlight that self-verification steps in CoT (i.e., aha moments) can also be decorative, where LLMs do not truly verify their solution. Steering along the TrueThinking direction can force internal reasoning over these steps, resulting in a change in the final results. Overall, our work reveals that LLMs often verbalize reasoning steps without actually performing them internally, which undermines both the efficiency of LLM reasoning and the trustworthiness of CoT.",arXiv.org,2,White-box,General,该论文明确研究 CoT 中哪些推理步骤真正对模型预测有因果影响，提出了 True Thinking Score (TTS) 来测量每个推理步骤的因果作用，并揭示了模型会生成装饰性推理步骤（decorative-thinking steps）的现象。这直接符合 Faithfulness 的核心定义，即研究 CoT 是否真实反映模型的内部计算过程。此外，论文还通过操纵潜在空间中的 TrueThinking 方向来验证因果性，属于白盒方法。
The Kinetics of Reasoning: How Chain-of-Thought Shapes Learning in Transformers?,2025,True,True,True,,论文研究了CoT的学习动态，揭示了不忠实现象，并提出了量化框架。,"Chain-of-thought (CoT) supervision can substantially improve transformer performance, yet the mechanisms by which models learn to follow and benefit from CoT remain poorly understood. We investigate these learning dynamics through the lens of grokking by pretraining transformers on symbolic reasoning tasks with tunable algorithmic complexity and controllable data composition to study their generalization. Models were trained under two settings: (i) producing only final answers, and (ii) emitting explicit CoT traces before answering. Our results show that while CoT generally improves task performance, its benefits depend on task complexity. To quantify these effects, we model the accuracy of the logarithmic training steps with a three-parameter logistic curve, revealing how the learning speed and shape vary with task complexity, data distribution, and the presence of CoT supervision. We also uncover a transient trace unfaithfulness phase: early in training, models often produce correct answers while skipping or contradicting CoT steps, before later aligning their reasoning traces with answers. Empirically, we (1) demonstrate that CoT accelerates generalization but does not overcome tasks with higher algorithmic complexity, such as finding list intersections; (2) introduce a kinetic modeling framework for understanding transformer learning; (3) characterize trace faithfulness as a dynamic property that emerges over training; and (4) show CoT alters internal transformer computation mechanistically.",arXiv.org,2,White-box,General,论文明确研究了 CoT 的忠实度（Faithfulness），特别是发现了训练早期存在 'transient trace unfaithfulness phase'（暂时性不忠实阶段），即模型在早期训练中会生成正确答案但跳过或与 CoT 步骤矛盾，随后才逐渐对齐推理轨迹与答案。此外，论文还从机制上分析了 CoT 如何改变 Transformer 的内部计算，符合白盒研究特征。
Thinking About Thinking: SAGE-nano's Inverse Reasoning for Self-Aware Language Models,2025,True,False,True,Interpretability & Internal Mechanisms,论文提出逆向推理方法，通过元认知结构提升模型对自身推理链的解释能力，涉及忠实性。,"Large Language Models (LLMs) have demonstrated remarkable capabilities at solving complex reasoning tasks with Chain-of-Thought (CoT) prompting, but their decision-making processes remain somewhat blackbox. We introduce textbfinverse reasoning, a novel paradigm enabling LLMs to decompose and explain their own reasoning chains post-hoc. Our approach, used in SAGE-nano, a 4-billion-parameter reasoning model, employs a metacognitive structure that reflects back via attention processes to identify major decision points and generate explanations of reasoning choices. While typical CoT approaches are directed towards forward reasoning generation, inverse reasoning provides insight into why specific reasoning chains were selected over others. Through thorough testing of logical reasoning puzzles, math problems and ethical dilemmas from AQUA-RAT, CommonsenseQA, and customized benchmarks, we demonstrate that SAGE-nano is at the cutting edge both on reasoning accuracy (74.6% on AQUA-RAT) and explanation quality (92.1% human preference score) for its task, and offers performance almost on par with models like Claude-3.5 Sonnet or GPT-4o. Our contributions are: (i) the first rigorous framework for LLM self-reflection via inverse reasoning, (ii) a novel metalearning framework to reverse the attention flow, (iii) comprehensive evaluation frameworks for reasoning transparency, and (iv) evidence that increasing reasoning using inverse reasoning improves interpretability along with reasoning performance. Our work creates new avenues for transparent AI systems and closes significant gaps in AI safety, education, and scientific discovery.",arXiv.org,2,White-box,General,该论文明确研究LLM如何通过逆向推理（inverse reasoning）分解和解释自己的推理链，涉及模型内部注意力机制的反向流动，直接探讨了推理链选择的真实原因（causal role），属于CoT Faithfulness的核心研究范畴。
Unveiling Confirmation Bias in Chain-of-Thought Reasoning,2025,True,True,False,Prompting & In-Context Learning,论文揭示了CoT中的确认偏误现象，并提出了改进提示策略的需求。,"Chain-of-thought (CoT) prompting has been widely adopted to enhance the reasoning capabilities of large language models (LLMs). However, the effectiveness of CoT reasoning is inconsistent across tasks with different reasoning types. This work presents a novel perspective to understand CoT behavior through the lens of \textit{confirmation bias} in cognitive psychology. Specifically, we examine how model internal beliefs, approximated by direct question-answering probabilities, affect both reasoning generation ($Q \to R$) and reasoning-guided answer prediction ($QR \to A$) in CoT. By decomposing CoT into a two-stage process, we conduct a thorough correlation analysis in model beliefs, rationale attributes, and stage-wise performance. Our results provide strong evidence of confirmation bias in LLMs, such that model beliefs not only skew the reasoning process but also influence how rationales are utilized for answer prediction. Furthermore, the interplay between task vulnerability to confirmation bias and the strength of beliefs also provides explanations for CoT effectiveness across reasoning tasks and models. Overall, this study provides a valuable insight for the needs of better prompting strategies that mitigate confirmation bias to enhance reasoning performance. Code is available at \textit{https://github.com/yuewan2/biasedcot}.",Annual Meeting of the Association for Computational Linguistics,2,White-box,General,该论文明确研究了CoT推理中的确认偏见（confirmation bias），即模型内部信念如何影响推理生成和答案预测，直接关联到CoT的忠实度问题。通过分解CoT为两阶段过程并分析模型信念与推理属性的相关性，揭示了模型推理过程可能被扭曲的现象，符合Faithfulness的核心定义。
Are language models aware of the road not taken? Token-level uncertainty and hidden state dynamics,2025,True,False,False,Interpretability & Internal Mechanisms,论文探讨了语言模型在生成CoT时的内部状态和不确定性，与Faithfulness相关，并提出了基于激活干预的改进方法。,"When a language model generates text, the selection of individual tokens might lead it down very different reasoning paths, making uncertainty difficult to quantify. In this work, we consider whether reasoning language models represent the alternate paths that they could take during generation. To test this hypothesis, we use hidden activations to control and predict a language model's uncertainty during chain-of-thought reasoning. In our experiments, we find a clear correlation between how uncertain a model is at different tokens, and how easily the model can be steered by controlling its activations. This suggests that activation interventions are most effective when there are alternate paths available to the model -- in other words, when it has not yet committed to a particular final answer. We also find that hidden activations can predict a model's future outcome distribution, demonstrating that models implicitly represent the space of possible paths.",arXiv.org,2,White-box,General,该论文明确研究语言模型在生成链式思考（CoT）时的内部机制，通过隐藏激活状态来控制和预测模型的不确定性，探讨模型是否意识到未选择的推理路径。这与Faithfulness的核心定义直接相关，因为它涉及模型生成的推理路径是否真实反映了其内部计算过程，而非事后合理化。
X-Node: Self-Explanation is All We Need,2025,True,False,False,"Training & Fine-tuning, Interpretability & Internal Mechanisms",论文提出X-Node框架，通过构建结构化上下文向量生成忠实解释，解码器确保解释与内部嵌入一致，属于提升忠实性的内部机制方法。,"Graph neural networks (GNNs) have achieved state-of-the-art results in computer vision and medical image classification tasks by capturing structural dependencies across data instances. However, their decision-making remains largely opaque, limiting their trustworthiness in high-stakes clinical applications where interpretability is essential. Existing explainability techniques for GNNs are typically post-hoc and global, offering limited insight into individual node decisions or local reasoning. We introduce X-Node, a self-explaining GNN framework in which each node generates its own explanation as part of the prediction process. For every node, we construct a structured context vector encoding interpretable cues such as degree, centrality, clustering, feature saliency, and label agreement within its local topology. A lightweight Reasoner module maps this context into a compact explanation vector, which serves three purposes: (1) reconstructing the node's latent embedding via a decoder to enforce faithfulness, (2) generating a natural language explanation using a pre-trained LLM (e.g., Grok or Gemini), and (3) guiding the GNN itself via a""text-injection""mechanism that feeds explanations back into the message-passing pipeline. We evaluate X-Node on two graph datasets derived from MedMNIST and MorphoMNIST, integrating it with GCN, GAT, and GIN backbones. Our results show that X-Node maintains competitive classification accuracy while producing faithful, per-node explanations. Repository: https://github.com/basiralab/X-Node.",,2,White-box,Medical,论文明确提出了一个自解释的GNN框架X-Node，其中每个节点在预测过程中生成自己的解释，并通过解码器强制忠实度（faithfulness）。此外，论文还讨论了如何通过解释向量来重建节点的潜在嵌入，以确保解释的真实性，这与CoT Faithfulness的核心定义直接相关。
Unsupervised decoding of encoded reasoning using language model interpretability,2025,True,False,False,Interpretability & Internal Mechanisms,论文探讨了通过内部激活解码 CoT 的方法，属于 Faithfulness 的白盒评估。,"As large language models become increasingly capable, there is growing concern that they may develop reasoning processes that are encoded or hidden from human oversight. To investigate whether current interpretability techniques can penetrate such encoded reasoning, we construct a controlled testbed by fine-tuning a reasoning model (DeepSeek-R1-Distill-Llama-70B) to perform chain-of-thought reasoning in ROT-13 encryption while maintaining intelligible English outputs. We evaluate mechanistic interpretability methods--in particular, logit lens analysis--on their ability to decode the model's hidden reasoning process using only internal activations. We show that logit lens can effectively translate encoded reasoning, with accuracy peaking in intermediate-to-late layers. Finally, we develop a fully unsupervised decoding pipeline that combines logit lens with automated paraphrasing, achieving substantial accuracy in reconstructing complete reasoning transcripts from internal model representations. These findings suggest that current mechanistic interpretability techniques may be more robust to simple forms of encoded reasoning than previously understood. Our work provides an initial framework for evaluating interpretability methods against models that reason in non-human-readable formats, contributing to the broader challenge of maintaining oversight over increasingly capable AI systems.",,2,White-box,General,该论文明确研究模型内部机制（如logit lens分析）是否能解码隐藏的推理过程（ROT-13加密的CoT），直接涉及CoT的忠实性验证。通过分析内部激活值重建推理轨迹，属于白盒方法，且任务领域不特定于数学或逻辑等，故归类为通用领域。
What Really Counts? Examining Step and Token Level Attribution in Multilingual CoT Reasoning,2025,True,True,True,,论文研究了CoT在多语言模型中的忠实性和解释性，提出了评估方法并揭示了不忠实现象。,"This study investigates the attribution patterns underlying Chain-of-Thought (CoT) reasoning in multilingual LLMs. While prior works demonstrate the role of CoT prompting in improving task performance, there are concerns regarding the faithfulness and interpretability of the generated reasoning chains. To assess these properties across languages, we applied two complementary attribution methods--ContextCite for step-level attribution and Inseq for token-level attribution--to the Qwen2.5 1.5B-Instruct model using the MGSM benchmark. Our experimental results highlight key findings such as: (1) attribution scores excessively emphasize the final reasoning step, particularly in incorrect generations; (2) structured CoT prompting significantly improves accuracy primarily for high-resource Latin-script languages; and (3) controlled perturbations via negation and distractor sentences reduce model accuracy and attribution coherence. These findings highlight the limitations of CoT prompting, particularly in terms of multilingual robustness and interpretive transparency.",,2,White-box,General,该论文明确研究了CoT推理的忠实性和可解释性，使用了两种互补的归因方法来评估多语言LLM中生成的推理链的忠实性。研究结果揭示了CoT提示的局限性，特别是在多语言鲁棒性和解释透明度方面，直接关联到Faithfulness的核心定义。
Is the MMI Criterion Necessary for Interpretability? Degenerating Non-causal Features to Plain Noise for Self-Rationalization,2024,True,True,True,Training & Fine-tuning,论文讨论了非因果特征对解释性的影响，并提出了新的准则来提升忠实性。,"An important line of research in the field of explainability is to extract a small subset of crucial rationales from the full input. The most widely used criterion for rationale extraction is the maximum mutual information (MMI) criterion. However, in certain datasets, there are spurious features non-causally correlated with the label and also get high mutual information, complicating the loss landscape of MMI. Although some penalty-based methods have been developed to penalize the spurious features (e.g., invariance penalty, intervention penalty, etc) to help MMI work better, these are merely remedial measures. In the optimization objectives of these methods, spurious features are still distinguished from plain noise, which hinders the discovery of causal rationales. This paper aims to develop a new criterion that treats spurious features as plain noise, allowing the model to work on datasets rich in spurious features as if it were working on clean datasets, thereby making rationale extraction easier. We theoretically observe that removing either plain noise or spurious features from the input does not alter the conditional distribution of the remaining components relative to the task label. However, significant changes in the conditional distribution occur only when causal features are eliminated. Based on this discovery, the paper proposes a criterion for \textbf{M}aximizing the \textbf{R}emaining \textbf{D}iscrepancy (MRD). Experiments on six widely used datasets show that our MRD criterion improves rationale quality (measured by the overlap with human-annotated rationales) by up to $10.4\%$ as compared to several recent competitive MMI variants. Code: \url{https://github.com/jugechengzi/Rationalization-MRD}.",Neural Information Processing Systems,2,White-box,General,论文明确研究了解释性（interpretability）中的因果特征与非因果特征（spurious features）问题，提出了新的准则（MRD）来区分因果特征和非因果特征，以确保解释的真实性（faithfulness）。这与CoT Faithfulness的核心定义高度相关，因为它关注的是解释是否真实反映了模型的预测过程，而非事后合理化。
Did I Faithfully Say What I Thought? Bridging the Gap Between Neural Activity and Self-Explanations in Large Language Models,2025,True,True,True,Interpretability & Internal Mechanisms,论文提出了NeuroFaith框架，评估和提升LLM自我解释的忠实性，涉及不忠实现象和度量方法。,"Large Language Models (LLMs) can generate plausible free text self-explanations to justify their answers. However, these natural language explanations may not accurately reflect the model's actual reasoning process, indicating a lack of faithfulness. Existing faithfulness evaluation methods rely primarily on behavioral tests or computational block analysis without examining the semantic content of internal neural representations. This paper proposes NeuroFaith, a flexible framework that measures the faithfulness of LLM free text self-explanation by identifying key concepts within explanations and mechanistically testing whether these concepts actually influence the model's predictions. We show the versatility of NeuroFaith across 2-hop reasoning and classification tasks. Additionally, a linear faithfulness probe based on NeuroFaith is developed to detect unfaithful self-explanations from representation space and improve faithfulness through steering. NeuroFaith provides a principled approach to evaluating and enhancing the faithfulness of LLM free text self-explanations, addressing critical needs for trustworthy AI systems.",arXiv.org,2,White-box,General,该论文明确研究LLM生成的自由文本自我解释是否忠实反映模型的实际推理过程，提出了NeuroFaith框架来测量忠实度，并通过内部神经表示分析验证概念是否真正影响预测，直接涉及Faithfulness的核心问题。
