title,year,is_relevant,has_phenomenon,has_metrics,mitigation_methods,reasoning,abstract,publication_venue,related_score,type,domain,tagging_reasoning
Can We Predict Alignment Before Models Finish Thinking? Towards Monitoring Misaligned Reasoning Models,2025,True,True,True,"Training & Fine-tuning, Interpretability & Internal Mechanisms",论文讨论了CoT的不忠实现象，并提出了基于激活的监控方法。,"Reasoning language models improve performance on complex tasks by generating long chains of thought (CoTs), but this process can also increase harmful outputs in adversarial settings. In this work, we ask whether the long CoTs can be leveraged for predictive safety monitoring: do the reasoning traces provide early signals of final response alignment that could enable timely intervention? We evaluate a range of monitoring methods using either CoT text or activations, including highly capable large language models, fine-tuned classifiers, and humans. First, we find that a simple linear probe trained on CoT activations significantly outperforms all text-based baselines in predicting whether a final response is safe or unsafe, with an average absolute increase of 13 in F1 scores over the best-performing alternatives. CoT texts are often unfaithful and misleading, while model latents provide a more reliable predictive signal. Second, the probe can be applied to early CoT segments before the response is generated, showing that alignment signals appear before reasoning completes. Error analysis reveals that the performance gap between text classifiers and the linear probe largely stems from a subset of responses we call performative CoTs, where the reasoning consistently contradicts the final response as the CoT progresses. Our findings generalize across model sizes, families, and safety benchmarks, suggesting that lightweight probes could enable real-time safety monitoring and early intervention during generation.",arXiv.org,2,White-box,General,论文明确研究了 CoT 的真实性（Faithfulness）问题，特别是提到了 CoT 文本常不忠实（unfaithful and misleading），而模型内部的激活值提供了更可靠的信号。此外，论文还探讨了 performative CoTs 现象，即推理过程与最终回应矛盾，这与 Faithfulness 的核心定义直接相关。
Breakpoint Transformers for Modeling and Tracking Intermediate Beliefs,2022,True,False,True,Training & Fine-tuning,论文提出了一种中间信念跟踪框架，与 CoT 的中间性和忠实性相关，并提出了新的评估指标。,"Can we teach models designed for language understanding tasks to track and improve their beliefs through intermediate points in text? Besides making their inner workings more transparent, this would also help make models more reliable and consistent. To this end, we propose a representation learning framework called breakpoint modeling that allows for efficient and robust learning of this type. Given any text encoder and data marked with intermediate states (breakpoints) along with corresponding textual queries viewed as true/false propositions (i.e., the candidate intermediate beliefs of a model), our approach trains models in an efficient and end-to-end fashion to build intermediate representations that facilitate direct querying and training of beliefs at arbitrary points in text, alongside solving other end-tasks. We evaluate breakpoint modeling on a diverse set of NLU tasks including relation reasoning on Cluttr and narrative understanding on bAbI. Using novel proposition prediction tasks alongside these end-tasks, we show the benefit of our T5-based breakpoint transformer over strong conventional representation learning approaches in terms of processing efficiency, belief accuracy, and belief consistency, all with minimal to no degradation on the end-task. To show the feasibility of incorporating our belief tracker into more complex reasoning pipelines, we also obtain state-of-the-art performance on the three-tiered reasoning challenge for the recent TRIP benchmark (23-32% absolute improvement on Tasks 2-3).",Conference on Empirical Methods in Natural Language Processing,1,White-box,General,该论文提出了一个框架来建模和跟踪中间信念，虽然涉及透明度和可靠性，但未明确研究CoT是否真实反映模型预测的计算过程。因此，它属于边缘相关。
Correlation or Causation: Analyzing the Causal Structures of LLM and LRM Reasoning Process,2025,True,True,False,Training & Fine-tuning,论文探讨了LLMs和LRMs的因果推理问题，涉及不忠实现象，并提出了通过RLVR训练提升因果推理的方法。,"LLMs suffer from critical reasoning issues such as unfaithfulness, bias, and inconsistency, since they lack robust causal underpinnings and may rely on superficial correlations rather than genuine understanding. Successive LRMs have emerged as a promising alternative, leveraging advanced training techniques such as reinforcement learning (RL) and distillation to improve task accuracy. However, the impact of these training methods on causality remains largely unexplored. In this study, we conduct a systematic causal analysis on LLMs and LRMs, examining structural causal models (SCMs) of four key variables: problem instruction (Z), thinking process (T), reasoning steps (X), and answer (Y). Our findings reveal that RLVR-trained LRMs exhibit enhanced causal reasoning capabilities, aligning more closely with ideal causal structures, while LLMs and distilled LRMs fail to address causality-related deficiencies. Our further investigation indicates that RLVR reduces spurious correlations and strengthens genuine causal patterns, thereby mitigating unfaithfulness and bias. In addition, our inspection on the dynamics of the RLVR training process observes a high correlation between reduced spurious features and improved causal structures, where the causal relationships consistently improve in the training process. This study contributes to the understanding of causality in reasoning models, highlights the critical role of RLVR in enhancing causal reasoning, and provides insights for designing future AI systems with stronger causal foundations. We release our code and data at https://github.com/Harryking1999/CoT_Causal_Analysis.",arXiv.org,2,White-box,General,该论文明确研究了LLM和LRM的因果结构，特别是思考过程（T）和推理步骤（X）与答案（Y）之间的因果关系。研究发现RLVR训练的LRM表现出更强的因果推理能力，减少了虚假相关性并增强了真实的因果模式，从而减轻了不忠实性和偏见。这些内容直接涉及CoT的忠实度问题，属于核心相关研究。
FRIT: Using Causal Importance to Improve Chain-of-Thought Faithfulness,2025,True,True,False,Training & Fine-tuning,论文提出了一种通过干预训练提升 CoT 忠实性的方法，并讨论了不忠实现象。,"Chain-of-thought (CoT) reasoning has emerged as a powerful tool for improving large language model performance on complex tasks, but recent work shows that reasoning steps often fail to causally influence the final answer, creating brittle and untrustworthy outputs. Prior approaches focus primarily on measuring faithfulness, while methods for systematically improving it remain limited. We introduce Faithful Reasoning via Intervention Training (FRIT), a scalable alignment method that trains models to produce causally consistent reasoning by learning from systematically corrupted examples. FRIT generates synthetic training data by intervening on individual reasoning steps in model-generated CoTs, creating faithful/unfaithful pairs that highlight when reasoning breaks down. We then apply Direct Preference Optimization to teach models to prefer causally consistent reasoning paths. Evaluating on Qwen3-8B and Mistral-7B-v0.1 across factual and symbolic reasoning tasks, FRIT increases faithful reasoning by $3.4$ percentage points for Mistral on GSM8K while improving accuracy by $7.6$ percentage points. Our approach provides the first scalable, supervision-free method for training language models to produce more reliable and interpretable reasoning, addressing a critical gap between reasoning performance and trustworthiness. We release our code at \href{https://github.com/Anut-py/frit}.",arXiv.org,2,White-box,General,该论文明确研究如何通过干预训练（FRIT）来提高 CoT 的忠实度，确保推理步骤对最终答案有因果影响。论文不仅提出了测量方法，还提供了系统性改进忠实度的方案，属于核心相关研究。
"From Reasoning to Answer: Empirical, Attention-Based and Mechanistic Insights into Distilled DeepSeek R1 Models",2025,True,False,False,Interpretability & Internal Mechanisms,论文探讨了推理痕迹对答案生成的影响，并通过干预实验验证了推理与答案之间的因果关系。,"Large Reasoning Models (LRMs) generate explicit reasoning traces alongside final answers, yet the extent to which these traces influence answer generation remains unclear. In this work, we conduct a three-stage investigation into the interplay between reasoning and answer generation in three distilled DeepSeek R1 models. First, through empirical evaluation, we demonstrate that including explicit reasoning consistently improves answer quality across diverse domains. Second, attention analysis reveals that answer tokens attend substantially to reasoning tokens, with certain mid-layer Reasoning-Focus Heads (RFHs) closely tracking the reasoning trajectory, including self-reflective cues. Third, we apply mechanistic interventions using activation patching to assess the dependence of answer tokens on reasoning activations. Our results show that perturbations to key reasoning tokens can reliably alter the final answers, confirming a directional and functional flow of information from reasoning to answer. These findings deepen our understanding of how LRMs leverage reasoning tokens for answer generation, highlighting the functional role of intermediate reasoning in shaping model outputs. Our data and code are publicly available at \href{https://aka.ms/R2A-code}{this URL}.",,2,White-box,General,该论文明确研究了推理痕迹（CoT）对答案生成的实际影响，通过注意力分析和机制干预（如激活修补）验证了推理痕迹在模型预测中的因果作用，符合Faithfulness的核心定义。
Inducing Faithfulness in Structured Reasoning via Counterfactual Sensitivity,2025,True,True,True,Training & Fine-tuning,论文提出了一种新的训练目标CSR，旨在增强模型推理步骤与输出之间的因果依赖性，直接涉及CoT的忠实性。,"The reasoning processes of large language models often lack faithfulness; a model may generate a correct answer while relying on a flawed or irrelevant reasoning trace. This behavior, a direct consequence of training objectives that solely reward final-answer correctness, severely undermines the trustworthiness of these models in high-stakes domains. This paper introduces \textbf{Counterfactual Sensitivity Regularization (CSR)}, a novel training objective designed to forge a strong, causal-like dependence between a model's output and its intermediate reasoning steps. During training, CSR performs automated, operator-level interventions on the generated reasoning trace (e.g., swapping ``+''with ``-'') to create a minimally-perturbed counterfactual. A regularization term then penalizes the model if this logically flawed trace still yields the original answer. Our efficient implementation adds only 8.7\% training overhead through warm-start curriculum and token-subset optimization. We evaluate faithfulness using \textbf{Counterfactual Outcome Sensitivity (COS)}, a metric quantifying how sensitive the final answer is to such logical perturbations. Across diverse structured reasoning benchmarks -- arithmetic (GSM8K), logical deduction (ProofWriter), multi-hop QA (HotpotQA), and code generation (MBPP) -- models trained with CSR demonstrate a vastly superior trade-off between accuracy and faithfulness. CSR improves faithfulness over standard fine-tuning and process supervision by up to 70 percentage points, with this learned sensitivity generalizing to larger models and enhancing the performance of inference-time techniques like self-consistency.",arXiv.org,2,White-box,General,该论文明确研究 CoT 的忠实性问题，提出了一种新的训练目标 CSR，通过反事实干预来增强模型输出与中间推理步骤之间的因果依赖关系。论文还提出了衡量忠实性的指标 COS，并验证了 CSR 在多个结构化推理任务上的有效性，显著提高了忠实性。
Neuro-symbolic Natural Logic with Introspective Revision for Natural Language Inference,2022,True,True,False,"Training & Fine-tuning, Verification & External Tools",论文涉及CoT和忠实性，通过强化学习和外部知识改进推理路径，减少虚假推理。,"We introduce a neuro-symbolic natural logic framework based on reinforcement learning with introspective revision. The model samples and rewards specific reasoning paths through policy gradient, in which the introspective revision algorithm modifies intermediate symbolic reasoning steps to discover reward-earning operations as well as leverages external knowledge to alleviate spurious reasoning and training inefficiency. The framework is supported by properly designed local relation models to avoid input entangling, which helps ensure the interpretability of the proof paths. The proposed model has built-in interpretability and shows superior capability in monotonicity inference, systematic generalization, and interpretability, compared with previous models on the existing datasets.",Transactions of the Association for Computational Linguistics,1,White-box,Logic,该论文提出了一个基于强化学习的神经符号自然逻辑框架，通过内省修正算法修改中间符号推理步骤，并利用外部知识来减少虚假推理。虽然论文强调了推理路径的可解释性，但并未明确研究 CoT 是否是模型预测的真实原因（Causal role），因此属于边缘相关。
Faithful Knowledge Graph Explanations in Commonsense Question Answering,2022,True,True,True,"Training & Fine-tuning, Interpretability & Internal Mechanisms",论文探讨了知识图谱解释的不忠实性，并提出了新的度量方法和改进架构。,"Knowledge graphs are commonly used as sources of information in commonsense question answering, and can also be used to express explanations for the model’s answer choice. A common way of incorporating facts from the graph is to encode them separately from the question, and then combine the two representations to select an answer. In this paper, we argue that highly faithful graph-based explanations cannot be extracted from existing models of this type. Such explanations will not include reasoning done by the transformer encoding the question, so will be incomplete. We confirm this theory with a novel proxy measure for faithfulness and propose two architecture changes to address the problem. Our findings suggest a path forward for developing architectures for faithful graph-based explanations.",Conference on Empirical Methods in Natural Language Processing,2,White-box,Society,该论文明确研究知识图谱解释的忠实度（Faithfulness），提出了一种新的代理测量方法，并分析了现有模型无法生成高度忠实解释的原因，符合核心定义。
Causal Abstraction for Chain-of-Thought Reasoning in Arithmetic Word Problems,2023,True,True,True,Interpretability & Internal Mechanisms,论文探讨了CoT在算术问题中的因果影响，揭示了LLMs使用CoT进行推理的现象，并提出了因果抽象评估方法。,"Recent work suggests that large language models (LLMs) achieve higher accuracy on multi-step reasoning tasks when prompted to generate intermediate reasoning steps, or a chain of thought (CoT), before their final answer. However, it is unclear how exactly CoTs improve LLMs’ accuracy, and in particular, if LLMs use their CoTs to reason to their final answers. This paper tries to answer this question with respect to arithmetic word problems, by (i) evaluating the correctness of LLMs’ CoTs, and (ii) using causal abstraction to assess if the intermediate tokens produced as part of a CoT causally impact LLMs’ final answers, in line with the reasoning described by the CoT. We find that for CoT-prompted LLMs, correct answers to arithmetic problems are highly correlated with correct CoTs, and that when LLMs produce correct CoTs, they realize to a fairly large extent the causal models suggested by their CoTs. Higher degrees of realization also seem associated with better overall accuracy on the arithmetic problems. These findings suggest that some CoT-prompted LLMs may do better on multi-step arithmetic reasoning at least partly because they use their CoTs to reason to their final answers. However, for some LLMs, other internal processes may also be involved.",BlackboxNLP Workshop on Analyzing and Interpreting Neural Networks for NLP,2,White-box,Math,该论文明确研究 CoT 是否因果影响模型的最终答案（通过因果抽象方法评估），直接关联 Faithfulness 的核心定义。研究领域为数学（算术应用题），且涉及模型内部机制分析（白盒）。
Obtaining Faithful Interpretations from Compositional Neural Networks,2020,True,True,False,Training & Fine-tuning,论文揭示了NMNs中间输出与预期不符的不忠实现象，并提出了通过辅助监督训练改进的方法。,"Neural module networks (NMNs) are a popular approach for modeling compositionality: they achieve high accuracy when applied to problems in language and vision, while reflecting the compositional structure of the problem in the network architecture. However, prior work implicitly assumed that the structure of the network modules, describing the abstract reasoning process, provides a faithful explanation of the model’s reasoning; that is, that all modules perform their intended behaviour. In this work, we propose and conduct a systematic evaluation of the intermediate outputs of NMNs on NLVR2 and DROP, two datasets which require composing multiple reasoning steps. We find that the intermediate outputs differ from the expected output, illustrating that the network structure does not provide a faithful explanation of model behaviour. To remedy that, we train the model with auxiliary supervision and propose particular choices for module architecture that yield much better faithfulness, at a minimal cost to accuracy.",Annual Meeting of the Association for Computational Linguistics,2,White-box,General,该论文明确研究了神经网络模块（NMN）的中间输出是否忠实反映了模型的推理过程，发现模块结构与实际行为不一致，并通过辅助监督和模块架构改进提升忠实度。这直接符合Faithfulness的核心定义，尤其是关于解释是否真实反映模型计算过程的研究。
On the Faithfulness of Visual Thinking: Measurement and Enhancement,2025,True,True,True,Training & Fine-tuning,论文揭示了视觉信息在MCoT中的不忠实现象，并提出了新的度量方法和改进策略。,"Recent large vision-language models (LVLMs) can generate vision-text multimodal chain-of-thought (MCoT) traces after reinforcement fine-tuning (RFT). However, we observe that the visual information incorporated in MCoT is often inaccurate, though still yield correct answers, indicating a lack of faithfulness in the MCoT reasoning process. We attribute this unfaithfulness to the RL reward in RFT, which solely incentivizes the format of interleaved vision-text cues, ie, it encourages the model to incorporate visual information into its text reasoning steps without considering the correctness of the visual information. In this paper, we first probe the faithfulness of MCoT by measuring how much the prediction changes when its visual and textual thoughts are intervened. Surprisingly, the model's predictions remain nearly unchanged under visual intervention but change significantly under textual intervention, indicating that the visual evidence is largely ignored. To further analyze visual information, we introduce an automated LVLM-based evaluation metric that quantifies the faithfulness of visual cues from two perspectives: reliability and sufficiency. Our evaluation reveals that the visual information in current MCoT traces is simultaneously unreliable and insufficient. To address this issue, we propose a novel MCoT learning strategy termed Sufficient-Component Cause Model (SCCM) learning. This approach encourages the MCoT to generate sufficient yet minimal visual components that are independently capable of leading to correct answers. We note that the proposed SCCM is annotation-free and compatible with various RFT for MCoT in a plug-and-play manner. Empirical results demonstrate that SCCM consistently improves the visual faithfulness across a suite of fine-grained perception and reasoning benchmarks. Code is available at https://github.com/EugeneLiu01/Faithful_Thinking_with_Image.",arXiv.org,2,White-box,General,该论文明确研究了视觉-文本多模态链式思考（MCoT）的忠实度问题，通过干预实验（视觉和文本干预）揭示了视觉信息在推理过程中被忽视的现象，并提出了量化视觉线索忠实度的指标（可靠性和充分性）。此外，论文还提出了一种新的学习策略（SCCM）来增强视觉忠实度，这直接符合Faithfulness的核心定义。
The Reasoning-Memorization Interplay in Language Models Is Mediated by a Single Direction,2025,True,True,False,Interpretability & Internal Mechanisms,论文揭示了LLMs在推理和记忆之间的动态切换现象，并提出了通过干预内部机制来提升推理忠实性的方法。,"Large language models (LLMs) excel on a variety of reasoning benchmarks, but previous studies suggest they sometimes struggle to generalize to unseen questions, potentially due to over-reliance on memorized training examples. However, the precise conditions under which LLMs switch between reasoning and memorization during text generation remain unclear. In this work, we provide a mechanistic understanding of LLMs' reasoning-memorization dynamics by identifying a set of linear features in the model's residual stream that govern the balance between genuine reasoning and memory recall. These features not only distinguish reasoning tasks from memory-intensive ones but can also be manipulated to causally influence model performance on reasoning tasks. Additionally, we show that intervening in these reasoning features helps the model more accurately activate the most relevant problem-solving capabilities during answer generation. Our findings offer new insights into the underlying mechanisms of reasoning and memory in LLMs and pave the way for the development of more robust and interpretable generative AI systems.",arXiv.org,2,White-box,General,该论文明确研究了语言模型在推理和记忆之间的动态平衡，通过识别模型残差流中的线性特征来控制真正的推理和记忆回忆之间的平衡。这些特征不仅可以区分推理任务和记忆密集型任务，还可以被操纵以因果性地影响模型在推理任务上的表现。这与Faithfulness的核心定义高度相关，因为它探讨了模型生成解释（CoT/Reasoning Trace）是否真实反映了模型做出最终预测的实际计算过程。
Measuring Chain of Thought Faithfulness by Unlearning Reasoning Steps,2025,True,False,True,Interpretability & Internal Mechanisms,论文提出了FUR框架，通过消除推理步骤中的信息来测量忠实性，揭示了不忠实现象并提出了新的度量方法。,"When prompted to think step-by-step, language models (LMs) produce a chain of thought (CoT), a sequence of reasoning steps that the model supposedly used to produce its prediction. Despite much work on CoT prompting, it is unclear if reasoning verbalized in a CoT is faithful to the models'parametric beliefs. We introduce a framework for measuring parametric faithfulness of generated reasoning, and propose Faithfulness by Unlearning Reasoning steps (FUR), an instance of this framework. FUR erases information contained in reasoning steps from model parameters, and measures faithfulness as the resulting effect on the model's prediction. Our experiments with four LMs and five multi-hop multi-choice question answering (MCQA) datasets show that FUR is frequently able to precisely change the underlying models'prediction for a given instance by unlearning key steps, indicating when a CoT is parametrically faithful. Further analysis shows that CoTs generated by models post-unlearning support different answers, hinting at a deeper effect of unlearning.",,2,White-box,General,该论文明确研究 CoT 的忠实度，提出了一个框架（FUR）来测量生成的推理步骤是否忠实于模型的参数信念。通过从模型参数中擦除推理步骤的信息，并测量对模型预测的影响，来评估忠实度。这直接符合 Faithfulness 的核心定义，即研究 CoT 是否是模型预测的真实原因。
