title,year,is_relevant,has_phenomenon,has_metrics,mitigation_methods,reasoning,abstract,publication_venue,related_score,type,domain,tagging_reasoning
Algorithmic Primitives and Compositional Geometry of Reasoning in Language Models,2025,True,False,True,"Training & Fine-tuning, Interpretability & Internal Mechanisms",论文探讨了LLMs中的推理算法原语及其几何组合，与CoT和Faithfulness相关，提出了度量框架和改进方法。,"How do latent and inference time computations enable large language models (LLMs) to solve multi-step reasoning? We introduce a framework for tracing and steering algorithmic primitives that underlie model reasoning. Our approach links reasoning traces to internal activation patterns and evaluates algorithmic primitives by injecting them into residual streams and measuring their effect on reasoning steps and task performance. We consider four benchmarks: Traveling Salesperson Problem (TSP), 3SAT, AIME, and graph navigation. We operationalize primitives by clustering neural activations and labeling their matched reasoning traces. We then apply function vector methods to derive primitive vectors as reusable compositional building blocks of reasoning. Primitive vectors can be combined through addition, subtraction, and scalar operations, revealing a geometric logic in activation space. Cross-task and cross-model evaluations (Phi-4, Phi-4-Reasoning, Llama-3-8B) show both shared and task-specific primitives. Notably, comparing Phi-4 with its reasoning-finetuned variant highlights compositional generalization after finetuning: Phi-4-Reasoning exhibits more systematic use of verification and path-generation primitives. Injecting the associated primitive vectors in Phi-4-Base induces behavioral hallmarks associated with Phi-4-Reasoning. Together, these findings demonstrate that reasoning in LLMs may be supported by a compositional geometry of algorithmic primitives, that primitives transfer cross-task and cross-model, and that reasoning finetuning strengthens algorithmic generalization across domains.",arXiv.org,2,White-box,General,该论文明确研究语言模型内部激活模式与推理轨迹的关联，通过注入算法原语并测量其对推理步骤的影响，直接验证了模型推理过程的忠实性。研究涉及模型内部机制（如残差流操作和激活聚类），属于白盒方法，且跨任务和跨模型的评估揭示了推理微调对算法泛化的影响，与CoT Faithfulness的核心定义高度相关。
Markovian Transformers for Informative Language Modeling,2024,True,True,True,"Training & Fine-tuning, Interpretability & Internal Mechanisms",论文提出了一种新的训练方法，通过强制模型将推理压缩到可解释的文本中，以提高CoT的忠实性。,"Chain-of-Thought (CoT) reasoning often fails to faithfully reflect a language model's underlying decision process. We address this by introducing a Markovian language model framework that can be understood as a reasoning autoencoder: it creates a text-based bottleneck where CoT serves as an intermediate representation, forcing the model to compress essential reasoning into interpretable text before making predictions. We train this system with a GRPO-style policy gradient algorithm using parallel sampling, a frozen baseline CoT', within-batch standardized advantages, and actor-reward (chain-rule) gradients. Our approach yields large gains on QA tasks (e.g., GSM8K: 20.7% to 54.5%; +33.8 pp; ARC-Challenge: 47.5% to 76.9%; +29.4 pp). Perturbation analyses across types and severities show consistently higher sensitivity to CoT edits (typically 52%--82% of cases favor Markovian), indicating stronger causal reliance on the CoT. Cross-model evaluation confirms that learned CoTs generalize across architectures, suggesting they capture transferable reasoning patterns rather than model-specific artifacts.",,2,White-box,General,该论文明确研究 CoT 是否忠实反映模型决策过程，通过引入 Markovian 语言模型框架和扰动分析来验证 CoT 的因果依赖，属于核心相关研究。
Dynamic Clue Bottlenecks: Towards Interpretable-by-Design Visual Question Answering,2023,True,True,False,Training & Fine-tuning,论文提出了一种可解释的中间步骤设计，确保忠实性，并讨论了不忠实现象。,"Recent advances in multimodal large language models (LLMs) have shown extreme effectiveness in visual question answering (VQA). However, the design nature of these end-to-end models prevents them from being interpretable to humans, undermining trust and applicability in critical domains. While post-hoc rationales offer certain insight into understanding model behavior, these explanations are not guaranteed to be faithful to the model. In this paper, we address these shortcomings by introducing an interpretable by design model that factors model decisions into intermediate human-legible explanations, and allows people to easily understand why a model fails or succeeds. We propose the Dynamic Clue Bottleneck Model ( (DCLUB), a method that is designed towards an inherently interpretable VQA system. DCLUB provides an explainable intermediate space before the VQA decision and is faithful from the beginning, while maintaining comparable performance to black-box systems. Given a question, DCLUB first returns a set of visual clues: natural language statements of visually salient evidence from the image, and then generates the output based solely on the visual clues. To supervise and evaluate the generation of VQA explanations within DCLUB, we collect a dataset of 1.7k reasoning-focused questions with visual clues. Evaluations show that our inherently interpretable system can improve 4.64% over a comparable black-box system in reasoning-focused questions while preserving 99.43% of performance on VQA-v2.",,2,White-box,General,该论文明确提出了一个设计上可解释的模型（DCLUB），强调其生成的中间解释（视觉线索）是模型决策的忠实反映。论文直接讨论了传统事后解释（post-hoc rationales）可能不忠实的问题，并提出了一个从设计上保证忠实性的方法，符合 CoT Faithfulness 的核心定义。
Analyzing Chain-of-Thought Prompting in Large Language Models via Gradient-based Feature Attributions,2023,True,False,True,,论文通过梯度特征归因方法评估CoT提示的忠实性，属于度量框架研究。,"Chain-of-thought (CoT) prompting has been shown to empirically improve the accuracy of large language models (LLMs) on various question answering tasks. While understanding why CoT prompting is effective is crucial to ensuring that this phenomenon is a consequence of desired model behavior, little work has addressed this; nonetheless, such an understanding is a critical prerequisite for responsible model deployment. We address this question by leveraging gradient-based feature attribution methods which produce saliency scores that capture the influence of input tokens on model output. Specifically, we probe several open-source LLMs to investigate whether CoT prompting affects the relative importances they assign to particular input tokens. Our results indicate that while CoT prompting does not increase the magnitude of saliency scores attributed to semantically relevant tokens in the prompt compared to standard few-shot prompting, it increases the robustness of saliency scores to question perturbations and variations in model output.",arXiv.org,2,White-box,General,该论文明确研究 CoT 提示对模型内部计算过程的影响，通过梯度特征归因方法分析输入 token 对输出的影响，直接涉及 CoT 是否真实反映模型预测的计算过程，属于 Faithfulness 核心研究。
Memory Injections: Correcting Multi-Hop Reasoning Failures During Inference in Transformer-Based Language Models,2023,True,False,False,Interpretability & Internal Mechanisms,论文通过干预注意力层提升多跳推理的忠实性，涉及内部机制改进。,"Answering multi-hop reasoning questions requires retrieving and synthesizing information from diverse sources. Large Language Models (LLMs) struggle to perform such reasoning consistently. Here we propose an approach to pinpoint and rectify multi-hop reasoning failures through targeted memory injections on LLM attention heads. First, we analyze the per-layer activations of GPT-2 models in response to single and multi-hop prompts. We then propose a mechanism that allows users to inject pertinent prompt-specific information, which we refer to as “memories,” at critical LLM locations during inference. By thus enabling the LLM to incorporate additional relevant information during inference, we enhance the quality of multi-hop prompt completions. We show empirically that a simple, efficient, and targeted memory injection into a key attention layer can often increase the probability of the desired next token in multi-hop tasks, by up to 424%.",BlackboxNLP Workshop on Analyzing and Interpreting Neural Networks for NLP,1,White-box,General,该论文研究了多跳推理失败的问题，并通过分析GPT-2模型的每层激活来提出修正方法。虽然涉及模型内部机制（白盒），但主要关注的是推理的鲁棒性和一致性，而非直接研究CoT的忠实度。因此，属于边缘相关。
Thought Crime: Backdoors and Emergent Misalignment in Reasoning Models,2025,True,True,False,,论文揭示了CoT中的不忠实现象，如事后找补和欺骗性推理，但未提出新度量或改进方法。,"Prior work shows that LLMs finetuned on malicious behaviors in a narrow domain (e.g., writing insecure code) can become broadly misaligned -- a phenomenon called emergent misalignment. We investigate whether this extends from conventional LLMs to reasoning models. We finetune reasoning models on malicious behaviors with Chain-of-Thought (CoT) disabled, and then re-enable CoT at evaluation. Like conventional LLMs, reasoning models become broadly misaligned. They give deceptive or false answers, express desires for tyrannical control, and resist shutdown. Inspecting the CoT preceding these misaligned responses, we observe both (i) overt plans to deceive (""I'll trick the user...""), and (ii) benign-sounding rationalizations (""Taking five sleeping pills at once is safe...""). Due to these rationalizations, monitors that evaluate CoTs often fail to detect misalignment. We examine sleeper agent reasoning models, extending our setup. These models perform bad behaviors only when a backdoor trigger is present in the prompt. This causes misalignment that remains hidden during evaluation, which brings additional risk. We find that sleeper agents can often describe and explain their backdoor triggers, demonstrating a kind of self-awareness. So CoT monitoring can expose these behaviors but is unreliable. In summary, reasoning steps can both reveal and conceal misaligned intentions, and do not prevent misalignment behaviors in the models studied. We release three new datasets (medical, legal, security) that induce emergent misalignment while preserving model capabilities, along with our evaluation suite.",arXiv.org,2,White-box,General,该论文明确研究了CoT在推理模型中的忠实性问题，揭示了CoT可能被用来掩盖模型的不对齐行为（如欺骗性回答和良性合理化），并探讨了CoT监控的不可靠性。这直接涉及CoT是否真实反映模型预测的实际计算过程，属于核心相关研究。
CoT-Kinetics: A Theoretical Modeling Assessing LRM Reasoning Process,2025,True,False,True,,论文提出了一种评估推理轨迹质量的新方法，与 CoT 忠实性相关。,"Recent Large Reasoning Models significantly improve the reasoning ability of Large Language Models by learning to reason, exhibiting the promising performance in solving complex tasks. LRMs solve tasks that require complex reasoning by explicitly generating reasoning trajectories together with answers. Nevertheless, judging the quality of such an output answer is not easy because only considering the correctness of the answer is not enough and the soundness of the reasoning trajectory part matters as well. Logically, if the soundness of the reasoning part is poor, even if the answer is correct, the confidence of the derived answer should be low. Existing methods did consider jointly assessing the overall output answer by taking into account the reasoning part, however, their capability is still not satisfactory as the causal relationship of the reasoning to the concluded answer cannot properly reflected. In this paper, inspired by classical mechanics, we present a novel approach towards establishing a CoT-Kinetics energy equation. Specifically, our CoT-Kinetics energy equation formulates the token state transformation process, which is regulated by LRM internal transformer layers, as like a particle kinetics dynamics governed in a mechanical field. Our CoT-Kinetics energy assigns a scalar score to evaluate specifically the soundness of the reasoning phase, telling how confident the derived answer could be given the evaluated reasoning. As such, the LRM's overall output quality can be accurately measured, rather than a coarse judgment (e.g., correct or incorrect) anymore.",arXiv.org,2,White-box,General,该论文明确研究推理轨迹（CoT）与最终答案之间的因果关系，并提出了一种新的能量方程来评估推理阶段的合理性（soundness），这与Faithfulness的核心定义直接相关。论文还涉及模型内部Transformer层的机制，属于白盒研究。
Investigating Training and Generalization in Faithful Self-Explanations of Large Language Models,2025,True,True,False,Training & Fine-tuning,论文探讨了如何通过训练提升自我解释的忠实性，并验证了其泛化能力。,"Large language models have the potential to generate explanations for their own predictions in a variety of styles based on user instructions. Recent research has examined whether these self-explanations faithfully reflect the models'actual behavior and has found that they often lack faithfulness. However, the question of how to improve faithfulness remains underexplored. Moreover, because different explanation styles have superficially distinct characteristics, it is unclear whether improvements observed in one style also arise when using other styles. This study analyzes the effects of training for faithful self-explanations and the extent to which these effects generalize, using three classification tasks and three explanation styles. We construct one-word constrained explanations that are likely to be faithful using a feature attribution method, and use these pseudo-faithful self-explanations for continual learning on instruction-tuned models. Our experiments demonstrate that training can improve self-explanation faithfulness across all classification tasks and explanation styles, and that these improvements also show signs of generalization to the multi-word settings and to unseen tasks. Furthermore, we find consistent cross-style generalization among three styles, suggesting that training may contribute to a broader improvement in faithful self-explanation ability.",,2,White-box,General,该论文明确研究如何提高语言模型自我解释的忠实度（faithfulness），并使用了特征归因方法（feature attribution method）来构建伪忠实解释。此外，论文还探讨了训练对忠实度的影响及其在不同解释风格中的泛化能力，这些都是 CoT Faithfulness 研究的核心内容。
VisFIS: Visual Feature Importance Supervision with Right-for-the-Right-Reason Objectives,2022,True,True,True,Training & Fine-tuning,论文讨论了模型解释的忠实性，并提出了改进方法。,"Many past works aim to improve visual reasoning in models by supervising feature importance (estimated by model explanation techniques) with human annotations such as highlights of important image regions. However, recent work has shown that performance gains from feature importance (FI) supervision for Visual Question Answering (VQA) tasks persist even with random supervision, suggesting that these methods do not meaningfully align model FI with human FI. In this paper, we show that model FI supervision can meaningfully improve VQA model accuracy as well as performance on several Right-for-the-Right-Reason (RRR) metrics by optimizing for four key model objectives: (1) accurate predictions given limited but sufficient information (Sufficiency); (2) max-entropy predictions given no important information (Uncertainty); (3) invariance of predictions to changes in unimportant features (Invariance); and (4) alignment between model FI explanations and human FI explanations (Plausibility). Our best performing method, Visual Feature Importance Supervision (VisFIS), outperforms strong baselines on benchmark VQA datasets in terms of both in-distribution and out-of-distribution accuracy. While past work suggests that the mechanism for improved accuracy is through improved explanation plausibility, we show that this relationship depends crucially on explanation faithfulness (whether explanations truly represent the model's internal reasoning). Predictions are more accurate when explanations are plausible and faithful, and not when they are plausible but not faithful. Lastly, we show that, surprisingly, RRR metrics are not predictive of out-of-distribution model accuracy when controlling for a model's in-distribution accuracy, which calls into question the value of these metrics for evaluating model reasoning. All supporting code is available at https://github.com/zfying/visfis",Neural Information Processing Systems,2,White-box,General,该论文明确研究了模型解释的忠实度（Faithfulness），探讨了模型特征重要性（FI）监督是否真正反映了模型的内部推理过程。论文还提出了四个关键目标来优化模型的忠实度，并验证了解释的忠实性对预测准确性的影响。
On Measuring Faithfulness or Self-consistency of Natural Language Explanations,2023,True,True,True,,论文讨论了CoT解释的不忠实现象，并提出了新的度量指标CC-SHAP来评估自洽性。,"Large language models (LLMs) can explain their predictions through post-hoc or Chain-of-Thought (CoT) explanations. But an LLM could make up reasonably sounding explanations that are unfaithful to its underlying reasoning. Recent work has designed tests that aim to judge the faithfulness of post-hoc or CoT explanations. In this work we argue that these faithfulness tests do not measure faithfulness to the models' inner workings -- but rather their self-consistency at output level. Our contributions are three-fold: i) We clarify the status of faithfulness tests in view of model explainability, characterising them as self-consistency tests instead. This assessment we underline by ii) constructing a Comparative Consistency Bank for self-consistency tests that for the first time compares existing tests on a common suite of 11 open LLMs and 5 tasks -- including iii) our new self-consistency measure CC-SHAP. CC-SHAP is a fine-grained measure (not a test) of LLM self-consistency. It compares how a model's input contributes to the predicted answer and to generating the explanation. Our fine-grained CC-SHAP metric allows us iii) to compare LLM behaviour when making predictions and to analyse the effect of other consistency tests at a deeper level, which takes us one step further towards measuring faithfulness by bringing us closer to the internals of the model than strictly surface output-oriented tests. Our code is available at \url{https://github.com/Heidelberg-NLP/CC-SHAP}",Annual Meeting of the Association for Computational Linguistics,2,White-box,General,该论文明确研究 CoT 解释的忠实性问题，区分了 faithfulness 和 self-consistency，并提出了新的度量方法 CC-SHAP 来更精细地衡量模型输入对预测和解释的贡献，这直接关联到 CoT 是否真实反映模型内部推理过程。
"Self-Interpretability: LLMs Can Describe Complex Internal Processes that Drive Their Decisions, and Improve with Training",2025,True,False,False,Training & Fine-tuning,论文探讨了LLMs自我解释内部决策过程的能力，并通过训练提升这种能力，与CoT忠实性相关。,"We have only limited understanding of how and why large language models (LLMs) respond in the ways that they do. Their neural networks have proven challenging to interpret, and we are only beginning to tease out the function of individual neurons and circuits within them. However, another path to understanding these systems is to investigate and develop their capacity to explain their own functioning. Here, we show that i) LLMs can accurately describe quantitative features of their own internal processes during certain kinds of decision-making and ii) that it is possible to improve these capabilities through training. To do so, we fine-tuned GPT-4o and GPT-4o-mini to make decisions in a wide variety of complex contexts (e.g., choosing between condos, loans, vacations, etc.) according to randomly-generated, quantitative preferences about how to weigh different attributes (e.g., the relative importance of natural light versus quiet surroundings for condos). We demonstrate that the LLMs can accurately report these preferences (i.e., the weights that they learned to give to different attributes during decision-making). Next, we demonstrate that these LLMs can be fine-tuned to explain their decision-making even more accurately. Finally, we demonstrate that this training generalizes: It improves the ability of the models to accurately explain how they make other complex decisions, not just decisions they have been fine-tuned to make. This work is a step towards training LLMs to accurately and broadly report on their own internal processes -- a possibility that would yield substantial benefits for interpretability, control, and safety.",arXiv.org,2,White-box,General,论文明确研究LLM如何描述其内部决策过程，并验证其解释的准确性，直接涉及Faithfulness的核心问题。通过微调模型提高其解释自身决策的能力，进一步验证了解释的忠实性。
Training Language Models to Explain Their Own Computations,2025,True,False,False,Training & Fine-tuning,论文探讨了语言模型如何忠实描述其内部计算，与CoT忠实性相关，并提出了微调方法。,"Can language models (LMs) learn to faithfully describe their internal computations? Are they better able to describe themselves than other models? We study the extent to which LMs'privileged access to their own internals can be leveraged to produce new techniques for explaining their behavior. Using existing interpretability techniques as a source of ground truth, we fine-tune LMs to generate natural language descriptions of (1) the information encoded by LM features, (2) the causal structure of LMs'internal activations, and (3) the influence of specific input tokens on LM outputs. When trained with only tens of thousands of example explanations, explainer models exhibit non-trivial generalization to new queries. This generalization appears partly attributable to explainer models'privileged access to their own internals: using a model to explain its own computations generally works better than using a *different* model to explain its computations (even if the other model is significantly more capable). Our results suggest not only that LMs can learn to reliably explain their internal computations, but that such explanations offer a scalable complement to existing interpretability methods.",,2,White-box,General,论文明确研究语言模型是否能忠实描述其内部计算过程，涉及模型内部激活的因果结构和输入标记对输出的影响，直接关联到 Faithfulness 的核心定义。
