title,year,is_relevant,has_phenomenon,has_metrics,mitigation_methods,reasoning,abstract,publication_venue,related_score,type,domain,tagging_reasoning
Effectively Controlling Reasoning Models through Thinking Intervention,2025,True,False,False,Interpretability & Internal Mechanisms,论文提出通过干预内部推理过程来增强模型行为控制，与CoT忠实性相关。,"Reasoning-enhanced large language models (LLMs) explicitly generate intermediate reasoning steps prior to generating final answers, helping the model excel in complex problem-solving. In this paper, we demonstrate that this emerging generation framework offers a unique opportunity for more fine-grained control over model behavior. We propose Thinking Intervention, a novel paradigm designed to explicitly guide the internal reasoning processes of LLMs by strategically inserting or revising specific thinking tokens. We find that the Thinking Intervention paradigm enhances the capabilities of reasoning models across a wide range of tasks, including instruction following on IFEval and Overthinking, instruction hierarchy on SEP, and safety alignment on XSTest and SorryBench. Our results demonstrate that Thinking Intervention significantly outperforms baseline prompting approaches, achieving up to 6.7% accuracy gains in instruction-following scenarios, 15.4% improvements in reasoning about instruction hierarchies, and a 40.0% increase in refusal rates for unsafe prompts using open-source DeepSeek R1 models. Overall, our work opens a promising new research avenue for controlling reasoning LLMs.",arXiv.org,1,White-box,General,该论文提出了Thinking Intervention方法，通过干预内部推理过程来控制模型行为，虽然未直接研究CoT的忠实度，但涉及了推理过程的内部机制，属于边缘相关。
The Geometry of Self-Verification in a Task-Specific Reasoning Model,2025,True,False,False,Interpretability & Internal Mechanisms,论文研究了模型如何自我验证其推理过程，涉及CoT的忠实性，并提出了白盒干预方法。,"How do reasoning models verify their own answers? We study this question by training a model using DeepSeek R1's recipe on the CountDown task. We leverage the fact that preference tuning leads to mode collapse, yielding a model that always produces highly structured chain-of-thought sequences. With this setup, we do top-down and bottom-up analyses to reverse-engineer how the model verifies its outputs. Top-down, we find Gated Linear Unit (GLU) weights encoding verification-related tokens, such as ``success'' or ``incorrect''. Bottom-up, we find that ``previous-token heads'' are mainly responsible for self-verification in our setup. Our analyses meet in the middle: drawing inspiration from inter-layer communication channels, we use the identified GLU weights to localize as few as three attention heads that can disable self-verification, pointing to a necessary component of a potentially larger verification circuit. Finally, we verify that similar verification components exist in our base model and a general reasoning DeepSeek-R1 model.",arXiv.org,2,White-box,Logic,该论文明确研究了模型如何验证自己的答案，通过分析模型内部机制（如GLU权重和注意力头）来理解自我验证过程，这与CoT Faithfulness的核心定义直接相关，即研究解释是否真实反映了模型的实际计算过程。
Towards Faithful Natural Language Explanations: A Study Using Activation Patching in Large Language Models,2024,True,True,True,Interpretability & Internal Mechanisms,论文提出使用激活修补技术测量解释的忠实性，并提出了新的度量标准。,"Large Language Models (LLMs) are capable of generating persuasive Natural Language Explanations (NLEs) to justify their answers. However, the faithfulness of these explanations should not be readily trusted at face value. Recent studies have proposed various methods to measure the faithfulness of NLEs, typically by inserting perturbations at the explanation or feature level. We argue that these approaches are neither comprehensive nor correctly designed according to the established definition of faithfulness. Moreover, we highlight the risks of grounding faithfulness findings on out-of-distribution samples. In this work, we leverage a causal mediation technique called activation patching, to measure the faithfulness of an explanation towards supporting the explained answer. Our proposed metric, Causal Faithfulness quantifies the consistency of causal attributions between explanations and the corresponding model outputs as the indicator of faithfulness. We experimented across models varying from 2B to 27B parameters and found that models that underwent alignment tuning tend to produce more faithful and plausible explanations. We find that Causal Faithfulness is a promising improvement over existing faithfulness tests by taking into account the model's internal computations and avoiding out of distribution concerns that could otherwise undermine the validity of faithfulness assessments. We release the code in \url{https://github.com/wj210/Causal-Faithfulness}",,2,White-box,General,该论文明确研究了解释的忠实性（Faithfulness），提出了一种新的度量方法 Causal Faithfulness，利用激活修补（activation patching）技术来测量解释与模型内部计算的一致性。这符合核心相关性的定义，且采用了白盒方法分析模型内部机制。
A Causal Lens for Evaluating Faithfulness Metrics,2025,True,True,True,,论文提出了评估忠实性指标的因果框架，并讨论了不忠实现象和度量方法。,"Large Language Models (LLMs) offer natural language explanations as an alternative to feature attribution methods for model interpretability. However, despite their plausibility, they may not reflect the model's true reasoning faithfully, which is crucial for understanding the model's true decision-making processes. Although several faithfulness metrics have been proposed, they are often evaluated in isolation, making direct, principled comparisons between them difficult. Here, we present Causal Diagnosticity, a framework that serves as a common testbed to evaluate faithfulness metrics for natural language explanations. Our framework employs the concept of diagnosticity, and uses model-editing methods to generate faithful-unfaithful explanation pairs. Our benchmark includes four tasks: fact-checking, analogy, object counting, and multi-hop reasoning. We evaluate prominent faithfulness metrics, including post-hoc explanation and chain-of-thought-based methods. We find that diagnostic performance varies across tasks and models, with Filler Tokens performing best overall. Additionally, continuous metrics are generally more diagnostic than binary ones but can be sensitive to noise and model choice. Our results highlight the need for more robust faithfulness metrics.",,2,White-box,General,该论文明确研究自然语言解释（包括CoT）的忠实性，提出了一个评估忠实性指标的因果框架，并生成了忠实与非忠实解释对。此外，论文还评估了包括基于CoT的方法在内的多种忠实性指标，直接涉及CoT Faithfulness的核心研究范畴。
Making Reasoning Matter: Measuring and Improving Faithfulness of Chain-of-Thought Reasoning,2024,True,True,True,"Training & Fine-tuning, Verification & External Tools",论文揭示了LLMs在生成答案时不忠实于中间推理步骤的现象，并提出了FRODO框架来改进忠实性。,"Large language models (LLMs) have been shown to perform better when asked to reason step-by-step before answering a question. However, it is unclear to what degree the model's final answer is faithful to the stated reasoning steps. In this paper, we perform a causal mediation analysis on twelve LLMs to examine how intermediate reasoning steps generated by the LLM influence the final outcome and find that LLMs do not reliably use their intermediate reasoning steps when generating an answer. To address this issue, we introduce FRODO, a framework to tailor small-sized LMs to generate correct reasoning steps and robustly reason over these steps. FRODO consists of an inference module that learns to generate correct reasoning steps using an implicit causal reward function and a reasoning module that learns to faithfully reason over these intermediate inferences using a counterfactual and causal preference objective. Our experiments show that FRODO significantly outperforms four competitive baselines. Furthermore, FRODO improves the robustness and generalization ability of the reasoning LM, yielding higher performance on out-of-distribution test sets. Finally, we find that FRODO's rationales are more faithful to its final answer predictions than standard supervised fine-tuning.",Conference on Empirical Methods in Natural Language Processing,2,White-box,General,该论文明确研究了CoT的忠实度问题，通过因果中介分析验证了LLM是否可靠地使用中间推理步骤来生成最终答案，并提出了FRODO框架以提高推理的忠实度。这直接符合Faithfulness的核心定义，即模型生成的解释是否真实反映了其预测的实际计算过程。
Focus on Your Question! Interpreting and Mitigating Toxic CoT Problems in Commonsense Reasoning,2024,True,True,True,"Training & Fine-tuning, Interpretability & Internal Mechanisms",论文揭示了CoT中的不忠实现象（Toxic CoT问题），并提出了基于内部机制探测的改进方法。,"Large language models exhibit high-level commonsense reasoning abilities, especially with enhancement methods like Chain-of-Thought (CoT). However, we find these CoT-like methods lead to a considerable number of originally correct answers turning wrong, which we define as the Toxic CoT problem. To interpret and mitigate this problem, we first utilize attribution tracing and causal tracing methods to probe the internal working mechanism of the LLM during CoT reasoning. Through comparisons, we prove that the model exhibits information loss from the question over the shallow attention layers when generating rationales or answers. Based on the probing findings, we design a novel method called RIDERS (Residual decodIng and sERial-position Swap), which compensates for the information deficit in the model from both decoding and serial-position perspectives. Through extensive experiments on multiple commonsense reasoning benchmarks, we validate that this method not only significantly eliminates Toxic CoT problems (decreased by 23.6%), but also effectively improves the model's overall commonsense reasoning performance (increased by 5.5%).",Annual Meeting of the Association for Computational Linguistics,2,White-box,General,该论文明确研究了CoT推理过程中的信息丢失问题，使用内部机制分析方法（如attribution tracing和causal tracing），并且设计了RIDERS方法来补偿信息缺失，直接关联到CoT的真实性和忠实度问题。
Let's Think Dot by Dot: Hidden Computation in Transformer Language Models,2024,True,True,False,,论文揭示了CoT中可能存在的隐藏计算现象，与忠实性相关。,"Chain-of-thought responses from language models improve performance across most benchmarks. However, it remains unclear to what extent these performance gains can be attributed to human-like task decomposition or simply the greater computation that additional tokens allow. We show that transformers can use meaningless filler tokens (e.g., '......') in place of a chain of thought to solve two hard algorithmic tasks they could not solve when responding without intermediate tokens. However, we find empirically that learning to use filler tokens is difficult and requires specific, dense supervision to converge. We also provide a theoretical characterization of the class of problems where filler tokens are useful in terms of the quantifier depth of a first-order formula. For problems satisfying this characterization, chain-of-thought tokens need not provide information about the intermediate computational steps involved in multi-token computations. In summary, our results show that additional tokens can provide computational benefits independent of token choice. The fact that intermediate tokens can act as filler tokens raises concerns about large language models engaging in unauditable, hidden computations that are increasingly detached from the observed chain-of-thought tokens.",arXiv.org,2,White-box,General,该论文明确研究了 Chain-of-Thought (CoT) 是否真实反映了模型的计算过程，揭示了中间标记（如无意义的填充标记）可以独立于其语义内容提供计算优势，这表明 CoT 可能并不忠实于模型的实际推理过程。论文还提出了对 CoT 忠实性的担忧，即模型可能进行与观察到的 CoT 标记脱节的不可审计的隐藏计算，这直接涉及 CoT Faithfulness 的核心问题。
Understanding Reasoning in Chain-of-Thought from the Hopfieldian View,2024,True,False,True,Interpretability & Internal Mechanisms,论文提出了基于Hopfieldian认知视角的RoT框架，增强CoT推理的鲁棒性和可解释性。,"Large Language Models have demonstrated remarkable abilities across various tasks, with Chain-of-Thought (CoT) prompting emerging as a key technique to enhance reasoning capabilities. However, existing research primarily focuses on improving performance, lacking a comprehensive framework to explain and understand the fundamental factors behind CoT's success. To bridge this gap, we introduce a novel perspective grounded in the Hopfieldian view of cognition in cognitive neuroscience. We establish a connection between CoT reasoning and key cognitive elements such as stimuli, actions, neural populations, and representation spaces. From our view, we can understand the reasoning process as the movement between these representation spaces. Building on this insight, we develop a method for localizing reasoning errors in the response of CoTs. Moreover, we propose the Representation-of-Thought (RoT) framework, which leverages the robustness of low-dimensional representation spaces to enhance the robustness of the reasoning process in CoTs. Experimental results demonstrate that RoT improves the robustness and interpretability of CoT reasoning while offering fine-grained control over the reasoning process.",arXiv.org,1,White-box,General,论文从Hopfieldian认知视角研究CoT的内部机制，涉及神经群体和表征空间等认知元素，并定位推理错误，但未明确讨论CoT是否忠实反映模型的实际计算过程。
Unveiling and Causalizing CoT: A Causal Pespective,2025,True,True,True,Interpretability & Internal Mechanisms,论文从因果视角揭示和纠正CoT中的错误步骤，提升忠实性和可理解性。,"Although Chain-of-Thought (CoT) has achieved remarkable success in enhancing the reasoning ability of large language models (LLMs), the mechanism of CoT remains a ``black box''. Even if the correct answers can frequently be obtained, existing CoTs struggle to make the reasoning understandable to human. In this paper, we unveil and causalize CoT from a causal perspective to ensure both correctness and understandability of all reasoning steps (to the best of our knowledge, the first such). We model causality of CoT via structural causal models (SCM) to unveil the reasoning mechanism of CoT. To measure the causality of CoT, we define the CoT Average Causal Effect (CACE) to test the causal relations between steps. For those steps without causality (wrong or unintelligible steps), we design a role-playing causal query algorithm to causalize these steps, resulting a causalized CoT with all steps correct and understandable. Experimental results on both open-source and closed-source LLMs demonstrate that the causal errors commonly in steps are effectively corrected and the reasoning ability of LLMs is significantly improved.",arXiv.org,2,White-box,General,该论文明确从因果视角研究CoT的机制，通过结构因果模型（SCM）和定义的CoT平均因果效应（CACE）来测试步骤间的因果关系，直接涉及CoT的忠实度问题。
On the Impact of Fine-Tuning on Chain-of-Thought Reasoning,2024,True,True,False,Training & Fine-tuning,论文探讨了微调对CoT推理忠实性的影响，揭示了不忠实现象。,"Large language models have emerged as powerful tools for general intelligence, showcasing advanced natural language processing capabilities that find applications across diverse domains. Despite their impressive performance, recent studies have highlighted the potential for significant enhancements in LLMs' task-specific performance through fine-tuning strategies like Reinforcement Learning with Human Feedback (RLHF), supervised fine-tuning (SFT), and Quantized Low-Rank Adapters (Q-LoRA) method. However, previous works have shown that while fine-tuning offers significant performance gains, it also leads to challenges such as catastrophic forgetting and privacy and safety risks. To this end, there has been little to no work in \textit{understanding the impact of fine-tuning on the reasoning capabilities of LLMs}. Our research investigates the effect of fine-tuning on the reasoning abilities of LLMs, addressing critical questions regarding the impact of task-specific fine-tuning on overall reasoning capabilities, the influence of fine-tuning on Chain-of-Thought (CoT) reasoning performance, and the implications for the faithfulness of CoT reasonings. By exploring these dimensions, our study shows the impact of fine-tuning on LLM reasoning capabilities, where the faithfulness of CoT reasoning, on average across four datasets, decreases, highlighting potential shifts in internal mechanisms of the LLMs resulting from fine-tuning processes.",North American Chapter of the Association for Computational Linguistics,2,White-box,General,该论文明确研究了微调对CoT推理忠实度的影响，探讨了微调如何改变LLM的内部机制，并直接提及了CoT推理的faithfulness问题。
Consistent Multi-Granular Rationale Extraction for Explainable Multi-hop Fact Verification,2023,True,True,True,Training & Fine-tuning,论文探讨了多粒度理由提取的忠实性和一致性，并提出了新的评估指标。,"The success of deep learning models on multi-hop fact verification has prompted researchers to understand the behavior behind their veracity. One possible way is erasure search: obtaining the rationale by entirely removing a subset of input without compromising the veracity prediction. Although extensively explored, existing approaches fall within the scope of the single-granular (tokens or sentences) explanation, which inevitably leads to explanation redundancy and inconsistency. To address such issues, this paper explores the viability of multi-granular rationale extraction with consistency and faithfulness for explainable multi-hop fact verification. In particular, given a pretrained veracity prediction model, both the token-level explainer and sentence-level explainer are trained simultaneously to obtain multi-granular rationales via differentiable masking. Meanwhile, three diagnostic properties (fidelity, consistency, salience) are introduced and applied to the training process, to ensure that the extracted rationales satisfy faithfulness and consistency. Experimental results on three multi-hop fact verification datasets show that the proposed approach outperforms some state-of-the-art baselines.",arXiv.org,2,White-box,General,该论文明确研究多粒度理由提取的忠实性（faithfulness）和一致性（consistency），并引入了诊断属性（如fidelity）来确保提取的理由满足忠实性。这与CoT Faithfulness的核心定义直接相关，即模型生成的解释是否真实反映了模型做出预测的实际计算过程。
Thinking About Thinking: Evaluating Reasoning in Post-Trained Language Models,2025,True,True,False,Training & Fine-tuning,论文讨论了模型内部推理痕迹与最终输出的对齐问题，涉及不忠实现象，并提到通过SFT、DPO和GRPO等训练方法改进。,"Recent advances in post-training techniques have endowed Large Language Models (LLMs) with enhanced capabilities for tackling complex, logic-intensive tasks through the generation of supplementary planning tokens. This development raises a fundamental question: Are these models aware of what they""learn""and""think""? To address this, we define three core competencies: (1) awareness of learned latent policies, (2) generalization of these policies across domains, and (3) alignment between internal reasoning traces and final outputs. We empirically evaluate these abilities on several tasks, each designed to require learning a distinct policy. Furthermore, we contrast the profiles of models post-trained via Supervised Fine-Tuning (SFT), Direct Policy Optimization (DPO), and Group Relative Policy Optimization (GRPO). Our findings indicate that RL-trained models not only demonstrate greater awareness of their learned behaviors and stronger generalizability to novel, structurally similar tasks than SFT models but also often exhibit weak alignment between their reasoning traces and final outputs, an effect most pronounced in GRPO-trained models.",arXiv.org,2,White-box,General,论文明确研究了内部推理轨迹（reasoning traces）与最终输出的对齐问题（alignment），这直接涉及CoT的忠实度（Faithfulness）。特别是发现RL训练的模型在推理轨迹与输出之间存在弱对齐现象，符合核心定义中关于'Post-hoc Rationalization'的研究。此外，论文还对比了不同训练方法（SFT/DPO/GRPO）对模型内部机制的影响，属于白盒分析。
Verifying Chain-of-Thought Reasoning via Its Computational Graph,2025,True,False,True,Interpretability & Internal Mechanisms,论文提出了一种白盒方法验证CoT的计算图，直接关联模型内部电路与推理过程，符合Faithfulness定义。,"Current Chain-of-Thought (CoT) verification methods predict reasoning correctness based on outputs (black-box) or activations (gray-box), but offer limited insight into why a computation fails. We introduce a white-box method: Circuit-based Reasoning Verification (CRV). We hypothesize that attribution graphs of correct CoT steps, viewed as execution traces of the model's latent reasoning circuits, possess distinct structural fingerprints from those of incorrect steps. By training a classifier on structural features of these graphs, we show that these traces contain a powerful signal of reasoning errors. Our white-box approach yields novel scientific insights unattainable by other methods. (1) We demonstrate that structural signatures of error are highly predictive, establishing the viability of verifying reasoning directly via its computational graph. (2) We find these signatures to be highly domain-specific, revealing that failures in different reasoning tasks manifest as distinct computational patterns. (3) We provide evidence that these signatures are not merely correlational; by using our analysis to guide targeted interventions on individual transcoder features, we successfully correct the model's faulty reasoning. Our work shows that, by scrutinizing a model's computational process, we can move from simple error detection to a deeper, causal understanding of LLM reasoning.",arXiv.org,2,White-box,General,该论文明确研究 CoT 的计算图（computational graph）作为模型潜在推理电路的执行轨迹，并验证其结构特征是否能预测推理错误。这直接涉及 CoT 是否真实反映模型的计算过程（Faithfulness），且通过白盒方法（如干预 transcoder 特征）证明其因果性，符合核心相关标准。
Investigating Self-Rationalizing Models for Commonsense Reasoning,2023,True,True,False,Training & Fine-tuning,论文探讨了自解释模型的忠实性问题，并提出了通过微调改进的方法。,"The rise of explainable natural language processing spurred a bulk of work on datasets augmented with human explanations, as well as technical approaches to leverage them. Notably, generative large language models offer new possibilities, as they can output a prediction as well as an explanation in natural language. This work investigates the capabilities of fine-tuned text-to-text transfer Transformer (T5) models for commonsense reasoning and explanation generation. Our experiments suggest that while self-rationalizing models achieve interesting results, a significant gap remains: classifiers consistently outperformed self-rationalizing models, and a substantial fraction of model-generated explanations are not valid. Furthermore, training with expressive free-text explanations substantially altered the inner representation of the model, suggesting that they supplied additional information and may bridge the knowledge gap. Our code is publicly available, and the experiments were run on open-access datasets, hence allowing full reproducibility.",Stats,1,White-box,General,该论文研究了自解释模型在常识推理中的表现，发现模型生成的解释存在不有效的问题，并分析了训练过程中内部表征的变化。虽然未直接探讨CoT的忠实度，但涉及解释的有效性和模型内部机制，属于边缘相关。
