Title,Year,Citations,Category,Type,Domain,Tradeoff,Cost,Reasoning,Abstract
Is General-Purpose AI Reasoning Sensitive to Data-Induced Cognitive Biases? Dynamic Benchmarking on Typical Software Engineering Dilemmas,2025,2,Benchmark,Black-box,Code,Unknown,High,论文发现GPAI系统存在数据诱导的认知偏差。,"Human cognitive biases in software engineering can lead to costly errors. While general-purpose AI (GPAI) systems may help mitigate these biases due to their non-human nature, their training on human-generated data raises a critical question: Do GPAI systems themselves exhibit cognitive biases? To investigate this, we present the first dynamic benchmarking framework to evaluate data-induced cognitive biases in GPAI within software engineering workflows. Starting with a seed set of 16 hand-crafted realistic tasks, each featuring one of 8 cognitive biases (e.g., anchoring, framing) and corresponding unbiased variants, we test whether bias-inducing linguistic cues unrelated to task logic can lead GPAI systems from correct to incorrect conclusions. To scale the benchmark and ensure realism, we develop an on-demand augmentation pipeline relying on GPAI systems to generate task variants that preserve bias-inducing cues while varying surface details. This pipeline ensures correctness (88-99% on average, according to human evaluation), promotes diversity, and controls reasoning complexity by leveraging Prolog-based reasoning. We evaluate leading GPAI systems (GPT, LLaMA, DeepSeek) and find a consistent tendency to rely on shallow linguistic heuristics over more complex reasoning. All systems exhibit bias sensitivity (6-35%), which increases with task complexity (up to 49%) and highlights risks in AI-driven software engineering."
The Quest for Efficient Reasoning: A Data-Centric Benchmark to CoT Distillation,2025,1,Benchmark,Black-box,General,Unknown,Low,论文主要关注数据蒸馏对CoT推理能力的评估。,"Data-centric distillation, including data augmentation, selection, and mixing, offers a promising path to creating smaller, more efficient student Large Language Models (LLMs) that retain strong reasoning abilities. However, there still lacks a comprehensive benchmark to systematically assess the effect of each distillation approach. This paper introduces DC-CoT, the first data-centric benchmark that investigates data manipulation in chain-of-thought (CoT) distillation from method, model and data perspectives. Utilizing various teacher models (e.g., o4-mini, Gemini-Pro, Claude-3.5) and student architectures (e.g., 3B, 7B parameters), we rigorously evaluate the impact of these data manipulations on student model performance across multiple reasoning datasets, with a focus on in-distribution (IID) and out-of-distribution (OOD) generalization, and cross-domain transfer. Our findings aim to provide actionable insights and establish best practices for optimizing CoT distillation through data-centric techniques, ultimately facilitating the development of more accessible and capable reasoning models. The dataset can be found at https://huggingface.co/datasets/rana-shahroz/DC-COT, while our code is shared in https://anonymous.4open.science/r/DC-COT-FF4C/."
AURA: A Fine-Grained Benchmark and Decomposed Metric for Audio-Visual Reasoning,2025,1,Benchmark,White-box,General,Unknown,High,论文提出了AuraScore指标，分解推理忠实度。,"Current audio-visual (AV) benchmarks focus on final answer accuracy, overlooking the underlying reasoning process. This makes it difficult to distinguish genuine comprehension from correct answers derived through flawed reasoning or hallucinations. To address this, we introduce AURA (Audio-visual Understanding and Reasoning Assessment), a benchmark for evaluating the cross-modal reasoning capabilities of Audio-Visual Large Language Models (AV-LLMs) and Omni-modal Language Models (OLMs). AURA includes questions across six challenging cognitive domains, such as causality, timbre and pitch, tempo and AV synchronization, unanswerability, implicit distractions, and skill profiling, explicitly designed to be unanswerable from a single modality. This forces models to construct a valid logical path grounded in both audio and video, setting AURA apart from AV datasets that allow uni-modal shortcuts. To assess reasoning traces, we propose a novel metric, AuraScore, which addresses the lack of robust tools for evaluating reasoning fidelity. It decomposes reasoning into two aspects: (i) Factual Consistency - whether reasoning is grounded in perceptual evidence, and (ii) Core Inference - the logical validity of each reasoning step. Evaluations of SOTA models on AURA reveal a critical reasoning gap: although models achieve high accuracy (up to 92% on some tasks), their Factual Consistency and Core Inference scores fall below 45%. This discrepancy highlights that models often arrive at correct answers through flawed logic, underscoring the need for our benchmark and paving the way for more robust multimodal evaluation."
"Beyond Theorem Proving: Formulation, Framework and Benchmark for Formal Problem-Solving",2025,1,Benchmark,White-box,Math,Unknown,High,论文提出RPE作为符号化验证指标。,"As a seemingly self-explanatory task, problem-solving has been a significant component of science and engineering. However, a general yet concrete formulation of problem-solving itself is missing. With the recent development of AI-based problem-solving agents, the demand for process-level verifiability is rapidly increasing yet underexplored. To fill these gaps, we present a principled formulation of problem-solving as a deterministic Markov decision process; a novel framework, FPS (Formal Problem-Solving), which utilizes existing FTP (formal theorem proving) environments to perform process-verified problem-solving; and D-FPS (Deductive FPS), decoupling solving and answer verification for better human-alignment. The expressiveness, soundness and completeness of the frameworks are proven. We construct three benchmarks on problem-solving: FormalMath500, a formalization of a subset of the MATH500 benchmark; MiniF2F-Solving and PutnamBench-Solving, adaptations of FTP benchmarks MiniF2F and PutnamBench. For faithful, interpretable, and human-aligned evaluation, we propose RPE (Restricted Propositional Equivalence), a symbolic approach to determine the correctness of answers by formal verification. We evaluate four prevalent FTP models and two prompting methods as baselines, solving at most 23.77% of FormalMath500, 27.47% of MiniF2F-Solving, and 0.31% of PutnamBench-Solving."
Evaluating Medical LLMs by Levels of Autonomy: A Survey Moving from Benchmarks to Applications,2025,1,Benchmark,Black-box,Medical,Unknown,Unknown,论文主要讨论医疗LLM的评估框架，未直接涉及CoT忠实度。,"Medical Large language models achieve strong scores on standard benchmarks; however, the transfer of those results to safe and reliable performance in clinical workflows remains a challenge. This survey reframes evaluation through a levels-of-autonomy lens (L0-L3), spanning informational tools, information transformation and aggregation, decision support, and supervised agents. We align existing benchmarks and metrics with the actions permitted at each level and their associated risks, making the evaluation targets explicit. This motivates a level-conditioned blueprint for selecting metrics, assembling evidence, and reporting claims, alongside directions that link evaluation to oversight. By centering autonomy, the survey moves the field beyond score-based claims toward credible, risk-aware evidence for real clinical use."
MedRECT: A Medical Reasoning Benchmark for Error Correction in Clinical Texts,2025,0,Benchmark,Black-box,Medical,Unknown,High,评估了多种LLM在医疗错误检测和纠正中的表现。,"Large language models (LLMs) show increasing promise in medical applications, but their ability to detect and correct errors in clinical texts -- a prerequisite for safe deployment -- remains under-evaluated, particularly beyond English. We introduce MedRECT, a cross-lingual benchmark (Japanese/English) that formulates medical error handling as three subtasks: error detection, error localization (sentence extraction), and error correction. MedRECT is built with a scalable, automated pipeline from the Japanese Medical Licensing Examinations (JMLE) and a curated English counterpart, yielding MedRECT-ja (663 texts) and MedRECT-en (458 texts) with comparable error/no-error balance. We evaluate 9 contemporary LLMs spanning proprietary, open-weight, and reasoning families. Key findings: (i) reasoning models substantially outperform standard architectures, with up to 13.5% relative improvement in error detection and 51.0% in sentence extraction; (ii) cross-lingual evaluation reveals 5-10% performance gaps from English to Japanese, with smaller disparities for reasoning models; (iii) targeted LoRA fine-tuning yields asymmetric improvements in error correction performance (Japanese: +0.078, English: +0.168) while preserving reasoning capabilities; and (iv) our fine-tuned model exceeds human expert performance on structured medical error correction tasks. To our knowledge, MedRECT is the first comprehensive cross-lingual benchmark for medical error correction, providing a reproducible framework and resources for developing safer medical LLMs across languages."
CodeFuse-CommitEval: Towards Benchmarking LLM's Power on Commit Message and Code Change Inconsistency Detection,2025,0,Benchmark,Black-box,Code,Negative,High,思维链提升精确度但牺牲召回率和增加token消耗。,"Version control relies on commit messages to convey the rationale for code changes, but these messages are often low quality and, more critically, inconsistent with their diffs-known as message-code inconsistency (MCI). MCIs mislead reviewers, hinder maintenance, contaminate research datasets, and may obscure security patches. Yet, no dedicated benchmark exists to evaluate models for MCI detection. We introduce CODEFUSE-COMMITEVAL, the first benchmark designed for MCI detection using large language models (LLMs). Built on the ApacheCM dataset for diversity and quality, we generate seven types of inconsistent messages through rule-guided mutations of originally consistent commits and apply two-fold validation to verify both positive and negative samples. Using this labeled dataset of message-diff pairs, we evaluate six state-of-the-art open-source LLMs under a vanilla setting and with three augmentation strategies: few-shot prompting, chain-of-thought, and extended context. Results show models detect inconsistent commits more reliably than consistent ones (average Recall 85.95%, Precision 80.28%, Specificity 63.8%); gpt-oss-20B performs best overall but uses over twice the tokens of others. Augmentation effects vary: adjacent context helps larger models but adds noise for smaller ones; few-shot improves accuracy and reduces token use, yet increases universally incorrect predictions; chain-of-thought boosts precision and specificity at the cost of recall and higher token consumption. Type-wise analysis reveals higher detectability for component, file-path, and operation inconsistencies, but lower accuracy and higher token cost for intent-level""purpose""inconsistencies. CODEFUSE-COMMITEVAL provides a rigorous foundation for measuring, comparing, and advancing MCI detection, highlighting the need for richer context and balanced data to capture high-level semantic gaps."
An Analysis of Architectural Impact on LLM-based Abstract Visual Reasoning: A Systematic Benchmark on RAVEN-FAIR,2025,0,Benchmark,Black-box,Logic,Unknown,High,论文分析了不同架构对LLM抽象视觉推理的影响。,"This study aims to systematically evaluate the performance of large language models (LLMs) in abstract visual reasoning problems. We examined four LLM models (GPT-4.1-Mini, Claude-3.5-Haiku, Gemini-1.5-Flash, Llama-3.3-70b) utilizing four different reasoning architectures (single-shot, embedding-controlled repetition, self-reflection, and multi-agent) on the RAVEN-FAIR dataset. Visual responses generated through a three-stage process (JSON extraction, LLM reasoning, and Tool Function) were evaluated using SSIM and LPIPS metrics; Chain-of-Thought scores and error types (semantic hallucination, numeric misperception) were analyzed. Results demonstrate that GPT-4.1-Mini consistently achieved the highest overall accuracy across all architectures, indicating a strong reasoning capability. While the multi-agent architecture occasionally altered semantic and numeric balance across models, these effects were not uniformly beneficial. Instead, each model exhibited distinct sensitivity patterns to architectural design, underscoring that reasoning effectiveness remains model-specific. Variations in response coverage further emerged as a confounding factor that complicates direct cross-architecture comparison. To estimate the upper-bound performance of each configuration, we report the best of five independent runs, representing a best-case scenario rather than an averaged outcome. This multi-run strategy aligns with recent recommendations, which emphasize that single-run evaluations are fragile and may lead to unreliable conclusions."
From Canonical to Complex: Benchmarking LLM Capabilities in Undergraduate Thermodynamics,2025,0,Benchmark,Black-box,General,Unknown,Low,论文评估了LLM在热力学领域的表现。,"Large language models (LLMs) are increasingly considered as tutoring aids in science education. Yet their readiness for unsupervised use in undergraduate instruction remains uncertain, as reliable teaching requires more than fluent recall: it demands consistent, principle-grounded reasoning. Thermodynamics, with its compact laws and subtle distinctions between state and path functions, reversibility, and entropy, provides an ideal testbed for evaluating such capabilities. Here we present UTQA, a 50-item undergraduate thermodynamics question answering benchmark, covering ideal-gas processes, reversibility, and diagram interpretation. No leading 2025-era model exceeded our 95\% competence threshold: the best LLMs achieved 82\% accuracy, with text-only items performing better than image reasoning tasks, which often fell to chance levels. Prompt phrasing and syntactic complexity showed modest to little correlation with performance. The gap concentrates in finite-rate/irreversible scenarios and in binding visual features to thermodynamic meaning, indicating that current LLMs are not yet suitable for unsupervised tutoring in this domain."
FaithCoT-Bench: Benchmarking Instance-Level Faithfulness of Chain-of-Thought Reasoning,2025,0,Benchmark,Black-box,General,Unknown,High,论文提出评估CoT忠实度的基准框架，涉及多模型多领域评估。,"Large language models (LLMs) increasingly rely on Chain-of-Thought (CoT) prompting to improve problem-solving and provide seemingly transparent explanations. However, growing evidence shows that CoT often fail to faithfully represent the underlying reasoning process, raising concerns about their reliability in high-risk applications. Although prior studies have focused on mechanism-level analyses showing that CoTs can be unfaithful, they leave open the practical challenge of deciding whether a specific trajectory is faithful to the internal reasoning of the model. To address this gap, we introduce FaithCoT-Bench, a unified benchmark for instance-level CoT unfaithfulness detection. Our framework establishes a rigorous task formulation that formulates unfaithfulness detection as a discriminative decision problem, and provides FINE-CoT (Faithfulness instance evaluation for Chain-of-Thought), an expert-annotated collection of over 1,000 trajectories generated by four representative LLMs across four domains, including more than 300 unfaithful instances with fine-grained causes and step-level evidence. We further conduct a systematic evaluation of eleven representative detection methods spanning counterfactual, logit-based, and LLM-as-judge paradigms, deriving empirical insights that clarify the strengths and weaknesses of existing approaches and reveal the increased challenges of detection in knowledge-intensive domains and with more advanced models. To the best of our knowledge, FaithCoT-Bench establishes the first comprehensive benchmark for instance-level CoT faithfulness, setting a solid basis for future research toward more interpretable and trustworthy reasoning in LLMs."
