Title,Year,Citations,Category,Type,Domain,Tradeoff,Cost,Reasoning,Abstract
Code Prompting Elicits Conditional Reasoning Abilities in Text+Code LLMs,2024,16,Phenomenon,Black-box,Logic,Unknown,Low,研究代码表示如何触发LLM的推理能力。,"Reasoning is a fundamental component of language understanding. Recent prompting techniques, such as chain of thought, have consistently improved LLMs’ performance on various reasoning tasks. Nevertheless, there is still little understanding of what triggers reasoning abilities in LLMs in the inference stage. In this paper, we investigate the effect of the input representation on the reasoning abilities of LLMs. We hypothesize that representing natural language tasks as code can enhance specific reasoning abilities such as entity tracking or logical reasoning. To study this, we propose code prompting, a methodology we operationalize as a chain of prompts that transforms a natural language problem into code and directly prompts the LLM using the generated code without resorting to external code execution. We find that code prompting exhibits a high-performance boost for multiple LLMs (up to 22.52 percentage points on GPT 3.5, 7.75 on Mixtral, and 16.78 on Mistral) across multiple conditional reasoning datasets. We then conduct comprehensive experiments to understand how the code representation triggers reasoning abilities and which capabilities are elicited in the underlying models. Our analysis on GPT 3.5 reveals that the code formatting of the input problem is essential for performance improvement. Furthermore, the code representation improves sample efficiency of in-context learning and facilitates state tracking of entities."
On the Intrinsic Self-Correction Capability of LLMs: Uncertainty and Latent Concept,2024,16,Phenomenon,Black-box,General,Unknown,High,研究聚焦LLM内在自校正的收敛现象。,"Large Language Models (LLMs) are able to improve their responses when instructed to do so, a capability known as self-correction. When instructions provide only the task's goal without specific details about potential issues in the response, LLMs must rely on their internal knowledge to improve response quality, a process referred to as intrinsic self-correction. The empirical success of intrinsic self-correction is evident in various applications, but how and why it is effective remains unknown. In this paper, we unveil that intrinsic self-correction can be progressively improved, allowing it to approach a converged state. Our findings are verified in: (1) the scenario of multi-round question answering, by comprehensively demonstrating that intrinsic self-correction can progressively introduce performance gains through iterative interactions, ultimately converging to stable performance; and (2) the context of intrinsic self-correction for enhanced morality, in which we provide empirical evidence that iteratively applying instructions reduces model uncertainty towards convergence, which then leads to convergence of both the calibration error and self-correction performance, ultimately resulting in a stable state of intrinsic self-correction. Furthermore, we introduce a mathematical formulation and a simulation task indicating that the latent concepts activated by self-correction instructions drive the reduction of model uncertainty. Based on our experimental results and analysis of the convergence of intrinsic self-correction, we reveal its underlying mechanism: consistent injected instructions reduce model uncertainty which yields converged, improved performance."
"Do as We Do, Not as You Think: the Conformity of Large Language Models",2025,16,Phenomenon,Black-box,General,Unknown,High,研究大模型在多智能体系统中的从众现象。,"Recent advancements in large language models (LLMs) revolutionize the field of intelligent agents, enabling collaborative multi-agent systems capable of tackling complex problems across various domains. However, the potential of conformity within these systems, analogous to phenomena like conformity bias and groupthink in human group dynamics, remains largely unexplored, raising concerns about their collective problem-solving capabilities and possible ethical implications. This paper presents a comprehensive study on conformity in LLM-driven multi-agent systems, focusing on three aspects: the existence of conformity, the factors influencing conformity, and potential mitigation strategies. In particular, we introduce BenchForm, a new conformity-oriented benchmark, featuring reasoning-intensive tasks and five distinct interaction protocols designed to probe LLMs' behavior in collaborative scenarios. Several representative LLMs are evaluated on BenchForm, using metrics such as conformity rate and independence rate to quantify conformity's impact. Our analysis delves into factors influencing conformity, including interaction time and majority size, and examines how the subject agent rationalizes its conforming behavior. Furthermore, we explore two strategies to mitigate conformity effects, i.e., developing enhanced personas and implementing a reflection mechanism. Several interesting findings regarding LLMs' conformity are derived from empirical results and case studies. We hope that these insights can pave the way for more robust and ethically-aligned collaborative AI systems. Our benchmark and code are available at BenchForm."
Focus on Your Question! Interpreting and Mitigating Toxic CoT Problems in Commonsense Reasoning,2024,16,Phenomenon,White-box,General,Unknown,High,论文发现了CoT导致正确回答变错的现象。,"Large language models exhibit high-level commonsense reasoning abilities, especially with enhancement methods like Chain-of-Thought (CoT). However, we find these CoT-like methods lead to a considerable number of originally correct answers turning wrong, which we define as the Toxic CoT problem. To interpret and mitigate this problem, we first utilize attribution tracing and causal tracing methods to probe the internal working mechanism of the LLM during CoT reasoning. Through comparisons, we prove that the model exhibits information loss from the question over the shallow attention layers when generating rationales or answers. Based on the probing findings, we design a novel method called RIDERS (Residual decodIng and sERial-position Swap), which compensates for the information deficit in the model from both decoding and serial-position perspectives. Through extensive experiments on multiple commonsense reasoning benchmarks, we validate that this method not only significantly eliminates Toxic CoT problems (decreased by 23.6%), but also effectively improves the model's overall commonsense reasoning performance (increased by 5.5%)."
Self-Consistency of Large Language Models under Ambiguity,2023,15,Phenomenon,Black-box,General,Unknown,Low,研究大模型在模糊情境下的自洽性现象。,"Large language models (LLMs) that do not give consistent answers across contexts are problematic when used for tasks with expectations of consistency–e.g. question-answering, explanations, etc. Our work presents an evaluation benchmark for self-consistency in cases of under-specification where two or more answers can be correct. We conduct a series of behavioral experiments on the OpenAI model suite using an ambiguous integer sequence completion task. We find that average consistency ranges from 67% to 82%, far higher than would be predicted if a model’s consistency was random, and increases as model capability improves. Furthermore, we show that models tend to maintain self-consistency across a series of robustness checks, including prompting speaker changes and sequence length changes. These results suggest that self-consistency arises as an emergent capability without specifically training for it. Despite this, we find that models are uncalibrated when judging their own consistency, with models displaying both over- and under-confidence. We also propose a nonparametric test for determining from token output distribution whether a model assigns non-trivial probability to alternative answers. Using this test, we find that despite increases in self-consistency, models usually place significant weight on alternative, inconsistent answers. This distribution of probability mass provides evidence that even highly self-consistent models internally compute multiple possible responses."
Comparing Inferential Strategies of Humans and Large Language Models in Deductive Reasoning,2024,14,Phenomenon,Black-box,Logic,Unknown,High,研究LLMs在演绎推理中的推理策略相似性。,"Deductive reasoning plays a pivotal role in the formulation of sound and cohesive arguments. It allows individuals to draw conclusions that logically follow, given the truth value of the information provided. Recent progress in the domain of large language models (LLMs) has showcased their capability in executing deductive reasoning tasks. Nonetheless, a significant portion of research primarily assesses the accuracy of LLMs in solving such tasks, often overlooking a deeper analysis of their reasoning behavior. In this study, we draw upon principles from cognitive psychology to examine inferential strategies employed by LLMs, through a detailed evaluation of their responses to propositional logic problems. Our findings indicate that LLMs display reasoning patterns akin to those observed in humans, including strategies like $\textit{supposition following}$ or $\textit{chain construction}$. Moreover, our research demonstrates that the architecture and scale of the model significantly affect its preferred method of reasoning, with more advanced models tending to adopt strategies more frequently than less sophisticated ones. Importantly, we assert that a model's accuracy, that is the correctness of its final conclusion, does not necessarily reflect the validity of its reasoning process. This distinction underscores the necessity for more nuanced evaluation procedures in the field."
Can Large Language Models Reason? A Characterization via 3-SAT,2024,13,Phenomenon,Black-box,Logic,Unknown,High,论文发现LLMs无法真正解决3-SAT问题。,"Large Language Models (LLMs) have been touted as AI models possessing advanced reasoning abilities. However, recent works have shown that LLMs often bypass true reasoning using shortcuts, sparking skepticism. To study the reasoning capabilities in a principled fashion, we adopt a computational theory perspective and propose an experimental protocol centered on 3-SAT -- the prototypical NP-complete problem lying at the core of logical reasoning and constraint satisfaction tasks. Specifically, we examine the phase transitions in random 3-SAT and characterize the reasoning abilities of LLMs by varying the inherent hardness of the problem instances. Our experimental evidence shows that LLMs are incapable of performing true reasoning, as required for solving 3-SAT problems. Moreover, we observe significant performance variation based on the inherent hardness of the problems -- performing poorly on harder instances and vice versa. Importantly, we show that integrating external reasoners can considerably enhance LLM performance. By following a principled experimental protocol, our study draws concrete conclusions and moves beyond the anecdotal evidence often found in LLM reasoning research."
Dissecting Human and LLM Preferences,2024,13,Phenomenon,Black-box,General,Unknown,Low,分析了人类和LLM偏好的差异现象。,"As a relative quality comparison of model responses, human and Large Language Model (LLM) preferences serve as common alignment goals in model fine-tuning and criteria in evaluation. Yet, these preferences merely reflect broad tendencies, resulting in less explainable and controllable models with potential safety risks. In this work, we dissect the preferences of human and 32 different LLMs to understand their quantitative composition, using annotations from real-world user-model conversations for a fine-grained, scenario-wise analysis. We find that humans are less sensitive to errors, favor responses that support their stances, and show clear dislike when models admit their limits. On the contrary, advanced LLMs like GPT-4-Turbo emphasize correctness, clarity, and harmlessness more. Additionally, LLMs of similar sizes tend to exhibit similar preferences, regardless of their training methods, and fine-tuning for alignment does not significantly alter the preferences of pretrained-only LLMs. Finally, we show that preference-based evaluation can be intentionally manipulated. In both training-free and training-based settings, aligning a model with the preferences of judges boosts scores, while injecting the least preferred properties lowers them. This results in notable score shifts: up to 0.59 on MT-Bench (1-10 scale) and 31.94 on AlpacaEval 2.0 (0-100 scale), highlighting the significant impact of this strategic adaptation. Interactive Demo: https://huggingface.co/spaces/GAIR/Preference-Dissection-Visualization Dataset: https://huggingface.co/datasets/GAIR/preference-dissection Code: https://github.com/GAIR-NLP/Preference-Dissection"
It's Not Easy Being Wrong: Large Language Models Struggle with Process of Elimination Reasoning,2023,13,Phenomenon,Black-box,General,Unknown,High,研究探索了LLMs在错误推理中的表现。,"Chain-of-thought (COT) prompting can help large language models (LLMs) reason toward correct answers, but its efficacy in reasoning toward incorrect answers is unexplored. This process of elimination (PoE), when used with COT, can enhance self-consistency, interpretability, and tasks such as medical diagnoses of exclusion. Thus, we propose PoE with COT, where LLMs must reason toward incorrect options on multiple-choice questions. We evaluate the ability of GPT-3.5, LLaMA-2, and Falcon to perform PoE with COT on a total of four commonsense and scientific reasoning datasets. We find that the strategy of PoE always underperforms the strategy of choosing the correct answer. The agreement of these strategies is also lower than the self-consistency of each strategy. To study these issues further, we conduct error analyses and give suggestions for future work."
Anchored Answers: Unravelling Positional Bias in GPT-2's Multiple-Choice Questions,2024,13,Phenomenon,White-box,General,Unknown,Low,研究揭示了GPT-2在MCQ中的位置偏差现象。,"Large Language Models (LLMs), such as the GPT-4 and LLaMA families, have demonstrated considerable success across diverse tasks, including multiple-choice questions (MCQs). However, these models exhibit a positional bias, particularly an even worse anchored bias in the GPT-2 family, where they consistently favour the first choice 'A' in MCQs during inference. This anchored bias challenges the integrity of GPT-2's decision-making process, as it skews performance based on the position rather than the content of the choices in MCQs. In this study, we utilise the mechanistic interpretability approach to identify the internal modules within GPT-2 models responsible for this bias. We focus on the Multi-Layer Perceptron (MLP) layers and attention heads, using the""logit lens""method to trace and modify the specific value vectors that contribute to the bias. By updating these vectors within MLP and recalibrating attention patterns to neutralise the preference for the first choice 'A', we effectively mitigate the anchored bias. Our interventions not only mitigate the bias but also improve the overall MCQ prediction accuracy for the GPT-2 family across various datasets. This work represents the first comprehensive mechanistic analysis of anchored bias from the failing cases in MCQs within the GPT-2 models, introducing targeted, minimal-intervention strategies that significantly enhance GPT2 model robustness and accuracy in MCQs. Our code is available at https://github.com/ruizheliUOA/Anchored_Bias_GPT2."
Dissociation of Faithful and Unfaithful Reasoning in LLMs,2024,13,Phenomenon,Black-box,General,Unknown,Low,研究LLM在思维链中错误恢复的不忠实现象。,"Large language models (LLMs) often improve their performance in downstream tasks when they generate Chain of Thought reasoning text before producing an answer. We investigate how LLMs recover from errors in Chain of Thought. Through analysis of error recovery behaviors, we find evidence for unfaithfulness in Chain of Thought, which occurs when models arrive at the correct answer despite invalid reasoning text. We identify factors that shift LLM recovery behavior: LLMs recover more frequently from obvious errors and in contexts that provide more evidence for the correct answer. Critically, these factors have divergent effects on faithful and unfaithful recoveries. Our results indicate that there are distinct mechanisms driving faithful and unfaithful error recoveries. Selective targeting of these mechanisms may be able to drive down the rate of unfaithful reasoning and improve model interpretability."
FLamE: Few-shot Learning from Natural Language Explanations,2023,13,Phenomenon,Black-box,General,Unknown,High,发现生成解释与分类决策不匹配的现象。,"Natural language explanations have the potential to provide rich information that in principle guides model reasoning.Yet, recent work by Lampinen et al. has shown limited utility of natural language explanations in improving classification.To effectively learn from explanations, we present FLamE, a two-stage few-shot learning framework that first generates explanations using GPT-3, and then fine-tunes a smaller model (e.g., RoBERTa) with generated explanations.Our experiments on natural language inference demonstrate effectiveness over strong baselines, increasing accuracy by 17.6% over GPT-3 Babbage and 5.7% over GPT-3 Davinci in e-SNLI.Despite improving classification performance, human evaluation surprisingly reveals that the majority of generated explanations does not adequately justify classification decisions.Additional analyses point to the important role of label-specific cues (e.g., “not know” for the neutral label) in generated explanations."
The Reasoning-Memorization Interplay in Language Models Is Mediated by a Single Direction,2025,12,Phenomenon,White-box,General,Unknown,Low,论文揭示了LLMs在推理与记忆间的动态机制。,"Large language models (LLMs) excel on a variety of reasoning benchmarks, but previous studies suggest they sometimes struggle to generalize to unseen questions, potentially due to over-reliance on memorized training examples. However, the precise conditions under which LLMs switch between reasoning and memorization during text generation remain unclear. In this work, we provide a mechanistic understanding of LLMs' reasoning-memorization dynamics by identifying a set of linear features in the model's residual stream that govern the balance between genuine reasoning and memory recall. These features not only distinguish reasoning tasks from memory-intensive ones but can also be manipulated to causally influence model performance on reasoning tasks. Additionally, we show that intervening in these reasoning features helps the model more accurately activate the most relevant problem-solving capabilities during answer generation. Our findings offer new insights into the underlying mechanisms of reasoning and memory in LLMs and pave the way for the development of more robust and interpretable generative AI systems."
In-Context Learning Dynamics with Random Binary Sequences,2023,12,Phenomenon,Black-box,General,Unknown,Low,研究大模型在随机序列中的上下文学习动态。,"Large language models (LLMs) trained on huge corpora of text datasets demonstrate intriguing capabilities, achieving state-of-the-art performance on tasks they were not explicitly trained for. The precise nature of LLM capabilities is often mysterious, and different prompts can elicit different capabilities through in-context learning. We propose a framework that enables us to analyze in-context learning dynamics to understand latent concepts underlying LLMs' behavioral patterns. This provides a more nuanced understanding than success-or-failure evaluation benchmarks, but does not require observing internal activations as a mechanistic interpretation of circuits would. Inspired by the cognitive science of human randomness perception, we use random binary sequences as context and study dynamics of in-context learning by manipulating properties of context data, such as sequence length. In the latest GPT-3.5+ models, we find emergent abilities to generate seemingly random numbers and learn basic formal languages, with striking in-context learning dynamics where model outputs transition sharply from seemingly random behaviors to deterministic repetition."
"Ask Again, Then Fail: Large Language Models' Vacillations in Judgement",2023,12,Phenomenon,Black-box,General,Unknown,Low,观察到模型在后续问题中判断摇摆的现象。,"We observe that current conversational language models often waver in their judgments when faced with follow-up questions, even if the original judgment was correct. This wavering presents a significant challenge for generating reliable responses and building user trust. To comprehensively assess this issue, we introduce a \textsc{Follow-up Questioning Mechanism} along with two metrics to quantify this inconsistency, confirming its widespread presence in current language models. To mitigate this issue, we explore various prompting strategies for closed-source models; moreover, we develop a training-based framework \textsc{Unwavering-FQ} that teaches language models to maintain their originally correct judgments through synthesized high-quality preference data. Our experimental results confirm the effectiveness of our framework and its ability to enhance the general capabilities of models."
Technological folie à deux: Feedback Loops Between AI Chatbots and Mental Illness,2025,11,Phenomenon,Black-box,General,Unknown,High,研究关注AI聊天机器人对心理健康的影响。,"Artificial intelligence chatbots have achieved unprecedented adoption, with millions now using these systems for emotional support and companionship in contexts of widespread social isolation and capacity-constrained mental health services. While some users report psychological benefits, concerning edge cases are emerging, including reports of suicide, violence, and delusional thinking linked to perceived emotional relationships with chatbots. To understand this new risk profile we need to consider the interaction between human cognitive and emotional biases, and chatbot behavioural tendencies such as agreeableness (sycophancy) and adaptability (in-context learning). We argue that individuals with mental health conditions face increased risks of chatbot-induced belief destabilization and dependence, owing to altered belief-updating, impaired reality-testing, and social isolation. Current AI safety measures are inadequate to address these interaction-based risks. To address this emerging public health concern, we need coordinated action across clinical practice, AI development, and regulatory frameworks."
LLMs' Classification Performance is Overclaimed,2024,11,Phenomenon,Black-box,General,Unknown,Low,发现LLMs在标签缺失时仍强制选择候选标签的现象。,"In many classification tasks designed for AI or human to solve, gold labels are typically included within the label space by default, often posed as""which of the following is correct?""This standard setup has traditionally highlighted the strong performance of advanced AI, particularly top-performing Large Language Models (LLMs), in routine classification tasks. However, when the gold label is intentionally excluded from the label space, it becomes evident that LLMs still attempt to select from the available label candidates, even when none are correct. This raises a pivotal question: Do LLMs truly demonstrate their intelligence in understanding the essence of classification tasks? In this study, we evaluate both closed-source and open-source LLMs across representative classification tasks, arguing that the perceived performance of LLMs is overstated due to their inability to exhibit the expected comprehension of the task. This paper makes a threefold contribution: i) To our knowledge, this is the first work to identify the limitations of LLMs in classification tasks when gold labels are absent. We define this task as Classify-w/o-Gold and propose it as a new testbed for LLMs. ii) We introduce a benchmark, Know-No, comprising two existing classification tasks and one new task, to evaluate Classify-w/o-Gold. iii) This work defines and advocates for a new evaluation metric, OmniAccuracy, which assesses LLMs' performance in classification tasks both when gold labels are present and absent."
