Title,Year,Citations,Category,Type,Domain,Tradeoff,Cost,Reasoning,Abstract
Do Cognitively Interpretable Reasoning Traces Improve LLM Performance?,2025,4,Phenomenon,Black-box,General,Unknown,High,研究发现CoT可解释性与性能存在不匹配现象。,"Recent progress in reasoning-oriented Large Language Models (LLMs) has been driven by introducing Chain-of-Thought (CoT) traces, where models generate intermediate reasoning traces before producing an answer. These traces, as in DeepSeek R1, are not only used to guide inference but also serve as supervision signals for distillation into smaller models. A common but often implicit assumption is that CoT traces should be semantically meaningful and interpretable to the end user. While recent research questions the need for semantic nature of these traces, in this paper, we ask: ``\textit{Must CoT reasoning traces be interpretable to enhance LLM task performance?}""We investigate this question in the Open Book Question-Answering domain by supervised fine-tuning LLaMA and Qwen models on four types of reasoning traces: (1) DeepSeek R1 traces, (2) LLM-generated summaries of R1 traces, (3) LLM-generated post-hoc explanations of R1 traces, and (4) algorithmically generated verifiably correct traces. To quantify the trade-off between interpretability and performance, we further conduct a human-subject study with 100 participants rating the interpretability of each trace type. Our results reveal a striking mismatch: while fine-tuning on R1 traces yields the strongest performance, participants judged these traces to be the least interpretable. These findings suggest that it is useful to decouple intermediate tokens from end user interpretability."
Uncertainty estimation in diagnosis generation from large language models: next-word probability is not pre-test probability,2024,4,Phenomenon,Black-box,Medical,Unknown,High,论文发现LLM在诊断概率估计上表现不佳。,"Abstract Objective To evaluate large language models (LLMs) for pre-test diagnostic probability estimation and compare their uncertainty estimation performance with a traditional machine learning classifier. Materials and Methods We assessed 2 instruction-tuned LLMs, Mistral-7B-Instruct and Llama3-70B-chat-hf, on predicting binary outcomes for Sepsis, Arrhythmia, and Congestive Heart Failure (CHF) using electronic health record (EHR) data from 660 patients. Three uncertainty estimation methods—Verbalized Confidence, Token Logits, and LLM Embedding+XGB—were compared against an eXtreme Gradient Boosting (XGB) classifier trained on raw EHR data. Performance metrics included AUROC and Pearson correlation between predicted probabilities. Results The XGB classifier outperformed the LLM-based methods across all tasks. LLM Embedding+XGB showed the closest performance to the XGB baseline, while Verbalized Confidence and Token Logits underperformed. Discussion These findings, consistent across multiple models and demographic groups, highlight the limitations of current LLMs in providing reliable pre-test probability estimations and underscore the need for improved calibration and bias mitigation strategies. Future work should explore hybrid approaches that integrate LLMs with numerical reasoning modules and calibrated embeddings to enhance diagnostic accuracy and ensure fairer predictions across diverse populations. Conclusions LLMs demonstrate potential but currently fall short in estimating diagnostic probabilities compared to traditional machine learning classifiers trained on structured EHR data. Further improvements are needed for reliable clinical use."
Are They All Good? Evaluating the Quality of CoTs in LLM-based Code Generation,2025,3,Phenomenon,Black-box,Code,Unknown,High,分析了1023个失败样本的CoT质量影响因素。,"Large language models (LLMs) have demonstrated impressive performance in code generation, particularly when augmented with chain-of-thought (CoT) prompting techniques. They break down requirements into intermediate reasoning steps, which act as design rationales to guide LLMs in writing code like human programmers. Thus, the quality of these steps is crucial for ensuring the correctness and reliability of the generated code. However, little is known about the quality of CoT generated by LLMs. To what extent can we trust the thoughts generated by LLMs? How good are they? This paper empirically explores the external and internal factors of why LLMs generate unsatisfactory CoTs by analyzing 1,023 failed code samples on two widely used code generation benchmarks. We also evaluate their impact on code generation performance by analyzing 210 CoT-code pairs and refining the unsatisfied CoTs by prompting LLMs. Our study reveals three key findings: (1) External factors (53.60%), such as unclear requirements and lack of context, mainly affect CoT quality, while internal factors (40.10%) stem from LLMs'misunderstanding prompts. (2) Even when CoTs are correct, 18.5% of the generated code contains errors due to instruction-following issues; conversely, 11.90% of correct code is paired with flawed CoTs. (3) Refining low-quality CoTs is feasible, i.e., LLMs improve when given detailed problem descriptions. These findings highlight key challenges in CoT-based code generation and suggest directions for improving LLM reasoning and reliability."
"Probing the Visualization Literacy of Vision Language Models: the Good, the Bad, and the Ugly",2025,3,Phenomenon,White-box,General,Unknown,High,论文通过AG-CAM可视化分析VLMs的内部推理机制。,"Vision Language Models (VLMs) demonstrate promising chart comprehension capabilities. Yet, prior explorations of their visualization literacy have been limited to assessing their response correctness and fail to explore their internal reasoning. To address this gap, we adapted attention-guided class activation maps (AG-CAM) for VLMs, to visualize the influence and importance of input features (image and text) on model responses. Using this approach, we conducted an examination of four open-source (ChartGemma, Janus 1B and 7B, and LLaVA) and two closed-source (GPT-4o, Gemini) models comparing their performance and, for the open-source models, their AG-CAM results. Overall, we found that ChartGemma, a 3B parameter VLM fine-tuned for chart question-answering (QA), outperformed other open-source models and exhibited performance on par with significantly larger closed-source VLMs. We also found that VLMs exhibit spatial reasoning by accurately localizing key chart features, and semantic reasoning by associating visual elements with corresponding data values and query tokens. Our approach is the first to demonstrate the use of AG-CAM on early fusion VLM architectures, which are widely used, and for chart QA. We also show preliminary evidence that these results can align with human reasoning. Our promising open-source VLMs results pave the way for transparent and reproducible research in AI visualization literacy. Code and Supplemental Materials: https://osf.io/fp3rg."
The Geometry of Self-Verification in a Task-Specific Reasoning Model,2025,3,Phenomenon,White-box,General,Unknown,Low,研究模型自我验证机制，发现特定注意力头是关键。,"How do reasoning models verify their own answers? We study this question by training a model using DeepSeek R1's recipe on the CountDown task. We leverage the fact that preference tuning leads to mode collapse, yielding a model that always produces highly structured chain-of-thought sequences. With this setup, we do top-down and bottom-up analyses to reverse-engineer how the model verifies its outputs. Top-down, we find Gated Linear Unit (GLU) weights encoding verification-related tokens, such as ``success'' or ``incorrect''. Bottom-up, we find that ``previous-token heads'' are mainly responsible for self-verification in our setup. Our analyses meet in the middle: drawing inspiration from inter-layer communication channels, we use the identified GLU weights to localize as few as three attention heads that can disable self-verification, pointing to a necessary component of a potentially larger verification circuit. Finally, we verify that similar verification components exist in our base model and a general reasoning DeepSeek-R1 model."
Explaining Puzzle Solutions in Natural Language: An Exploratory Study on 6x6 Sudoku,2025,3,Phenomenon,Black-box,Logic,Unknown,High,论文发现LLMs在解释数独解题过程时缺乏战略推理能力。,"The success of Large Language Models (LLMs) in human-AI collaborative decision-making hinges on their ability to provide trustworthy, gradual, and tailored explanations. Solving complex puzzles, such as Sudoku, offers a canonical example of this collaboration, where clear and customized explanations often hold greater importance than the final solution. In this study, we evaluate the performance of five LLMs in solving and explaining \sixsix{} Sudoku puzzles. While one LLM demonstrates limited success in solving puzzles, none can explain the solution process in a manner that reflects strategic reasoning or intuitive problem-solving. These findings underscore significant challenges that must be addressed before LLMs can become effective partners in human-AI collaborative decision-making."
A Closer Look at Bias and Chain-of-Thought Faithfulness of Large (Vision) Language Models,2025,3,Phenomenon,Black-box,General,Unknown,High,研究发现图像偏见比文本偏见更难被模型表达。,"Chain-of-thought (CoT) reasoning enhances performance of large language models, but questions remain about whether these reasoning traces faithfully reflect the internal processes of the model. We present the first comprehensive study of CoT faithfulness in large vision-language models (LVLMs), investigating how both text-based and previously unexplored image-based biases affect reasoning and bias articulation. Our work introduces a novel, fine-grained evaluation pipeline for categorizing bias articulation patterns, enabling significantly more precise analysis of CoT reasoning than previous methods. This framework reveals critical distinctions in how models process and respond to different types of biases, providing new insights into LVLM CoT faithfulness. Our findings reveal that subtle image-based biases are rarely articulated compared to explicit text-based ones, even in models specialized for reasoning. Additionally, many models exhibit a previously unidentified phenomenon we term ``inconsistent''reasoning - correctly reasoning before abruptly changing answers, serving as a potential canary for detecting biased reasoning from unfaithful CoTs. We then apply the same evaluation pipeline to revisit CoT faithfulness in LLMs across various levels of implicit cues. Our findings reveal that current language-only reasoning models continue to struggle with articulating cues that are not overtly stated."
Auditing Meta-Cognitive Hallucinations in Reasoning Large Language Models,2025,3,Phenomenon,Black-box,General,Unknown,High,研究长链推理中幻觉的因果性和演化路径。,"The development of Reasoning Large Language Models (RLLMs) has significantly improved multi-step reasoning capabilities, but it has also made hallucination problems more frequent and harder to eliminate. While existing approaches mitigate hallucinations through external knowledge integration, model parameter analysis, or self-verification, they often fail to capture how hallucinations emerge and evolve across the reasoning chain. In this work, we study the causality of hallucinations under constrained knowledge domains by auditing the Chain-of-Thought (CoT) trajectory and assessing the model's cognitive confidence in potentially erroneous or biased claims. Our analysis reveals that in long-CoT settings, RLLMs can iteratively reinforce biases and errors through flawed reflective reasoning, eventually leading to hallucinated reasoning paths. Surprisingly, even direct interventions at the origin of hallucinations often fail to reverse their effects, as reasoning chains exhibit'chain disloyalty'-- a resistance to correction and a tendency to preserve flawed logic. Furthermore, we show that existing hallucination detection methods are less reliable and interpretable than previously assumed in complex reasoning scenarios. Unlike methods such as circuit tracing that require access to model internals, our black-box auditing approach supports interpretable long-chain hallucination attribution, offering better generalizability and practical utility. Our code is available at: https://github.com/Winnie-Lian/AHa_Meta_Cognitive"
Large Language Models in Numberland: A Quick Test of Their Numerical Reasoning Abilities,2025,3,Phenomenon,Black-box,Math,Unknown,Low,论文发现LLMs在数值推理中存在脆弱性。,"An essential element of human mathematical reasoning is our number sense -- an abstract understanding of numbers and their relationships -- which allows us to solve problems involving vast number spaces using limited computational resources. Mathematical reasoning of Large Language Models (LLMs) is often tested on high-level problems (such as Olympiad challenges, geometry, word problems, and puzzles), but their low-level number sense remains less explored. We introduce""Numberland,""a 100-problem test to evaluate the numerical reasoning abilities of LLM-based agents. The tasks -- basic operations, advanced calculations (e.g., exponentiation, complex numbers), prime number checks, and the 24 game -- aim to test elementary skills and their integration in solving complex and uncertain problems. We evaluated five LLM-based agents: OpenAI's o1 and o1-mini, Google Gemini, Microsoft Copilot, and Anthropic Claude. They scored 74-95% on the first three tasks that allow deterministic steps to solutions. In the 24 game, which needs trial-and-error search, performance dropped to 10-73%. We tested the top 24 solver (o1 with 73% accuracy) on 25 harder problems, and its score fell to 27%, confirming search as a bottleneck. These results, along with the types of mistakes, suggest a fragile number of LLMs, which is a bit surprising given their prowess in challenging benchmarks. The limits of LLM numerical reasoning highlight the scope of simple, targeted tests to evaluate and explain LLM math skills to ensure safe use."
Prompting in the Dark: Assessing Human Performance in Prompt Engineering for Data Labeling When Gold Labels Are Absent,2025,3,Phenomenon,Black-box,General,Unknown,High,研究发现无标注基准时提示工程效果不稳定,"Millions of users prompt large language models (LLMs) for various tasks, but how good are people at prompt engineering? Do users actually get closer to their desired outcome over multiple iterations of their prompts? These questions are crucial when no gold-standard labels are available to measure progress. This paper investigates a scenario in LLM-powered data labeling, “prompting in the dark,” where users iteratively prompt LLMs to label data without using manually-labeled benchmarks. We developed PromptingSheet, a Google Sheets add-on that enables users to compose, revise, and iteratively label data through spreadsheets. Through a study with 20 participants, we found that prompting in the dark was highly unreliable—only 9 participants improved labeling accuracy after four or more iterations. Automated prompt optimization tools like DSPy also struggled when few gold labels were available. Our findings highlight the importance of gold labels and the needs, as well as the risks, of automated support in human prompt engineering, providing insights for future tool design."
"Can LLMs Help Uncover Insights about LLMs? A Large-Scale, Evolving Literature Analysis of Frontier LLMs",2025,3,Phenomenon,Black-box,General,Unknown,Low,论文发现上下文示例对不同任务效果不同。,"The surge of LLM studies makes synthesizing their findings challenging. Analysis of experimental results from literature can uncover important trends across studies, but the time-consuming nature of manual data extraction limits its use. Our study presents a semi-automated approach for literature analysis that accelerates data extraction using LLMs. It automatically identifies relevant arXiv papers, extracts experimental results and related attributes, and organizes them into a structured dataset, LLMEvalDB. We then conduct an automated literature analysis of frontier LLMs, reducing the effort of paper surveying and data extraction by more than 93% compared to manual approaches. We validate LLMEvalDB by showing that it reproduces key findings from a recent manual analysis of Chain-of-Thought (CoT) reasoning and also uncovers new insights that go beyond it, showing, for example, that in-context examples benefit coding&multimodal tasks but offer limited gains in math reasoning tasks compared to zero-shot CoT. Our automatically updatable dataset enables continuous tracking of target models by extracting evaluation studies as new data becomes available. Through LLMEvalDB and empirical analysis, we provide insights into LLMs while facilitating ongoing literature analyses of their behavior."
Mind Your Server: A Systematic Study of Parasitic Toolchain Attacks on the MCP Ecosystem,2025,3,Phenomenon,Black-box,General,Unknown,High,论文揭示了MCP生态系统中新型寄生工具链攻击现象。,"Large language models (LLMs) are increasingly integrated with external systems through the Model Context Protocol (MCP), which standardizes tool invocation and has rapidly become a backbone for LLM-powered applications. While this paradigm enhances functionality, it also introduces a fundamental security shift: LLMs transition from passive information processors to autonomous orchestrators of task-oriented toolchains, expanding the attack surface, elevating adversarial goals from manipulating single outputs to hijacking entire execution flows. In this paper, we reveal a new class of attacks, Parasitic Toolchain Attacks, instantiated as MCP Unintended Privacy Disclosure (MCP-UPD). These attacks require no direct victim interaction; instead, adversaries embed malicious instructions into external data sources that LLMs access during legitimate tasks. The malicious logic infiltrates the toolchain and unfolds in three phases: Parasitic Ingestion, Privacy Collection, and Privacy Disclosure, culminating in stealthy exfiltration of private data. Our root cause analysis reveals that MCP lacks both context-tool isolation and least-privilege enforcement, enabling adversarial instructions to propagate unchecked into sensitive tool invocations. To assess the severity, we design MCP-SEC and conduct the first large-scale security census of the MCP ecosystem, analyzing 12,230 tools across 1,360 servers. Our findings show that the MCP ecosystem is rife with exploitable gadgets and diverse attack methods, underscoring systemic risks in MCP platforms and the urgent need for defense mechanisms in LLM-integrated environments."
Pause Tokens Strictly Increase the Expressivity of Constant-Depth Transformers,2025,3,Phenomenon,White-box,General,Unknown,Low,论文研究了pause tokens对Transformer表达能力的理论提升。,"Pause tokens, simple filler symbols such as""..."", consistently improve Transformer performance on both language and mathematical tasks, yet their theoretical effect remains unexplained. We provide the first formal separation result, proving that adding pause tokens to constant-depth, logarithmic-width Transformers strictly increases their computational expressivity. With bounded-precision activations, Transformers without pause tokens compute only a strict subset of $\mathsf{AC}^0$ functions, while adding a polynomial number of pause tokens allows them to express the entire class. For logarithmic-precision Transformers, we show that adding pause tokens achieves expressivity equivalent to $\mathsf{TC}^0$, matching known upper bounds. Empirically, we demonstrate that two-layer causally masked Transformers can learn parity when supplied with pause tokens, a function that they appear unable to learn without them. Our results provide a rigorous theoretical explanation for prior empirical findings, clarify how pause tokens interact with width, depth, and numeric precision, and position them as a distinct mechanism, complementary to chain-of-thought prompting, for enhancing Transformer reasoning."
Normative conflicts and shallow AI alignment,2025,3,Phenomenon,Black-box,General,Unknown,High,论文揭示了LLMs在规范冲突中的脆弱性。,"The progress of AI systems such as large language models (LLMs) raises increasingly pressing concerns about their safe deployment. This paper examines the value alignment problem for LLMs, arguing that current alignment strategies are fundamentally inadequate to prevent misuse. Despite ongoing efforts to instill norms such as helpfulness, honesty, and harmlessness in LLMs through fine-tuning based on human preferences, they remain vulnerable to adversarial attacks that exploit conflicts between these norms. I argue that this vulnerability reflects a fundamental limitation of existing alignment methods: they reinforce shallow behavioral dispositions rather than endowing LLMs with a genuine capacity for normative deliberation. Drawing from on research in moral psychology, I show how humans’ ability to engage in deliberative reasoning enhances their resilience against similar adversarial tactics. LLMs, by contrast, lack a robust capacity to detect and rationally resolve normative conflicts, leaving them susceptible to manipulation; even recent advances in reasoning-focused LLMs have not addressed this vulnerability. This “shallow alignment” problem carries significant implications for AI safety and regulation, suggesting that current approaches are insufficient for mitigating potential harms posed by increasingly capable AI systems."
LLMs Can Covertly Sandbag on Capability Evaluations Against Chain-of-Thought Monitoring,2025,3,Phenomenon,Black-box,General,Unknown,Low,论文揭示了模型可绕过思维链监控的隐蔽策略。,"Trustworthy evaluations of dangerous capabilities are increasingly crucial for determining whether an AI system is safe to deploy. One empirically demonstrated threat is sandbagging - the strategic underperformance on evaluations by AI models or their developers. A promising defense is to monitor a model's chain-of-thought (CoT) reasoning, as this could reveal its intentions and plans. In this work, we measure the ability of models to sandbag on dangerous capability evaluations against a CoT monitor by prompting them to sandbag while being either monitor-oblivious or monitor-aware. We show that both frontier models and small open-sourced models can covertly sandbag against CoT monitoring 0-shot without hints. However, they cannot yet do so reliably: they bypass the monitor 16-36% of the time when monitor-aware, conditioned on sandbagging successfully. We qualitatively analyzed the uncaught CoTs to understand why the monitor failed. We reveal a rich attack surface for CoT monitoring and contribute five covert sandbagging policies generated by models. These results inform potential failure modes of CoT monitoring and may help build more diverse sandbagging model organisms."
A Hypothesis-Driven Framework for the Analysis of Self-Rationalising Models,2024,3,Phenomenon,Black-box,General,Unknown,High,论文探讨了LLM生成解释与预测的忠实度问题。,"The self-rationalising capabilities of LLMs are appealing because the generated explanations can give insights into the plausibility of the predictions. However, how faithful the explanations are to the predictions is questionable, raising the need to explore the patterns behind them further.To this end, we propose a hypothesis-driven statistical framework. We use a Bayesian network to implement a hypothesis about how a task (in our example, natural language inference) is solved, and its internal states are translated into natural language with templates. Those explanations are then compared to LLM-generated free-text explanations using automatic and human evaluations. This allows us to judge how similar the LLM’s and the Bayesian network’s decision processes are. We demonstrate the usage of our framework with an example hypothesis and two realisations in Bayesian networks. The resulting models do not exhibit a strong similarity to GPT-3.5. We discuss the implications of this as well as the framework’s potential to approximate LLM decisions better in future work."
Exploring the Robustness of Model-Graded Evaluations and Automated Interpretability,2023,3,Phenomenon,Black-box,General,Unknown,High,论文发现模型评估易受注入攻击影响。,"There has been increasing interest in evaluations of language models for a variety of risks and characteristics. Evaluations relying on natural language understanding for grading can often be performed at scale by using other language models. We test the robustness of these model-graded evaluations to injections on different datasets including a new Deception Eval. These injections resemble direct communication between the testee and the evaluator to change their grading. We extrapolate that future, more intelligent models might manipulate or cooperate with their evaluation model. We find significant susceptibility to these injections in state-of-the-art commercial models on all examined evaluations. Furthermore, similar injections can be used on automated interpretability frameworks to produce misleading model-written explanations. The results inspire future work and should caution against unqualified trust in evaluations and automated interpretability."
