Title,Year,Citations,Category,Type,Domain,Tradeoff,Cost,Reasoning,Abstract
OlympicArena: Benchmarking Multi-discipline Cognitive Reasoning for Superintelligent AI,2024,68,Benchmark,Black-box,General,Unknown,High,论文主要构建评测基准，未直接涉及CoT忠实度。,"The evolution of Artificial Intelligence (AI) has been significantly accelerated by advancements in Large Language Models (LLMs) and Large Multimodal Models (LMMs), gradually showcasing potential cognitive reasoning abilities in problem-solving and scientific discovery (i.e., AI4Science) once exclusive to human intellect. To comprehensively evaluate current models' performance in cognitive reasoning abilities, we introduce OlympicArena, which includes 11,163 bilingual problems across both text-only and interleaved text-image modalities. These challenges encompass a wide range of disciplines spanning seven fields and 62 international Olympic competitions, rigorously examined for data leakage. We argue that the challenges in Olympic competition problems are ideal for evaluating AI's cognitive reasoning due to their complexity and interdisciplinary nature, which are essential for tackling complex scientific challenges and facilitating discoveries. Beyond evaluating performance across various disciplines using answer-only criteria, we conduct detailed experiments and analyses from multiple perspectives. We delve into the models' cognitive reasoning abilities, their performance across different modalities, and their outcomes in process-level evaluations, which are vital for tasks requiring complex reasoning with lengthy solutions. Our extensive evaluations reveal that even advanced models like GPT-4o only achieve a 39.97% overall accuracy, illustrating current AI limitations in complex reasoning and multimodal integration. Through the OlympicArena, we aim to advance AI towards superintelligence, equipping it to address more complex challenges in science and beyond. We also provide a comprehensive set of resources to support AI research, including a benchmark dataset, an open-source annotation platform, a detailed evaluation tool, and a leaderboard with automatic submission features."
Towards LogiGLUE: A Brief Survey and A Benchmark for Analyzing Logical Reasoning Capabilities of Language Models,2023,43,Benchmark,Black-box,Logic,Unknown,High,论文主要关注逻辑推理能力评估，未直接涉及CoT忠实度。,"Logical reasoning is fundamental for humans yet presents a substantial challenge in the domain of Artificial Intelligence. Initially, researchers used Knowledge Representation and Reasoning (KR) systems that did not scale and required non trivial manual effort. Recently, the emergence of large language models (LLMs) has demonstrated the ability to overcome various limitations of formal Knowledge Representation (KR) systems. Consequently, there is a growing interest in using LLMs for logical reasoning via natural language. This work strives to understand the proficiency of LLMs in logical reasoning by offering a brief review of the latest progress in this area; with a focus on the logical reasoning datasets, tasks, and the methods adopted to utilize LLMs for reasoning. To offer a thorough analysis, we have compiled a benchmark titled LogiGLUE. This includes 24 varied datasets encompassing deductive, abductive, and inductive reasoning. We have standardized these datasets into Seq2Seq tasks to facilitate straightforward training and evaluation for future research. Utilizing LogiGLUE as a foundation, we have trained an instruction fine tuned language model, resulting in LogiT5. We study single task training, multi task training, and a chain of thought knowledge distillation fine tuning technique to assess the performance of model across the different logical reasoning categories. By this comprehensive process, we aim to shed light on the capabilities and potential pathways for enhancing logical reasoning proficiency in LLMs, paving the way for more advanced and nuanced developments in this critical field."
V-STaR: Benchmarking Video-LLMs on Video Spatio-Temporal Reasoning,2025,22,Benchmark,Black-box,Logic,Unknown,High,论文提出评估视频LLM时空推理能力的基准。,"Human processes video reasoning in a sequential spatio-temporal reasoning logic, we first identify the relevant frames (""when"") and then analyse the spatial relationships (""where"") between key objects, and finally leverage these relationships to draw inferences (""what""). However, can Video Large Language Models (Video-LLMs) also""reason through a sequential spatio-temporal logic""in videos? Existing Video-LLM benchmarks primarily focus on assessing object presence, neglecting relational reasoning. Consequently, it is difficult to measure whether a model truly comprehends object interactions (actions/events) in videos or merely relies on pre-trained""memory""of co-occurrences as biases in generating answers. In this work, we introduce a Video Spatio-Temporal Reasoning (V-STaR) benchmark to address these shortcomings. The key idea is to decompose video understanding into a Reverse Spatio-Temporal Reasoning (RSTR) task that simultaneously evaluates what objects are present, when events occur, and where they are located while capturing the underlying Chain-of-thought (CoT) logic. To support this evaluation, we construct a dataset to elicit the spatial-temporal reasoning process of Video-LLMs. It contains coarse-to-fine CoT questions generated by a semi-automated GPT-4-powered pipeline, embedding explicit reasoning chains to mimic human cognition. Experiments from 14 Video-LLMs on our V-STaR reveal significant gaps between current Video-LLMs and the needs for robust and consistent spatio-temporal reasoning."
SocialStigmaQA: A Benchmark to Uncover Stigma Amplification in Generative Language Models,2023,20,Benchmark,Black-box,General,Unknown,High,论文发现生成模型存在社会偏见放大现象。,"Current datasets for unwanted social bias auditing are limited to studying protected demographic features such as race and gender. In this work, we introduce a comprehensive benchmark that is meant to capture the amplification of social bias, via stigmas, in generative language models. Taking inspiration from social science research, we start with a documented list of 93 US-centric stigmas and curate a question-answering (QA) dataset which involves simple social situations. Our benchmark, SocialStigmaQA, contains roughly 10K prompts, with a variety of prompt styles, carefully constructed to systematically test for both social bias and model robustness. We present results for SocialStigmaQA with two open source generative language models and we find that the proportion of socially biased output ranges from 45% to 59% across a variety of decoding strategies and prompting styles. We demonstrate that the deliberate design of the templates in our benchmark (e.g., adding biasing text to the prompt or using different verbs that change the answer that indicates bias) impacts the model tendencies to generate socially biased output. Additionally, through manual evaluation, we discover problematic patterns in the generated chain-of-thought output that range from subtle bias to lack of reasoning.

Warning: This paper contains examples of text which are toxic, biased, and potentially harmful."
BizBench: A Quantitative Reasoning Benchmark for Business and Finance,2023,19,Benchmark,Black-box,Code,Unknown,High,论文提出了BizBench评估模型在金融领域的定量推理能力。,"Answering questions within business and finance requires reasoning, precision, and a wide-breadth of technical knowledge. Together, these requirements make this domain difficult for large language models (LLMs). We introduce BizBench, a benchmark for evaluating models' ability to reason about realistic financial problems. BizBench comprises eight quantitative reasoning tasks, focusing on question-answering (QA) over financial data via program synthesis. We include three financially-themed code-generation tasks from newly collected and augmented QA data. Additionally, we isolate the reasoning capabilities required for financial QA: reading comprehension of financial text and tables for extracting intermediate values, and understanding financial concepts and formulas needed to calculate complex solutions. Collectively, these tasks evaluate a model's financial background knowledge, ability to parse financial documents, and capacity to solve problems with code. We conduct an in-depth evaluation of open-source and commercial LLMs, comparing and contrasting the behavior of code-focused and language-focused models. We demonstrate that the current bottleneck in performance is due to LLMs' limited business and financial understanding, highlighting the value of a challenging benchmark for quantitative reasoning within this domain."
COMPL-AI Framework: A Technical Interpretation and LLM Benchmarking Suite for the EU Artificial Intelligence Act,2024,18,Benchmark,Black-box,General,Unknown,Low,论文聚焦AI法案技术化框架，未直接涉及思维链忠实度评估。,"The EU's Artificial Intelligence Act (AI Act) is a significant step towards responsible AI development, but lacks clear technical interpretation, making it difficult to assess models' compliance. This work presents COMPL-AI, a comprehensive framework consisting of (i) the first technical interpretation of the EU AI Act, translating its broad regulatory requirements into measurable technical requirements, with the focus on large language models (LLMs), and (ii) an open-source Act-centered benchmarking suite, based on thorough surveying and implementation of state-of-the-art LLM benchmarks. By evaluating 12 prominent LLMs in the context of COMPL-AI, we reveal shortcomings in existing models and benchmarks, particularly in areas like robustness, safety, diversity, and fairness. This work highlights the need for a shift in focus towards these aspects, encouraging balanced development of LLMs and more comprehensive regulation-aligned benchmarks. Simultaneously, COMPL-AI for the first time demonstrates the possibilities and difficulties of bringing the Act's obligations to a more concrete, technical level. As such, our work can serve as a useful first step towards having actionable recommendations for model providers, and contributes to ongoing efforts of the EU to enable application of the Act, such as the drafting of the GPAI Code of Practice."
ElecBench: a Power Dispatch Evaluation Benchmark for Large Language Models,2024,17,Benchmark,Black-box,General,Unknown,High,论文提出了电力行业LLM评估基准，包含多维度指标。,"In response to the urgent demand for grid stability and the complex challenges posed by renewable energy integration and electricity market dynamics, the power sector increasingly seeks innovative technological solutions. In this context, large language models (LLMs) have become a key technology to improve efficiency and promote intelligent progress in the power sector with their excellent natural language processing, logical reasoning, and generalization capabilities. Despite their potential, the absence of a performance evaluation benchmark for LLM in the power sector has limited the effective application of these technologies. Addressing this gap, our study introduces""ElecBench"", an evaluation benchmark of LLMs within the power sector. ElecBench aims to overcome the shortcomings of existing evaluation benchmarks by providing comprehensive coverage of sector-specific scenarios, deepening the testing of professional knowledge, and enhancing decision-making precision. The framework categorizes scenarios into general knowledge and professional business, further divided into six core performance metrics: factuality, logicality, stability, security, fairness, and expressiveness, and is subdivided into 24 sub-metrics, offering profound insights into the capabilities and limitations of LLM applications in the power sector. To ensure transparency, we have made the complete test set public, evaluating the performance of eight LLMs across various scenarios and metrics. ElecBench aspires to serve as the standard benchmark for LLM applications in the power sector, supporting continuous updates of scenarios, metrics, and models to drive technological progress and application."
ExplainCPE: A Free-text Explanation Benchmark of Chinese Pharmacist Examination,2023,14,Benchmark,Black-box,General,Unknown,High,论文分析了LLMs在医学解释中的错误和局限性。,"As ChatGPT and GPT-4 spearhead the development of Large Language Models (LLMs), more researchers are investigating their performance across various tasks. But more research needs to be done on the interpretability capabilities of LLMs, that is, the ability to generate reasons after an answer has been given. Existing explanation datasets are mostly English-language general knowledge questions, which leads to insufficient thematic and linguistic diversity. To address the language bias and lack of medical resources in generating rationales QA datasets, we present ExplainCPE (over 7k instances), a challenging medical benchmark in Simplified Chinese. We analyzed the errors of ChatGPT and GPT-4, pointing out the limitations of current LLMs in understanding text and computational reasoning. During the experiment, we also found that different LLMs have different preferences for in-context learning. ExplainCPE presents a significant challenge, but its potential for further investigation is promising, and it can be used to evaluate the ability of a model to generate explanations. AI safety and trustworthiness need more attention, and this work makes the first step to explore the medical interpretability of LLMs.The dataset is available at https://github.com/HITsz-TMG/ExplainCPE."
BeHonest: Benchmarking Honesty in Large Language Models,2024,11,Benchmark,Black-box,General,Unknown,Low,论文提出评估模型诚实度的基准BeHonest。,"Previous works on Large Language Models (LLMs) have mainly focused on evaluating their helpfulness or harmlessness. However, honesty, another crucial alignment criterion, has received relatively less attention. Dishonest behaviors in LLMs, such as spreading misinformation and defrauding users, present severe risks that intensify as these models approach superintelligent levels. Enhancing honesty in LLMs addresses critical limitations and helps uncover latent capabilities that are not readily expressed. This underscores the urgent need for reliable methods and benchmarks to effectively ensure and evaluate the honesty of LLMs. In this paper, we introduce BeHonest, a pioneering benchmark specifically designed to assess honesty in LLMs comprehensively. BeHonest evaluates three essential aspects of honesty: awareness of knowledge boundaries, avoidance of deceit, and consistency in responses. Building on this foundation, we designed 10 scenarios to evaluate and analyze 9 popular LLMs on the market, including both closed-source and open-source models from different model families with varied model sizes. Our findings indicate that there is still significant room for improvement in the honesty of LLMs. We encourage the AI community to prioritize honesty alignment in these models, which can harness their full potential to benefit society while preventing them from causing harm through deception or inconsistency. Our benchmark and code can be found at: \url{https://github.com/GAIR-NLP/BeHonest}."
Atomic-to-Compositional Generalization for Mobile Agents with A New Benchmark and Scheduling System,2025,6,Benchmark,Black-box,General,Positive,Low,论文提出轻量级调度系统，提升任务成功率且不显著增加开销。,"Autonomous agents powered by multimodal large language models have been developed to facilitate task execution on mobile devices. However, prior work has predominantly focused on atomic tasks -- such as shot-chain execution tasks and single-screen grounding tasks -- while overlooking the generalization to compositional tasks, which are indispensable for real-world applications. This work introduces UI-NEXUS, a comprehensive benchmark designed to evaluate mobile agents on three categories of compositional operations: Simple Concatenation, Context Transition, and Deep Dive. UI-NEXUS supports interactive evaluation in 20 fully controllable local utility app environments, as well as 30 online Chinese and English service apps. It comprises 100 interactive task templates with an average optimal step count of 14.05. Experimental results across a range of mobile agents with agentic workflow or agent-as-a-model show that UI-NEXUS presents significant challenges. Specifically, existing agents generally struggle to balance performance and efficiency, exhibiting representative failure modes such as under-execution, over-execution, and attention drift, causing visible atomic-to-compositional generalization gap. Inspired by these findings, we propose AGENT-NEXUS, a lightweight and efficient scheduling system to tackle compositional mobile tasks. AGENT-NEXUS extrapolates the abilities of existing mobile agents by dynamically decomposing long-horizon tasks to a series of self-contained atomic subtasks. AGENT-NEXUS achieves 24% to 40% task success rate improvement for existing mobile agents on compositional operation tasks within the UI-NEXUS benchmark without significantly sacrificing inference overhead. The demo video, dataset, and code are available on the project page at https://ui-nexus.github.io."
JBBQ: Japanese Bias Benchmark for Analyzing Social Biases in Large Language Models,2024,5,Benchmark,Black-box,General,Unknown,High,使用思维链提示减少偏见，但需多次推理。,"With the development of large language models (LLMs), social biases in these LLMs have become a pressing issue. Although there are various benchmarks for social biases across languages, the extent to which Japanese LLMs exhibit social biases has not been fully investigated. In this study, we construct the Japanese Bias Benchmark dataset for Question Answering (JBBQ) based on the English bias benchmark BBQ, with analysis of social biases in Japanese LLMs. The results show that while current open Japanese LLMs with more parameters show improved accuracies on JBBQ, their bias scores increase. In addition, prompts with a warning about social biases and chain-of-thought prompting reduce the effect of biases in model outputs, but there is room for improvement in extracting the correct evidence from contexts in Japanese. Our dataset is available at https://github.com/ynklab/JBBQ_data."
Standard Benchmarks Fail -- Auditing LLM Agents in Finance Must Prioritize Risk,2025,2,Benchmark,Black-box,General,Unknown,High,论文强调金融领域LLM的风险评估而非性能指标。,"Standard benchmarks fixate on how well large language model (LLM) agents perform in finance, yet say little about whether they are safe to deploy. We argue that accuracy metrics and return-based scores provide an illusion of reliability, overlooking vulnerabilities such as hallucinated facts, stale data, and adversarial prompt manipulation. We take a firm position: financial LLM agents should be evaluated first and foremost on their risk profile, not on their point-estimate performance. Drawing on risk-engineering principles, we outline a three-level agenda: model, workflow, and system, for stress-testing LLM agents under realistic failure modes. To illustrate why this shift is urgent, we audit six API-based and open-weights LLM agents on three high-impact tasks and uncover hidden weaknesses that conventional benchmarks miss. We conclude with actionable recommendations for researchers, practitioners, and regulators: audit risk-aware metrics in future studies, publish stress scenarios alongside datasets, and treat ``safety budget'' as a primary success criterion. Only by redefining what ``good'' looks like can the community responsibly advance AI-driven finance."
Beyond Chains of Thought: Benchmarking Latent-Space Reasoning Abilities in Large Language Models,2025,2,Benchmark,Black-box,General,Unknown,Low,研究揭示了LLM潜在空间推理能力的存在。,"Large language models (LLMs) can perform reasoning computations both internally within their latent space and externally by generating explicit token sequences like chains of thought. Significant progress in enhancing reasoning abilities has been made by scaling test-time compute. However, understanding and quantifying model-internal reasoning abilities - the inferential""leaps""models make between individual token predictions - remains crucial. This study introduces a benchmark (n = 4,000 items) designed to quantify model-internal reasoning in different domains. We achieve this by having LLMs indicate the correct solution to reasoning problems not through descriptive text, but by selecting a specific language of their initial response token that is different from English, the benchmark language. This not only requires models to reason beyond their context window, but also to overrise their default tendency to respond in the same language as the prompt, thereby posing an additional cognitive strain. We evaluate a set of 18 LLMs, showing significant performance variations, with GPT-4.5 achieving the highest accuracy (74.7%), outperforming models like Grok-2 (67.2%), and Llama 3.1 405B (65.6%). Control experiments and difficulty scaling analyses suggest that while LLMs engage in internal reasoning, we cannot rule out heuristic exploitations under certain conditions, marking an area for future investigation. Our experiments demonstrate that LLMs can""think""via latent-space computations, revealing model-internal inference strategies that need further understanding, especially regarding safety-related concerns such as covert planning, goal-seeking, or deception emerging without explicit token traces."
MedOmni-45°: A Safety-Performance Benchmark for Reasoning-Oriented LLMs in Medicine,2025,2,Benchmark,Black-box,General,Unknown,High,论文提出了CoT-Faithfulness指标评估推理忠实度。,"With the increasing use of large language models (LLMs) in medical decision-support, it is essential to evaluate not only their final answers but also the reliability of their reasoning. Two key risks are Chain-of-Thought (CoT) faithfulness -- whether reasoning aligns with responses and medical facts -- and sycophancy, where models follow misleading cues over correctness. Existing benchmarks often collapse such vulnerabilities into single accuracy scores. To address this, we introduce MedOmni-45 Degrees, a benchmark and workflow designed to quantify safety-performance trade-offs under manipulative hint conditions. It contains 1,804 reasoning-focused medical questions across six specialties and three task types, including 500 from MedMCQA. Each question is paired with seven manipulative hint types and a no-hint baseline, producing about 27K inputs. We evaluate seven LLMs spanning open- vs. closed-source, general-purpose vs. medical, and base vs. reasoning-enhanced models, totaling over 189K inferences. Three metrics -- Accuracy, CoT-Faithfulness, and Anti-Sycophancy -- are combined into a composite score visualized with a 45 Degrees plot. Results show a consistent safety-performance trade-off, with no model surpassing the diagonal. The open-source QwQ-32B performs closest (43.81 Degrees), balancing safety and accuracy but not leading in both. MedOmni-45 Degrees thus provides a focused benchmark for exposing reasoning vulnerabilities in medical LLMs and guiding safer model development."
WakenLLM: Evaluating Reasoning Potential and Stability in LLMs via Fine-Grained Benchmarking,2025,2,Benchmark,Black-box,General,Unknown,High,研究聚焦LLM输出Unknown的模糊感知现象。,"Large Language Models (LLMs) frequently output the label Unknown in reasoning tasks, where two scenarios may appear: (i) an input sample is genuinely unverifiable, but the model cannot understand why; and (ii) a verifiable problem that the model fails to solve, thus outputs Unknown. We refer to these cases collectively as the Vague Perception phenomenon. Current evaluations focus on whether such answers are honest, rather than analyzing the limits of LLM reasoning. To address this, we introduce WakenLLM, a framework that quantifies the portion of Unknown output attributable to model incapacity and evaluates whether stimulation can convert them into either correct answers (verifiable) or justified (unverifiable) responses with valid reasoning. Our method offers a clearer picture of the limits of LLM reasoning and the potential for corrections across various datasets. Comprehensive experiments on six LLMs suggest that, without any training or parameter revision, LLMs can achieve up to a 68.53% accuracy improvement on Vague Perception samples through guided understanding. Our work reveals that current baseline methods only activate a small portion of LLMs'reasoning potential, indicating considerable unexplored capacity. This extends the theoretical upper bounds of reasoning accuracy in LLMs. Consequently, this study deepens our understanding of the latent reasoning capacity of LLMs and offers a new perspective on addressing the Vague Perception phenomenon."
