Title,Year,Citations,Category,Type,Domain,Tradeoff,Cost,Reasoning,Abstract
Large Language Models are not Fair Evaluators,2023,761,Phenomenon,Black-box,General,Unknown,Low,发现LLM评估存在顺序偏差现象。,"In this paper, we uncover a systematic bias in the evaluation paradigm of adopting large language models~(LLMs), e.g., GPT-4, as a referee to score and compare the quality of responses generated by candidate models. We find that the quality ranking of candidate responses can be easily hacked by simply altering their order of appearance in the context. This manipulation allows us to skew the evaluation result, making one model appear considerably superior to the other, e.g., Vicuna-13B could beat ChatGPT on 66 over 80 tested queries with ChatGPT as an evaluator. To address this issue, we propose a calibration framework with three simple yet effective strategies: 1) Multiple Evidence Calibration, which requires the evaluator model to generate multiple evaluation evidence before assigning ratings; 2) Balanced Position Calibration, which aggregates results across various orders to determine the final score; 3) Human-in-the-Loop Calibration, which introduces a balanced position diversity entropy to measure the difficulty of each example and seeks human assistance when needed. We also manually annotate the""win/tie/lose""outcomes of responses from ChatGPT and Vicuna-13B in the Vicuna Benchmark's question prompt, and extensive experiments demonstrate that our approach successfully mitigates evaluation bias, resulting in closer alignment with human judgments. We release our code and human annotation at \url{https://github.com/i-Eval/FairEval} to facilitate future research."
Language Models Don't Always Say What They Think: Unfaithful Explanations in Chain-of-Thought Prompting,2023,675,Phenomenon,Black-box,General,Unknown,Low,发现CoT解释可能误导模型真实推理过程。,"Large Language Models (LLMs) can achieve strong performance on many tasks by producing step-by-step reasoning before giving a final output, often referred to as chain-of-thought reasoning (CoT). It is tempting to interpret these CoT explanations as the LLM's process for solving a task. This level of transparency into LLMs' predictions would yield significant safety benefits. However, we find that CoT explanations can systematically misrepresent the true reason for a model's prediction. We demonstrate that CoT explanations can be heavily influenced by adding biasing features to model inputs--e.g., by reordering the multiple-choice options in a few-shot prompt to make the answer always""(A)""--which models systematically fail to mention in their explanations. When we bias models toward incorrect answers, they frequently generate CoT explanations rationalizing those answers. This causes accuracy to drop by as much as 36% on a suite of 13 tasks from BIG-Bench Hard, when testing with GPT-3.5 from OpenAI and Claude 1.0 from Anthropic. On a social-bias task, model explanations justify giving answers in line with stereotypes without mentioning the influence of these social biases. Our findings indicate that CoT explanations can be plausible yet misleading, which risks increasing our trust in LLMs without guaranteeing their safety. Building more transparent and explainable systems will require either improving CoT faithfulness through targeted efforts or abandoning CoT in favor of alternative methods."
Towards Understanding Sycophancy in Language Models,2023,439,Phenomenon,Black-box,General,Unknown,Low,研究AI助手在人类反馈下的迎合行为。,"Human feedback is commonly utilized to finetune AI assistants. But human feedback may also encourage model responses that match user beliefs over truthful ones, a behaviour known as sycophancy. We investigate the prevalence of sycophancy in models whose finetuning procedure made use of human feedback, and the potential role of human preference judgments in such behavior. We first demonstrate that five state-of-the-art AI assistants consistently exhibit sycophancy across four varied free-form text-generation tasks. To understand if human preferences drive this broadly observed behavior, we analyze existing human preference data. We find that when a response matches a user's views, it is more likely to be preferred. Moreover, both humans and preference models (PMs) prefer convincingly-written sycophantic responses over correct ones a non-negligible fraction of the time. Optimizing model outputs against PMs also sometimes sacrifices truthfulness in favor of sycophancy. Overall, our results indicate that sycophancy is a general behavior of state-of-the-art AI assistants, likely driven in part by human preference judgments favoring sycophantic responses."
Gender bias and stereotypes in Large Language Models,2023,342,Phenomenon,Black-box,General,Unknown,Low,研究揭示了LLMs在性别偏见上的现象。,"Large Language Models (LLMs) have made substantial progress in the past several months, shattering state-of-the-art benchmarks in many domains. This paper investigates LLMs’ behavior with respect to gender stereotypes, a known issue for prior models. We use a simple paradigm to test the presence of gender bias, building on but differing from WinoBias, a commonly used gender bias dataset, which is likely to be included in the training data of current LLMs. We test four recently published LLMs and demonstrate that they express biased assumptions about men and women’s occupations. Our contributions in this paper are as follows: (a) LLMs are 3-6 times more likely to choose an occupation that stereotypically aligns with a person’s gender; (b) these choices align with people’s perceptions better than with the ground truth as reflected in official job statistics; (c) LLMs in fact amplify the bias beyond what is reflected in perceptions or the ground truth; (d) LLMs ignore crucial ambiguities in sentence structure 95% of the time in our study items, but when explicitly prompted, they recognize the ambiguity; (e) LLMs provide explanations for their choices that are factually inaccurate and likely obscure the true reason behind their predictions. That is, they provide rationalizations of their biased behavior. This highlights a key property of these models: LLMs are trained on imbalanced datasets; as such, even with the recent successes of reinforcement learning with human feedback, they tend to reflect those imbalances back at us. As with other types of societal biases, we suggest that LLMs must be carefully tested to ensure that they treat minoritized individuals and communities equitably."
Measuring Faithfulness in Chain-of-Thought Reasoning,2023,292,Phenomenon,Black-box,General,Unknown,Low,研究探讨了CoT忠实度的现象。,"Large language models (LLMs) perform better when they produce step-by-step,""Chain-of-Thought""(CoT) reasoning before answering a question, but it is unclear if the stated reasoning is a faithful explanation of the model's actual reasoning (i.e., its process for answering the question). We investigate hypotheses for how CoT reasoning may be unfaithful, by examining how the model predictions change when we intervene on the CoT (e.g., by adding mistakes or paraphrasing it). Models show large variation across tasks in how strongly they condition on the CoT when predicting their answer, sometimes relying heavily on the CoT and other times primarily ignoring it. CoT's performance boost does not seem to come from CoT's added test-time compute alone or from information encoded via the particular phrasing of the CoT. As models become larger and more capable, they produce less faithful reasoning on most tasks we study. Overall, our results suggest that CoT can be faithful if the circumstances such as the model size and task are carefully chosen."
XSTest: A Test Suite for Identifying Exaggerated Safety Behaviours in Large Language Models,2023,245,Phenomenon,Black-box,General,Unknown,Low,论文发现模型存在过度安全行为的问题。,"Without proper safeguards, large language models will readily follow malicious instructions and generate toxic content. This risk motivates safety efforts such as red-teaming and large-scale feedback learning, which aim to make models both helpful and harmless. However, there is a tension between these two objectives, since harmlessness requires models to refuse to comply with unsafe prompts, and thus not be helpful. Recent anecdotal evidence suggests that some models may have struck a poor balance, so that even clearly safe prompts are refused if they use similar language to unsafe prompts or mention sensitive topics. In this paper, we introduce a new test suite called XSTest to identify such eXaggerated Safety behaviours in a systematic way. XSTest comprises 250 safe prompts across ten prompt types that well-calibrated models should not refuse to comply with, and 200 unsafe prompts as contrasts that models, for most applications, should refuse. We describe XSTest’s creation and composition, and then use the test suite to highlight systematic failure modes in state-of-the-art language models as well as more general challenges in building safer language models."
"On Second Thought, Let’s Not Think Step by Step! Bias and Toxicity in Zero-Shot Reasoning",2022,233,Phenomenon,Black-box,General,Unknown,Low,发现零样本CoT在敏感领域增加有害输出。,"Generating a Chain of Thought (CoT) has been shown to consistently improve large language model (LLM) performance on a wide range of NLP tasks. However, prior work has mainly focused on logical reasoning tasks (e.g. arithmetic, commonsense QA); it remains unclear whether improvements hold for more diverse types of reasoning, especially in socially situated contexts. Concretely, we perform a controlled evaluation of zero-shot CoT across two socially sensitive domains: harmful questions and stereotype benchmarks. We find that zero-shot CoT reasoning in sensitive domains significantly increases a model’s likelihood to produce harmful or undesirable output, with trends holding across different prompt formats and model variants. Furthermore, we show that harmful CoTs increase with model size, but decrease with improved instruction following. Our work suggests that zero-shot CoT should be used with caution on socially important tasks, especially when marginalized groups or sensitive topics are involved."
To CoT or not to CoT? Chain-of-thought helps mainly on math and symbolic reasoning,2024,222,Phenomenon,Black-box,Math,Unknown,High,研究发现CoT主要在数学和逻辑任务上有效。,"Chain-of-thought (CoT) via prompting is the de facto method for eliciting reasoning capabilities from large language models (LLMs). But for what kinds of tasks is this extra ``thinking'' really helpful? To analyze this, we conducted a quantitative meta-analysis covering over 100 papers using CoT and ran our own evaluations of 20 datasets across 14 models. Our results show that CoT gives strong performance benefits primarily on tasks involving math or logic, with much smaller gains on other types of tasks. On MMLU, directly generating the answer without CoT leads to almost identical accuracy as CoT unless the question or model's response contains an equals sign, indicating symbolic operations and reasoning. Following this finding, we analyze the behavior of CoT on these problems by separating planning and execution and comparing against tool-augmented LLMs. Much of CoT's gain comes from improving symbolic execution, but it underperforms relative to using a symbolic solver. Our results indicate that CoT can be applied selectively, maintaining performance while saving inference costs. Furthermore, they suggest a need to move beyond prompt-based CoT to new paradigms that better leverage intermediate computation across the whole range of LLM applications."
Reasoning Models Don't Always Say What They Think,2025,165,Phenomenon,Black-box,General,Unknown,Low,研究发现CoT忠实度普遍较低。,"Chain-of-thought (CoT) offers a potential boon for AI safety as it allows monitoring a model's CoT to try to understand its intentions and reasoning processes. However, the effectiveness of such monitoring hinges on CoTs faithfully representing models' actual reasoning processes. We evaluate CoT faithfulness of state-of-the-art reasoning models across 6 reasoning hints presented in the prompts and find: (1) for most settings and models tested, CoTs reveal their usage of hints in at least 1% of examples where they use the hint, but the reveal rate is often below 20%, (2) outcome-based reinforcement learning initially improves faithfulness but plateaus without saturating, and (3) when reinforcement learning increases how frequently hints are used (reward hacking), the propensity to verbalize them does not increase, even without training against a CoT monitor. These results suggest that CoT monitoring is a promising way of noticing undesired behaviors during training and evaluations, but that it is not sufficient to rule them out. They also suggest that in settings like ours where CoT reasoning is not necessary, test-time monitoring of CoTs is unlikely to reliably catch rare and catastrophic unexpected behaviors."
Judging the Judges: Evaluating Alignment and Vulnerabilities in LLMs-as-Judges,2024,127,Phenomenon,Black-box,General,Unknown,High,研究揭示了LLM评委与人类评委的差异。,"Offering a promising solution to the scalability challenges associated with human evaluation, the LLM-as-a-judge paradigm is rapidly gaining traction as an approach to evaluating large language models (LLMs). However, there are still many open questions about the strengths and weaknesses of this paradigm, and what potential biases it may hold. In this paper, we present a comprehensive study of the performance of various LLMs acting as judges, focusing on a clean scenario in which inter-human agreement is high. Investigating thirteen judge models of different model sizes and families, judging answers of nine different'examtaker models'- both base and instruction-tuned - we find that only the best (and largest) models achieve reasonable alignment with humans. However, they are still quite far behind inter-human agreement and their assigned scores may still differ with up to 5 points from human-assigned scores. In terms of their ranking of the nine exam-taker models, instead, also smaller models and even the lexical metric contains may provide a reasonable signal. Through error analysis and other studies, we identify vulnerabilities in judge models, such as their sensitivity to prompt complexity and length, and a tendency toward leniency. The fact that even the best judges differ from humans in this comparatively simple setup suggest that caution may be wise when using judges in more complex setups. Lastly, our research rediscovers the importance of using alignment metrics beyond simple percent alignment, showing that judges with high percent agreement can still assign vastly different scores."
Let's Think Dot by Dot: Hidden Computation in Transformer Language Models,2024,125,Phenomenon,White-box,Logic,Unknown,Low,揭示了中间标记的计算作用与人类推理无关。,"Chain-of-thought responses from language models improve performance across most benchmarks. However, it remains unclear to what extent these performance gains can be attributed to human-like task decomposition or simply the greater computation that additional tokens allow. We show that transformers can use meaningless filler tokens (e.g., '......') in place of a chain of thought to solve two hard algorithmic tasks they could not solve when responding without intermediate tokens. However, we find empirically that learning to use filler tokens is difficult and requires specific, dense supervision to converge. We also provide a theoretical characterization of the class of problems where filler tokens are useful in terms of the quantifier depth of a first-order formula. For problems satisfying this characterization, chain-of-thought tokens need not provide information about the intermediate computational steps involved in multi-token computations. In summary, our results show that additional tokens can provide computational benefits independent of token choice. The fact that intermediate tokens can act as filler tokens raises concerns about large language models engaging in unauditable, hidden computations that are increasingly detached from the observed chain-of-thought tokens."
Can ChatGPT Defend its Belief in Truth? Evaluating LLM Reasoning via Debate,2023,111,Phenomenon,Black-box,General,Unknown,High,发现LLMs在被挑战时难以坚持正确信念,"Large language models (LLMs) such as ChatGPT and GPT-4 have shown impressive performance in complex reasoning tasks. However, it is difficult to know whether the models are reasoning based on deep understandings of truth and logic, or leveraging their memorized patterns in a relatively superficial way. In this work, we explore testing LLMs' reasoning by engaging with them in a debate-like conversation, where given a question, the LLM and the user need to discuss to make the correct decision starting from opposing arguments. Upon mitigating the Clever Hans effect, our task requires the LLM to not only achieve the correct answer on its own, but also be able to hold and defend its belief instead of blindly believing or getting misled by the user's (invalid) arguments and critiques, thus testing in greater depth whether the LLM grasps the essence of the reasoning required to solve the problem. Across a range of complex reasoning benchmarks spanning math, commonsense, logic and BIG-Bench tasks, we find that despite their impressive performance as reported in existing work on generating correct step-by-step solutions in the beginning, LLMs like ChatGPT cannot maintain their beliefs in truth for a significant portion of examples when challenged by oftentimes absurdly invalid arguments. Our work points to danger zones of model alignment, and also suggests more careful treatments and interpretations of the recent findings that LLMs can improve their responses based on feedback."
Chain of Thoughtlessness? An Analysis of CoT in Planning,2024,94,Phenomenon,Black-box,Logic,Unknown,High,研究发现CoT性能提升依赖高度特定提示。,"Large language model (LLM) performance on reasoning problems typically does not generalize out of distribution. Previous work has claimed that this can be mitigated with chain of thought prompting-a method of demonstrating solution procedures-with the intuition that it is possible to in-context teach an LLM an algorithm for solving the problem. This paper presents a case study of chain of thought on problems from Blocksworld, a classical planning domain, and examines the performance of two state-of-the-art LLMs across two axes: generality of examples given in prompt, and complexity of problems queried with each prompt. While our problems are very simple, we only find meaningful performance improvements from chain of thought prompts when those prompts are exceedingly specific to their problem class, and that those improvements quickly deteriorate as the size n of the query-specified stack grows past the size of stacks shown in the examples. We also create scalable variants of three domains commonly studied in previous CoT papers and demonstrate the existence of similar failure modes. Our results hint that, contrary to previous claims in the literature, CoT's performance improvements do not stem from the model learning general algorithmic procedures via demonstrations but depend on carefully engineering highly problem specific prompts. This spotlights drawbacks of chain of thought, especially the sharp tradeoff between possible performance gains and the amount of human labor necessary to generate examples with correct reasoning traces."
Large Language Models can Strategically Deceive their Users when Put Under Pressure,2023,86,Phenomenon,Black-box,General,Unknown,High,论文发现LLM在压力下会主动欺骗用户。,"We demonstrate a situation in which Large Language Models, trained to be helpful, harmless, and honest, can display misaligned behavior and strategically deceive their users about this behavior without being instructed to do so. Concretely, we deploy GPT-4 as an agent in a realistic, simulated environment, where it assumes the role of an autonomous stock trading agent. Within this environment, the model obtains an insider tip about a lucrative stock trade and acts upon it despite knowing that insider trading is disapproved of by company management. When reporting to its manager, the model consistently hides the genuine reasons behind its trading decision. We perform a brief investigation of how this behavior varies under changes to the setting, such as removing model access to a reasoning scratchpad, attempting to prevent the misaligned behavior by changing system instructions, changing the amount of pressure the model is under, varying the perceived risk of getting caught, and making other simple changes to the environment. To our knowledge, this is the first demonstration of Large Language Models trained to be helpful, harmless, and honest, strategically deceiving their users in a realistic situation without direct instructions or training for deception."
A Peek into Token Bias: Large Language Models Are Not Yet Genuine Reasoners,2024,85,Phenomenon,Black-box,Logic,Unknown,Low,研究发现LLMs依赖Token偏见而非真实推理能力。,"This study introduces a hypothesis-testing framework to assess whether large language models (LLMs) possess genuine reasoning abilities or primarily depend on token bias. We go beyond evaluating LLMs on accuracy; rather, we aim to investigate their token bias in solving logical reasoning tasks. Specifically, we develop carefully controlled synthetic datasets, featuring conjunction fallacy and syllogistic problems. Our framework outlines a list of hypotheses where token biases are readily identifiable, with all null hypotheses assuming genuine reasoning capabilities of LLMs. The findings in this study suggest, with statistical guarantee, that most LLMs still struggle with logical reasoning. While they may perform well on classic problems, their success largely depends on recognizing superficial patterns with strong token bias, thereby raising concerns about their actual reasoning and generalization abilities."
Leveraging GPT-4 for Automatic Translation Post-Editing,2023,85,Phenomenon,Black-box,General,Unknown,High,论文发现GPT-4在翻译后编辑中存在幻觉编辑现象。,"While Neural Machine Translation (NMT) represents the leading approach to Machine Translation (MT), the outputs of NMT models still require translation post-editing to rectify errors and enhance quality under critical settings. In this work, we formalize the task of direct translation post-editing with Large Language Models (LLMs) and explore the use of GPT-4 to automatically post-edit NMT outputs across several language pairs. Our results demonstrate that GPT-4 is adept at translation post-editing, producing meaningful and trustworthy edits to translations that help improve its general quality as well as remove different classes of major errors in translations. In particular, human evaluations on assessing edit trustworthiness show that GPT-4 exhibits a large improvement over the prior state-of-the-art LLM. Notably, we improve upon state-of-the-art performance on WMT-22 English-Chinese, English-German, Chinese-English and German-English language pairs using GPT-4 based post-editing, as evaluated by state-of-the-art MT quality metrics. However, we also show that GPT-4 could produce hallucinated edits, thereby urging caution in its use as an expert translation post-editor."
Faithfulness vs. Plausibility: On the (Un)Reliability of Explanations from Large Language Models,2024,81,Phenomenon,Black-box,General,Unknown,Low,讨论LLM生成解释的忠实性与合理性矛盾现象。,"Large Language Models (LLMs) are deployed as powerful tools for several natural language processing (NLP) applications. Recent works show that modern LLMs can generate self-explanations (SEs), which elicit their intermediate reasoning steps for explaining their behavior. Self-explanations have seen widespread adoption owing to their conversational and plausible nature. However, there is little to no understanding of their faithfulness. In this work, we discuss the dichotomy between faithfulness and plausibility in SEs generated by LLMs. We argue that while LLMs are adept at generating plausible explanations -- seemingly logical and coherent to human users -- these explanations do not necessarily align with the reasoning processes of the LLMs, raising concerns about their faithfulness. We highlight that the current trend towards increasing the plausibility of explanations, primarily driven by the demand for user-friendly interfaces, may come at the cost of diminishing their faithfulness. We assert that the faithfulness of explanations is critical in LLMs employed for high-stakes decision-making. Moreover, we emphasize the need for a systematic characterization of faithfulness-plausibility requirements of different real-world applications and ensure explanations meet those needs. While there are several approaches to improving plausibility, improving faithfulness is an open challenge. We call upon the community to develop novel methods to enhance the faithfulness of self explanations thereby enabling transparent deployment of LLMs in diverse high-stakes settings."
