Title,Year,Citations,Category,Type,Domain,Tradeoff,Cost,Reasoning,Abstract
Training Language Models to Explain Their Own Computations,2025,1,Phenomenon,White-box,General,Unknown,High,研究语言模型自我解释内部计算的能力。,"Can language models (LMs) learn to faithfully describe their internal computations? Are they better able to describe themselves than other models? We study the extent to which LMs'privileged access to their own internals can be leveraged to produce new techniques for explaining their behavior. Using existing interpretability techniques as a source of ground truth, we fine-tune LMs to generate natural language descriptions of (1) the information encoded by LM features, (2) the causal structure of LMs'internal activations, and (3) the influence of specific input tokens on LM outputs. When trained with only tens of thousands of example explanations, explainer models exhibit non-trivial generalization to new queries. This generalization appears partly attributable to explainer models'privileged access to their own internals: using a model to explain its own computations generally works better than using a *different* model to explain its computations (even if the other model is significantly more capable). Our results suggest not only that LMs can learn to reliably explain their internal computations, but that such explanations offer a scalable complement to existing interpretability methods."
An Empirical Study of Reasoning Steps in Thinking Code LLMs,2025,1,Phenomenon,Black-box,Code,Unknown,High,研究揭示了推理步骤数量与任务解决率的关系。,"Thinking Large Language Models (LLMs) generate explicit intermediate reasoning traces before final answers, potentially improving transparency, interpretability, and solution accuracy for code generation. However, the quality of these reasoning chains remains underexplored. We present a comprehensive empirical study examining the reasoning process and quality of thinking LLMs for code generation. We evaluate six state-of-the-art reasoning LLMs (DeepSeek-R1, OpenAI-o3-mini, Claude-3.7-Sonnet-Thinking, Gemini-2.0-Flash-Thinking, Gemini-2.5-Flash, and Qwen-QwQ) across 100 code generation tasks of varying difficulty from BigCodeBench. We quantify reasoning-chain structure through step counts and verbosity, conduct controlled step-budget adjustments, and perform a 21-participant human evaluation across three dimensions: efficiency, logical correctness, and completeness. Our step-count interventions reveal that targeted step increases can improve resolution rates for certain models/tasks, while modest reductions often preserve success on standard tasks, rarely on hard ones. Through systematic analysis, we develop a reasoning-problematic taxonomy, identifying completeness as the dominant failure mode. Task complexity significantly impacts reasoning quality; hard problems are substantially more prone to incompleteness than standard tasks. Our stability analysis demonstrates that thinking LLMs maintain consistent logical structures across computational effort levels and can self-correct previous errors. This study provides new insights into the strengths and limitations of current thinking LLMs in software engineering."
Can Reasoning Models Obfuscate Reasoning? Stress-Testing Chain-of-Thought Monitorability,2025,1,Phenomenon,Black-box,General,Unknown,High,研究模型在对抗压力下隐藏思维链的现象。,"Recent findings suggest that misaligned models may exhibit deceptive behavior, raising concerns about output trustworthiness. Chain-of-thought (CoT) is a promising tool for alignment monitoring: when models articulate their reasoning faithfully, monitors can detect and mitigate harmful behaviors before undesirable outcomes occur. However, a key uncertainty is: Can models obfuscate their CoT in order to pursue hidden adversarial objectives while evading detection? To answer this question and thus stress-test CoT monitorability, we develop a composable and quantifiable taxonomy of prompts to elicit CoT obfuscation. We evaluate both internal CoT (reasoning traces) and external CoT (prompted reasoning in outputs) using toy tasks and more realistic environments in SHADE-Arena. We show that: (i) CoT monitoring performs accurately and efficiently without obfuscation pressure. (ii) Under strong obfuscation pressure, some models successfully complete adversarial tasks while evading detection. (iii) Models do not obfuscate their internal CoT as much as their external CoT (under prompt pressure). These results suggest that while CoT provides valuable oversight in benign settings, robust deployment requires model-specific stress-testing of monitorability."
Emergent Misalignment via In-Context Learning: Narrow in-context examples can produce broadly misaligned LLMs,2025,1,Phenomenon,Black-box,General,Unknown,High,研究发现了ICL中广泛存在的模型不对齐现象。,"Recent work has shown that narrow finetuning can produce broadly misaligned LLMs, a phenomenon termed emergent misalignment (EM). While concerning, these findings were limited to finetuning and activation steering, leaving out in-context learning (ICL). We therefore ask: does EM emerge in ICL? We find that it does: across three datasets, three frontier models produce broadly misaligned responses at rates between 2% and 17% given 64 narrow in-context examples, and up to 58% with 256 examples. We also examine mechanisms of EM by eliciting step-by-step reasoning (while leaving in-context examples unchanged). Manual analysis of the resulting chain-of-thought shows that 67.5% of misaligned traces explicitly rationalize harmful outputs by adopting a reckless or dangerous''persona'', echoing prior results on finetuning-induced EM."
Diagnosing Hallucination Risk in AI Surgical Decision-Support: A Sequential Framework for Sequential Validation,2025,1,Phenomenon,Black-box,General,Unknown,High,研究发现扩展思维链推理不总能提升临床可靠性。,"Large language models (LLMs) offer transformative potential for clinical decision support in spine surgery but pose significant risks through hallucinations, which are factually inconsistent or contextually misaligned outputs that may compromise patient safety. This study introduces a clinician-centered framework to quantify hallucination risks by evaluating diagnostic precision, recommendation quality, reasoning robustness, output coherence, and knowledge alignment. We assessed six leading LLMs across 30 expert-validated spinal cases. DeepSeek-R1 demonstrated superior overall performance (total score: 86.03 $\pm$ 2.08), particularly in high-stakes domains such as trauma and infection. A critical finding reveals that reasoning-enhanced model variants did not uniformly outperform standard counterparts: Claude-3.7-Sonnet's extended thinking mode underperformed relative to its standard version (80.79 $\pm$ 1.83 vs. 81.56 $\pm$ 1.92), indicating extended chain-of-thought reasoning alone is insufficient for clinical reliability. Multidimensional stress-testing exposed model-specific vulnerabilities, with recommendation quality degrading by 7.4% under amplified complexity. This decline contrasted with marginal improvements in rationality (+2.0%), readability (+1.7%) and diagnosis (+4.7%), highlighting a concerning divergence between perceived coherence and actionable guidance. Our findings advocate integrating interpretability mechanisms (e.g., reasoning chain visualization) into clinical workflows and establish a safety-aware validation framework for surgical LLM deployment."
Are language models aware of the road not taken? Token-level uncertainty and hidden state dynamics,2025,1,Phenomenon,White-box,General,Unknown,High,通过隐状态干预分析模型对未选择路径的表征能力,"When a language model generates text, the selection of individual tokens might lead it down very different reasoning paths, making uncertainty difficult to quantify. In this work, we consider whether reasoning language models represent the alternate paths that they could take during generation. To test this hypothesis, we use hidden activations to control and predict a language model's uncertainty during chain-of-thought reasoning. In our experiments, we find a clear correlation between how uncertain a model is at different tokens, and how easily the model can be steered by controlling its activations. This suggests that activation interventions are most effective when there are alternate paths available to the model -- in other words, when it has not yet committed to a particular final answer. We also find that hidden activations can predict a model's future outcome distribution, demonstrating that models implicitly represent the space of possible paths."
Cognitive Foundations for Reasoning and Their Manifestation in LLMs,2025,0,Phenomenon,Black-box,General,Unknown,High,研究发现LLMs在简单问题上表现不佳，机制与人类不同。,"Large language models (LLMs) solve complex problems yet fail on simpler variants, suggesting they achieve correct outputs through mechanisms fundamentally different from human reasoning. To understand this gap, we synthesize cognitive science research into a taxonomy of 28 cognitive elements spanning reasoning invariants, meta-cognitive controls, representations for organizing reasoning&knowledge, and transformation operations. We introduce a fine-grained evaluation framework and conduct the first large-scale empirical analysis of 192K traces from 18 models across text, vision, and audio, complemented by 54 human think-aloud traces, which we make publicly available. We find that models under-utilize cognitive elements correlated with success, narrowing to rigid sequential processing on ill-structured problems where diverse representations and meta-cognitive monitoring are critical. Human traces show more abstraction and conceptual processing, while models default to surface-level enumeration. Meta-analysis of 1.6K LLM reasoning papers reveals the research community concentrates on easily quantifiable elements (sequential organization: 55%, decomposition: 60%) but neglecting meta-cognitive controls (self-awareness: 16%) that correlate with success. Models possess behavioral repertoires associated with success but fail to deploy them spontaneously. Leveraging these patterns, we develop test-time reasoning guidance that automatically scaffold successful structures, improving performance by up to 66.7% on complex problems. By establishing a shared vocabulary between cognitive science and LLM research, our framework enables systematic diagnosis of reasoning failures and principled development of models that reason through robust cognitive mechanisms rather than spurious shortcuts, while providing tools to test theories of human cognition at scale."
What Really Counts? Examining Step and Token Level Attribution in Multilingual CoT Reasoning,2025,0,Phenomenon,White-box,General,Unknown,High,研究关注多语言CoT的归因模式与忠实度问题。,"This study investigates the attribution patterns underlying Chain-of-Thought (CoT) reasoning in multilingual LLMs. While prior works demonstrate the role of CoT prompting in improving task performance, there are concerns regarding the faithfulness and interpretability of the generated reasoning chains. To assess these properties across languages, we applied two complementary attribution methods--ContextCite for step-level attribution and Inseq for token-level attribution--to the Qwen2.5 1.5B-Instruct model using the MGSM benchmark. Our experimental results highlight key findings such as: (1) attribution scores excessively emphasize the final reasoning step, particularly in incorrect generations; (2) structured CoT prompting significantly improves accuracy primarily for high-resource Latin-script languages; and (3) controlled perturbations via negation and distractor sentences reduce model accuracy and attribution coherence. These findings highlight the limitations of CoT prompting, particularly in terms of multilingual robustness and interpretive transparency."
More Agents Helps but Adversarial Robustness Gap Persists,2025,0,Phenomenon,Black-box,Math,Unknown,High,论文揭示了多智能体协作下对抗鲁棒性差距持续存在的现象，属于黑盒评估，任务领域为数学问答，开销高。,"When LLM agents work together, they seem to be more powerful than a single LLM in mathematical question answering. However, are they also more robust to adversarial inputs? We investigate this question using adversarially perturbed math questions. These perturbations include punctuation noise with three intensities (10, 30, and 50 percent), plus real-world and human-like typos (WikiTypo, R2ATA). Using a unified sampling-and-voting framework (Agent Forest), we evaluate six open-source models (Qwen3-4B/14B, Llama3.1-8B, Mistral-7B, Gemma3-4B/12B) across four benchmarks (GSM8K, MATH, MMLU-Math, MultiArith), with various numbers of agents n from one to 25 (1, 2, 5, 10, 15, 20, 25). Our findings show that (1) Noise type matters: punctuation noise harm scales with its severity, and the human typos remain the dominant bottleneck, yielding the largest gaps to Clean accuracy and the highest ASR even with a large number of agents. And (2) Collaboration reliably improves accuracy as the number of agents, n, increases, with the largest gains from one to five agents and diminishing returns beyond 10 agents. However, the adversarial robustness gap persists regardless of the agent count."
Implicature in Interaction: Understanding Implicature Improves Alignment in Human-LLM Interaction,2025,0,Phenomenon,Black-box,General,Unknown,Low,研究关注LLM在隐含意图推理中的表现差异。,"The rapid advancement of Large Language Models (LLMs) is positioning language at the core of human-computer interaction (HCI). We argue that advancing HCI requires attention to the linguistic foundations of interaction, particularly implicature (meaning conveyed beyond explicit statements through shared context) which is essential for human-AI (HAI) alignment. This study examines LLMs'ability to infer user intent embedded in context-driven prompts and whether understanding implicature improves response generation. Results show that larger models approximate human interpretations more closely, while smaller models struggle with implicature inference. Furthermore, implicature-based prompts significantly enhance the perceived relevance and quality of responses across models, with notable gains in smaller models. Overall, 67.6% of participants preferred responses with implicature-embedded prompts to literal ones, highlighting a clear preference for contextually nuanced communication. Our work contributes to understanding how linguistic theory can be used to address the alignment problem by making HAI interaction more natural and contextually grounded."
The Ends Justify the Thoughts: RL-Induced Motivated Reasoning in LLMs,2025,0,Phenomenon,Black-box,General,Unknown,High,研究揭示了LLM在指令冲突时产生动机性推理的现象。,"The use of reinforcement learning (RL) with chain-of-thought (CoT) reasoning has emerged as a promising approach for developing more capable language models. In turn, this has led to investigation of CoT monitoring as a compelling method for detecting harmful behaviors such as reward hacking, under the assumption that models'reasoning processes reflect their internal decision-making. In practice, LLM training often produces unintended behaviors due to imperfect reward signals, leading models to develop misaligned tendencies. A common corrective approach is to apply post-hoc instructions to avoid problematic behaviors like sycophancy, but what happens to the model's reasoning process when these instructions conflict with learned behaviors? We investigate this question in simple settings and find that models engage in systematic motivated reasoning -- generating plausible-sounding justifications for violating their instructions while downplaying potential harms. Beyond being an interesting property of training, we find that while motivated reasoning can be detected by most frontier reasoning models, smaller LLM judges can fail to identify a portion of it, and in rare cases can themselves be persuaded that the reasoning is correct, despite it contradicting clear instructions. This capability gap raises concerns that as models become more sophisticated, their motivated reasoning may become increasingly difficult for monitors to detect. Our results underscore the need to account for motivated reasoning when relying on chain-of-thought processes for model evaluation and oversight. All code for this paper will be made available. WARNING: some examples in this paper may be upsetting."
Thinking About Thinking: Evaluating Reasoning in Post-Trained Language Models,2025,0,Phenomenon,White-box,General,Unknown,High,论文发现RL模型推理轨迹与输出对齐性弱。,"Recent advances in post-training techniques have endowed Large Language Models (LLMs) with enhanced capabilities for tackling complex, logic-intensive tasks through the generation of supplementary planning tokens. This development raises a fundamental question: Are these models aware of what they""learn""and""think""? To address this, we define three core competencies: (1) awareness of learned latent policies, (2) generalization of these policies across domains, and (3) alignment between internal reasoning traces and final outputs. We empirically evaluate these abilities on several tasks, each designed to require learning a distinct policy. Furthermore, we contrast the profiles of models post-trained via Supervised Fine-Tuning (SFT), Direct Policy Optimization (DPO), and Group Relative Policy Optimization (GRPO). Our findings indicate that RL-trained models not only demonstrate greater awareness of their learned behaviors and stronger generalizability to novel, structurally similar tasks than SFT models but also often exhibit weak alignment between their reasoning traces and final outputs, an effect most pronounced in GRPO-trained models."
On the Reasoning Abilities of Masked Diffusion Language Models,2025,0,Phenomenon,White-box,General,Unknown,Low,论文揭示了MDMs在并行推理中的效率优势。,"Masked diffusion models (MDMs) for text offer a compelling alternative to traditional autoregressive language models. Parallel generation makes them efficient, but their computational capabilities and the limitations inherent to their parallelism remain largely unexplored. To this end, we characterize what types of reasoning problems MDMs can provably solve and how efficiently. We do this by connecting MDMs to the well-understood reasoning frameworks of chain of thought (CoT) and padded looped transformers (PLTs) in the finite-precision log-width setting: We show that MDMs and polynomially-padded PLTs are, in fact, equivalent in this setting, and that MDMs can solve all problems that CoT-augmented transformers can. Moreover, we showcase classes of problems (including regular languages) for which MDMs are inherently more efficient than CoT transformers, where parallel generation allows for substantially faster reasoning."
A Framework for Studying Communication Pathways in Machine Learning-Based Agent-to-Agent Communication,2024,0,Phenomenon,White-box,General,Unknown,High,研究多智能体通信中的语言涌现现象。,": The rise of Large Language Models (LLMs) has increased the relevance of agent-to-agent communication, particularly in systems where agents learn from their interactions. However, current LLMs offer limited insights into the communication dynamics among multiple agents, especially in large-scale settings when multiple agents are involved. Particularly training LLMs - in contrast to in-context learning - becomes nearly infeasible without large-scale computing infrastructure. In our work we present a machine-learning based agent framework to investigate the role of different communication pathways for studying language emergence between machine learning-based agents. We designed a transformer-based image auto-encoder as the agent architecture. A Gumbel SoftMax layer encodes images in form of symbols forming the language between agents. We study two pathways: In the first pathway, the sender reads an image and sends a message to the receiver. The receiver uses the message to reconstruct the sender’s image. In the second pathway, the sender and receiver read an image and minimize the distance between the generated symbols. In the first pathway, language emerges with the Levenshtein distance of ≤ 2 for 96% of messages. In the second pathway, no language emerges with the Levenshtein distance of ≤ 2 for 3% of messages."
Evaluating Implicit Biases in LLM Reasoning through Logic Grid Puzzles,2025,0,Phenomenon,Black-box,Logic,Unknown,Low,论文发现LLMs在逻辑推理中存在隐性社会偏见。,"While recent safety guardrails effectively suppress overtly biased outputs, subtler forms of social bias emerge during complex logical reasoning tasks that evade current evaluation benchmarks. To fill this gap, we introduce a new evaluation framework, PRIME (Puzzle Reasoning for Implicit Biases in Model Evaluation), that uses logic grid puzzles to systematically probe the influence of social stereotypes on logical reasoning and decision making in LLMs. Our use of logic puzzles enables automatic generation and verification, as well as variability in complexity and biased settings. PRIME includes stereotypical, anti-stereotypical, and neutral puzzle variants generated from a shared puzzle structure, allowing for controlled and fine-grained comparisons. We evaluate multiple model families across puzzle sizes and test the effectiveness of prompt-based mitigation strategies. Focusing our experiments on gender stereotypes, our findings highlight that models consistently reason more accurately when solutions align with stereotypical associations. This demonstrates the significance of PRIME for diagnosing and quantifying social biases perpetuated in the deductive reasoning of LLMs, where fairness is critical."
Are We Aligned? A Preliminary Investigation of the Alignment of Responsible AI Values between LLMs and Human Judgment,2025,0,Phenomenon,Black-box,General,Unknown,Low,研究发现LLMs声称的价值观与实际行为存在不一致。,"Large Language Models (LLMs) are increasingly employed in software engineering tasks such as requirements elicitation, design, and evaluation, raising critical questions regarding their alignment with human judgments on responsible AI values. This study investigates how closely LLMs'value preferences align with those of two human groups: a US-representative sample and AI practitioners. We evaluate 23 LLMs across four tasks: (T1) selecting key responsible AI values, (T2) rating their importance in specific contexts, (T3) resolving trade-offs between competing values, and (T4) prioritizing software requirements that embody those values. The results show that LLMs generally align more closely with AI practitioners than with the US-representative sample, emphasizing fairness, privacy, transparency, safety, and accountability. However, inconsistencies appear between the values that LLMs claim to uphold (Tasks 1-3) and the way they prioritize requirements (Task 4), revealing gaps in faithfulness between stated and applied behavior. These findings highlight the practical risk of relying on LLMs in requirements engineering without human oversight and motivate the need for systematic approaches to benchmark, interpret, and monitor value alignment in AI-assisted software development."
From Five Dimensions to Many: Large Language Models as Precise and Interpretable Psychological Profilers,2025,0,Phenomenon,Black-box,General,Unknown,High,论文发现LLMs通过两阶段推理过程模拟人类心理结构。,"Psychological constructs within individuals are widely believed to be interconnected. We investigated whether and how Large Language Models (LLMs) can model the correlational structure of human psychological traits from minimal quantitative inputs. We prompted various LLMs with Big Five Personality Scale responses from 816 human individuals to role-play their responses on nine other psychological scales. LLMs demonstrated remarkable accuracy in capturing human psychological structure, with the inter-scale correlation patterns from LLM-generated responses strongly aligning with those from human data $(R^2>0.89)$. This zero-shot performance substantially exceeded predictions based on semantic similarity and approached the accuracy of machine learning algorithms trained directly on the dataset. Analysis of reasoning traces revealed that LLMs use a systematic two-stage process: First, they transform raw Big Five responses into natural language personality summaries through information selection and compression, analogous to generating sufficient statistics. Second, they generate target scale responses based on reasoning from these summaries. For information selection, LLMs identify the same key personality factors as trained algorithms, though they fail to differentiate item importance within factors. The resulting compressed summaries are not merely redundant representations but capture synergistic information--adding them to original scores enhances prediction alignment, suggesting they encode emergent, second-order patterns of trait interplay. Our findings demonstrate that LLMs can precisely predict individual participants'psychological traits from minimal data through a process of abstraction and reasoning, offering both a powerful tool for psychological simulation and valuable insights into their emergent reasoning capabilities."
