title,year,is_relevant,has_phenomenon,has_metrics,mitigation_methods,reasoning,abstract,publication_venue,related_score,type,domain,tagging_reasoning
Causal Abstraction for Chain-of-Thought Reasoning in Arithmetic Word Problems,2023,True,True,True,Interpretability & Internal Mechanisms,论文探讨了CoT在算术问题中的因果影响，揭示了LLMs使用CoT进行推理的现象，并提出了因果抽象评估方法。,"Recent work suggests that large language models (LLMs) achieve higher accuracy on multi-step reasoning tasks when prompted to generate intermediate reasoning steps, or a chain of thought (CoT), before their final answer. However, it is unclear how exactly CoTs improve LLMs’ accuracy, and in particular, if LLMs use their CoTs to reason to their final answers. This paper tries to answer this question with respect to arithmetic word problems, by (i) evaluating the correctness of LLMs’ CoTs, and (ii) using causal abstraction to assess if the intermediate tokens produced as part of a CoT causally impact LLMs’ final answers, in line with the reasoning described by the CoT. We find that for CoT-prompted LLMs, correct answers to arithmetic problems are highly correlated with correct CoTs, and that when LLMs produce correct CoTs, they realize to a fairly large extent the causal models suggested by their CoTs. Higher degrees of realization also seem associated with better overall accuracy on the arithmetic problems. These findings suggest that some CoT-prompted LLMs may do better on multi-step arithmetic reasoning at least partly because they use their CoTs to reason to their final answers. However, for some LLMs, other internal processes may also be involved.",BlackboxNLP Workshop on Analyzing and Interpreting Neural Networks for NLP,2,White-box,Math,这篇论文明确研究CoT是否因果影响模型最终答案，使用因果抽象(causal abstraction)方法评估中间推理token对最终答案的因果作用，直接对应Faithfulness的核心定义：CoT是否真实反映模型的实际计算过程。
CoT Red-Handed: Stress Testing Chain-of-Thought Monitoring,2025,True,True,True,Verification & External Tools,论文探讨了CoT监控中的不忠实现象（误导性合理化），并提出了混合协议作为改进方法。,"As AI models are deployed with increasing autonomy, it is important to ensure they do not take harmful actions unnoticed. As a potential mitigation, we investigate Chain-of-Thought (CoT) monitoring, wherein a weaker trusted monitor model continuously oversees the intermediate reasoning steps of a more powerful but untrusted model. We compare CoT monitoring to action-only monitoring, where only final outputs are reviewed, in a red-teaming setup where the untrusted model is instructed to pursue harmful side tasks while completing a coding problem. We find that while CoT monitoring is more effective than overseeing only model outputs in scenarios where action-only monitoring fails to reliably identify sabotage, reasoning traces can contain misleading rationalizations that deceive the CoT monitors, reducing performance in obvious sabotage cases. To address this, we introduce a hybrid protocol that independently scores model reasoning and actions, and combines them using a weighted average. Our hybrid monitor consistently outperforms both CoT and action-only monitors across all tested models and tasks, with detection rates twice higher than action-only monitoring for subtle deception scenarios.",arXiv.org,2,Black-box,General,这篇论文研究 CoT 监控的忠实性问题，特别是揭示了 CoT 轨迹中可能存在的欺骗性合理化（misleading rationalizations），这直接关联到 Faithfulness 的核心问题。论文不仅比较了仅监控最终输出和监控 CoT 的效果差异，还提出了一个混合评分协议来独立评估推理和行动，从而提高了检测欺骗的能力。这些内容明确涉及 CoT 的解释是否真实反映模型的计算过程，符合 Faithfulness 研究的核心定义。
Self-Critique and Refinement for Faithful Natural Language Explanations,2025,True,True,True,Prompting & In-Context Learning,论文提出通过自我批评和细化框架提升解释的忠实性，涉及不忠实现象和改进方法。,"With the rapid development of Large Language Models (LLMs), Natural Language Explanations (NLEs) have become increasingly important for understanding model predictions. However, these explanations often fail to faithfully represent the model's actual reasoning process. While existing work has demonstrated that LLMs can self-critique and refine their initial outputs for various tasks, this capability remains unexplored for improving explanation faithfulness. To address this gap, we introduce Self-critique and Refinement for Natural Language Explanations (SR-NLE), a framework that enables models to improve the faithfulness of their own explanations -- specifically, post-hoc NLEs -- through an iterative critique and refinement process without external supervision. Our framework leverages different feedback mechanisms to guide the refinement process, including natural language self-feedback and, notably, a novel feedback approach based on feature attribution that highlights important input words. Our experiments across three datasets and four state-of-the-art LLMs demonstrate that SR-NLE significantly reduces unfaithfulness rates, with our best method achieving an average unfaithfulness rate of 36.02%, compared to 54.81% for baseline -- an absolute reduction of 18.79%. These findings reveal that the investigated LLMs can indeed refine their explanations to better reflect their actual reasoning process, requiring only appropriate guidance through feedback without additional training or fine-tuning.",,2,Black-box,General,该论文明确研究了自然语言解释（NLEs）的忠实性问题，提出了一个自我批判和细化的框架来提高解释的忠实度，这与CoT Faithfulness的核心定义相符。论文还展示了如何通过反馈机制减少解释的不忠实率，直接触及了Faithfulness的关键问题。
Obtaining Faithful Interpretations from Compositional Neural Networks,2020,True,True,False,Training & Fine-tuning,论文揭示了NMNs中间输出与预期不符的不忠实现象，并提出了通过辅助监督训练改进的方法。,"Neural module networks (NMNs) are a popular approach for modeling compositionality: they achieve high accuracy when applied to problems in language and vision, while reflecting the compositional structure of the problem in the network architecture. However, prior work implicitly assumed that the structure of the network modules, describing the abstract reasoning process, provides a faithful explanation of the model’s reasoning; that is, that all modules perform their intended behaviour. In this work, we propose and conduct a systematic evaluation of the intermediate outputs of NMNs on NLVR2 and DROP, two datasets which require composing multiple reasoning steps. We find that the intermediate outputs differ from the expected output, illustrating that the network structure does not provide a faithful explanation of model behaviour. To remedy that, we train the model with auxiliary supervision and propose particular choices for module architecture that yield much better faithfulness, at a minimal cost to accuracy.",Annual Meeting of the Association for Computational Linguistics,2,White-box,General,该论文明确研究神经网络模块（NMN）的内部行为是否忠实反映了模型的推理过程，提出了对中间输出的系统性评估，并发现网络结构不能忠实解释模型行为，这与CoT Faithfulness的核心定义高度一致。
A Necessary Step toward Faithfulness: Measuring and Improving Consistency in Free-Text Explanations,2025,True,True,True,Training & Fine-tuning,论文提出了PEX一致性度量，揭示了LLM生成解释的不一致现象，并采用直接偏好优化提升忠实性。,"Faithful free-text explanations are important to ensure transparency in high-stakes AI decision-making contexts, but they are challenging to generate by language models and assess by humans. In this paper, we present a measure for Prediction-EXplanation (PEX) consistency, by extending the concept of weight of evidence. This measure quantifies how much a free-text explanation supports or opposes a prediction, serving as an important aspect of explanation faithfulness. Our analysis reveals that more than 62% explanations generated by large language models lack this consistency. We show that applying direct preference optimization improves the consistency of generated explanations across three model families, with improvement ranging from 43.1% to 292.3%. Furthermore, we demonstrate that optimizing this consistency measure can improve explanation faithfulness by up to 9.7%.",,2,Black-box,General,论文明确提出了一个衡量预测与解释一致性的指标（PEX consistency），并将其作为解释忠实度（Faithfulness）的重要方面。研究揭示了大型语言模型生成的解释中超过62%缺乏一致性，并通过优化方法提高了忠实度。这直接符合核心相关标准，特别是关于解释是否真实反映模型预测过程的研究。
Why do you think that? Exploring faithful sentence–level rationales without supervision,2020,True,True,False,Training & Fine-tuning,论文探讨了如何通过无监督方法生成忠实解释，并提出了训练框架来提升解释的忠实性。,"Evaluating the trustworthiness of a model’s prediction is essential for differentiating between ‘right for the right reasons’ and ‘right for the wrong reasons’. Identifying textual spans that determine the target label, known as faithful rationales, usually relies on pipeline approaches or reinforcement learning. However, such methods either require supervision and thus costly annotation of the rationales or employ non-differentiable models. We propose a differentiable training–framework to create models which output faithful rationales on a sentence level, by solely applying supervision on the target task. To achieve this, our model solves the task based on each rationale individually and learns to assign high scores to those which solved the task best. Our evaluation on three different datasets shows competitive results compared to a standard BERT blackbox while exceeding a pipeline counterpart’s performance in two cases. We further exploit the transparent decision–making process of these models to prefer selecting the correct rationales by applying direct supervision, thereby boosting the performance on the rationale–level.",Findings,2,Black-box,General,该论文明确研究了 faithful rationales，即模型输出的解释是否真实反映了预测过程，属于 Faithfulness 的核心研究范畴。虽然未直接涉及 Chain-of-Thought，但其方法（通过学习选择最佳 rationales）可以迁移到 CoT 的 Faithfulness 分析中。
Leakage-Adjusted Simulatability: Can Models Generate Non-Trivial Explanations of Their Behavior in Natural Language?,2020,True,True,True,"Training & Fine-tuning, Verification & External Tools",论文提出新的度量标准LAS评估解释的忠实性，并讨论了模型生成解释的合理性问题。,"Data collection for natural language (NL) understanding tasks has increasingly included human explanations alongside data points, allowing past works to introduce models that both perform a task and generate NL explanations for their outputs. Yet to date, model-generated explanations have been evaluated on the basis of surface-level similarities to human explanations, both through automatic metrics like BLEU and human evaluations. We argue that these evaluations are insufficient, since they fail to indicate whether explanations support actual model behavior (faithfulness), rather than simply match what a human would say (plausibility). In this work, we address the problem of evaluating explanations from the the model simulatability perspective. Our contributions are as follows: (1) We introduce a leakage-adjusted simulatability (LAS) metric for evaluating NL explanations, which measures how well explanations help an observer predict a model’s output, while controlling for how explanations can directly leak the output. We use a model as a proxy for a human observer, and validate this choice with two human subject experiments. (2) Using the CoS-E and e-SNLI datasets, we evaluate two existing generative graphical models and two new approaches; one rationalizing method we introduce achieves roughly human-level LAS scores. (3) Lastly, we frame explanation generation as a multi-agent game and optimize explanations for simulatability while penalizing label leakage, which can improve LAS scores.",Findings,2,Black-box,General,这篇论文明确关注解释的忠实性（faithfulness），提出了泄漏调整可模拟性（LAS）指标来评估自然语言解释是否真实反映了模型的行为，而不是仅仅匹配人类的解释（plausibility）。
Misaligning Reasoning with Answers - A Framework for Assessing LLM CoT Robustness,2025,True,True,True,,论文提出了评估框架MATCHA，揭示了LLMs在输入扰动下的不一致推理现象，与CoT忠实性相关。,"LLMs' decision-making process is opaque, prompting the need for explanation techniques like Chain-of-Thought. To investigate the relationship between answer and reasoning, we design a novel evaluation framework, MATCHA. In domains like education and healthcare, reasoning is key for model trustworthiness. MATCHA reveals that LLMs under input perturbations can give inconsistent or nonsensical reasoning. Additionally, we use LLM judges to assess reasoning robustness across models. Our results show that LLMs exhibit greater vulnerability to input perturbations for multi-step and commonsense tasks than compared to logical tasks. Also, we show non-trivial transfer rates of our successful examples to black-box models. Our evaluation framework helps to better understand LLM reasoning mechanisms and guides future models toward more robust and reasoning-driven architectures, enforcing answer-reasoning consistency.",arXiv.org,2,Black-box,General,这篇论文提出的MATCHA评估框架明确研究了LLM的Chain-of-Thought（CoT）在输入扰动下的不一致性或非理性现象，直接涉及CoT的忠实度（Faithfulness）。特别是它探讨了答案与推理之间的关系，揭示了模型在面对输入扰动时的脆弱性，这表明研究重点是推理过程的真实性和一致性，而非仅提升性能或事实性。因此，它符合核心相关（Core Relevant）的标准。
On the Faithfulness of Visual Thinking: Measurement and Enhancement,2025,True,True,True,Training & Fine-tuning,论文揭示了视觉信息在MCoT中的不忠实现象，并提出了新的度量方法和改进策略。,"Recent large vision-language models (LVLMs) can generate vision-text multimodal chain-of-thought (MCoT) traces after reinforcement fine-tuning (RFT). However, we observe that the visual information incorporated in MCoT is often inaccurate, though still yield correct answers, indicating a lack of faithfulness in the MCoT reasoning process. We attribute this unfaithfulness to the RL reward in RFT, which solely incentivizes the format of interleaved vision-text cues, ie, it encourages the model to incorporate visual information into its text reasoning steps without considering the correctness of the visual information. In this paper, we first probe the faithfulness of MCoT by measuring how much the prediction changes when its visual and textual thoughts are intervened. Surprisingly, the model's predictions remain nearly unchanged under visual intervention but change significantly under textual intervention, indicating that the visual evidence is largely ignored. To further analyze visual information, we introduce an automated LVLM-based evaluation metric that quantifies the faithfulness of visual cues from two perspectives: reliability and sufficiency. Our evaluation reveals that the visual information in current MCoT traces is simultaneously unreliable and insufficient. To address this issue, we propose a novel MCoT learning strategy termed Sufficient-Component Cause Model (SCCM) learning. This approach encourages the MCoT to generate sufficient yet minimal visual components that are independently capable of leading to correct answers. We note that the proposed SCCM is annotation-free and compatible with various RFT for MCoT in a plug-and-play manner. Empirical results demonstrate that SCCM consistently improves the visual faithfulness across a suite of fine-grained perception and reasoning benchmarks. Code is available at https://github.com/EugeneLiu01/Faithful_Thinking_with_Image.",arXiv.org,2,White-box,General,该论文明确研究了多模态CoT（MCoT）的忠实度问题，通过干预实验揭示了视觉信息在推理过程中被忽略的现象，并提出了量化视觉信息忠实度的评估标准和改进策略。这直接关联到Faithfulness的核心定义，即生成的解释是否真实反映模型的预测过程。
MArgE: Meshing Argumentative Evidence from Multiple Large Language Models for Justifiable Claim Verification,2025,True,True,False,Verification & External Tools,论文提出结构化论证树以提升推理的忠实性，属于改进方法中的验证与外部工具。,"Leveraging outputs from multiple large language models (LLMs) is emerging as a method for harnessing their power across a wide range of tasks while mitigating their capacity for making errors, e.g., hallucinations. However, current approaches to combining insights from multiple LLMs often involve unstructured interactions (e.g., free debate), resulting in model generations that are not faithfully justifiable. In this work, we introduce MArgE, a novel framework to provide formal structure to the evidence from each LLM, in the form of a tree of extracted arguments, for the task of claim verification. We use a variant of Argumentative LLMs (ArgLLMs), i.e. LLMs driven by frameworks and semantics from the field of computational argumentation, to construct structured argument trees for given claims. This process creates an inspectable pathway from the initial arguments to the final claim verification decisions, providing a faithful justification thereof. We show experimentally that MArgE can significantly outperform single LLMs, including three open-source models (4B to 8B parameters), GPT-4o-mini and existing ArgLLMs, as well as prior methods for unstructured multi-LLM debates. We thus demonstrate the advantages of incorporating formal, argumentative reasoning mechanisms when combining multiple LLM outputs.",arXiv.org,2,Black-box,Society,该论文明确研究了如何通过结构化论证树（Argument Trees）来提高模型生成解释的忠实度（Faithfulness），避免无结构的交互导致的不可靠解释。通过构建可检查的论证路径，确保了从初始论点到最终结论的推理过程是可追踪和可信的。
Reward-SQL: Boosting Text-to-SQL via Stepwise Reasoning and Process-Supervised Rewards,2025,True,True,False,"Training & Fine-tuning, Verification & External Tools",论文讨论了如何通过外部奖励模型提升CoT的忠实性，并提出了改进方法。,"Recent advances in large language models (LLMs) have significantly improved performance on the Text-to-SQL task by leveraging their powerful reasoning capabilities. To enhance accuracy during the reasoning process, external Process Reward Models (PRMs) can be introduced during training and inference to provide fine-grained supervision. However, if misused, PRMs may distort the reasoning trajectory and lead to suboptimal or incorrect SQL generation. To address this challenge, we propose Reward-SQL, a framework that systematically explores how to incorporate PRMs into the Text-to-SQL reasoning process effectively. Our approach follows a""cold start, then PRM supervision""paradigm. Specifically, we first train the model to decompose SQL queries into structured stepwise reasoning chains using common table expressions (Chain-of-CTEs), establishing a strong and interpretable reasoning baseline. Then, we investigate four strategies for integrating PRMs, and find that combining PRM as an online training signal (e.g.,GRPO) with PRM-guided inference (e.g., best-of-N sampling) yields the best results. Empirically, on the BIRD benchmark, Reward-SQL enables models supervised by PRM (7B) to achieve a 13.1% performance gain across various guidance strategies. Notably, our GRPO-aligned policy model based on Qwen2.5-Coder-7B-Instruct achieves 68.9% accuracy on the BIRD development set, outperforming all baseline methods under the same model size. These results demonstrate the effectiveness of Reward-SQL in leveraging reward-based supervision for Text-to-SQL reasoning.",arXiv.org,1,Black-box,Code,论文研究了外部奖励模型（PRMs）如何影响 Text-to-SQL 推理过程的准确性，并探讨了 PRMs 的可能误导作用。虽然未直接提及 Faithfulness，但对推理过程的鲁棒性和外部监督的影响进行了分析，属于边缘相关。
The Reasoning-Memorization Interplay in Language Models Is Mediated by a Single Direction,2025,True,True,False,Interpretability & Internal Mechanisms,论文揭示了LLMs在推理和记忆之间的动态切换现象，并提出了通过干预内部机制来提升推理忠实性的方法。,"Large language models (LLMs) excel on a variety of reasoning benchmarks, but previous studies suggest they sometimes struggle to generalize to unseen questions, potentially due to over-reliance on memorized training examples. However, the precise conditions under which LLMs switch between reasoning and memorization during text generation remain unclear. In this work, we provide a mechanistic understanding of LLMs' reasoning-memorization dynamics by identifying a set of linear features in the model's residual stream that govern the balance between genuine reasoning and memory recall. These features not only distinguish reasoning tasks from memory-intensive ones but can also be manipulated to causally influence model performance on reasoning tasks. Additionally, we show that intervening in these reasoning features helps the model more accurately activate the most relevant problem-solving capabilities during answer generation. Our findings offer new insights into the underlying mechanisms of reasoning and memory in LLMs and pave the way for the development of more robust and interpretable generative AI systems.",arXiv.org,2,White-box,General,该论文明确研究了LLM在推理和记忆之间的动态平衡机制，通过识别模型残差流中的线性特征来控制真实推理和记忆回忆之间的平衡。这些特征不仅能区分推理任务和记忆密集型任务，还能被操纵以因果性地影响模型在推理任务上的表现。这与Faithfulness的核心定义高度相关，因为它探讨了模型推理过程的真实性和因果性。
Truthful or Fabricated? Using Causal Attribution to Mitigate Reward Hacking in Explanations,2025,True,True,False,Training & Fine-tuning,论文揭示了偏好优化导致CoT不忠实的问题，并提出了通过因果归因改进的方法。,"Chain-of-thought explanations are widely used to inspect the decision process of large language models (LLMs) and to evaluate the trustworthiness of model outputs, making them important for effective collaboration between LLMs and humans. We demonstrate that preference optimization - a key step in the alignment phase - can inadvertently reduce the faithfulness of these explanations. This occurs because the reward model (RM), which guides alignment, is tasked with optimizing both the expected quality of the response and the appropriateness of the explanations (e.g., minimizing bias or adhering to safety standards), creating potential conflicts. The RM lacks a mechanism to assess the consistency between the model's internal decision process and the generated explanation. Consequently, the LLM may engage in""reward hacking""by producing a final response that scores highly while giving an explanation tailored to maximize reward rather than accurately reflecting its reasoning. To address this issue, we propose enriching the RM's input with a causal attribution of the prediction, allowing the RM to detect discrepancies between the generated self-explanation and the model's decision process. In controlled settings, we show that this approach reduces the tendency of the LLM to generate misleading explanations.",arXiv.org,2,Black-box,General,论文明确研究了CoT解释的忠实度问题，探讨了reward hacking导致的解释不忠实现象（生成解释以最大化奖励而非真实反映推理过程），并提出了基于因果归因的解决方法。这符合核心定义中对Faithfulness的研究要求。
