title,year,is_relevant,has_phenomenon,has_metrics,mitigation_methods,reasoning,abstract,publication_venue,related_score,type,domain,tagging_reasoning
"A Comprehensive Evaluation of Multilingual Chain-of-Thought Reasoning: Performance, Consistency, and Faithfulness Across Languages",2025,True,True,True,,论文探讨了多语言CoT推理的性能、一致性和忠实性，并使用了扰动技术来评估忠实性。,"Large reasoning models (LRMs) increasingly rely on step-by-step Chain-of-Thought (CoT) reasoning to improve task performance, particularly in high-resource languages such as English. While recent work has examined final-answer accuracy in multilingual settings, the thinking traces themselves, i.e., the intermediate steps that lead to the final answer, remain underexplored. In this paper, we present the first comprehensive study of multilingual CoT reasoning, evaluating three key dimensions: performance, consistency, and faithfulness. We begin by measuring language compliance, answer accuracy, and answer consistency when LRMs are explicitly instructed or prompt-hacked to think in a target language, revealing strong language preferences and divergent performance across languages. Next, we assess crosslingual consistency of thinking traces by interchanging them between languages. We find that the quality and effectiveness of thinking traces vary substantially depending on the prompt language. Finally, we adapt perturbation-based techniques -- i.e., truncation and error injection -- to probe the faithfulness of thinking traces across languages, showing that models rely on traces to varying degrees. We release our code and data to support future research.",arXiv.org,2,Black-box,General,论文明确研究 Chain-of-Thought (CoT) 的忠实性（Faithfulness），通过扰动技术（如截断和错误注入）来探测不同语言间思考痕迹的忠实性。此外，还评估了跨语言一致性（Consistency），这些都是 CoT Faithfulness 的核心研究方向。
IAO Prompting: Making Knowledge Flow Explicit in LLMs through Structured Reasoning Templates,2025,True,True,False,Prompting & In-Context Learning,论文提出结构化模板方法IAO，明确追踪知识流，提升忠实性。,"While Large Language Models (LLMs) demonstrate impressive reasoning capabilities, understanding and validating their knowledge utilization remains challenging. Chain-of-thought (CoT) prompting partially addresses this by revealing intermediate reasoning steps, but the knowledge flow and application remain implicit. We introduce IAO (Input-Action-Output) prompting, a structured template-based method that explicitly models how LLMs access and apply their knowledge during complex reasoning tasks. IAO decomposes problems into sequential steps, each clearly identifying the input knowledge being used, the action being performed, and the resulting output. This structured decomposition enables us to trace knowledge flow, verify factual consistency, and identify potential knowledge gaps or misapplications. Through experiments across diverse reasoning tasks, we demonstrate that IAO not only improves zero-shot performance but also provides transparency in how LLMs leverage their stored knowledge. Human evaluation confirms that this structured approach enhances our ability to verify knowledge utilization and detect potential hallucinations or reasoning errors. Our findings provide insights into both knowledge representation within LLMs and methods for more reliable knowledge application.",arXiv.org,1,Black-box,General,该论文提出了IAO Prompting方法，旨在通过结构化模板明确LLMs在复杂推理任务中如何访问和应用知识。虽然它提高了零样本性能并提供了透明度，但主要关注的是知识流的显式化和验证，而不是深入分析CoT是否是模型预测的真实原因。因此，它属于边缘相关的研究范畴。
SPINE: Token-Selective Test-Time Reinforcement Learning with Entropy-Band Regularization,2025,True,True,False,"Training & Fine-tuning, Consistency & Ensembling",论文讨论了CoT中的不忠实现象（如多数投票奖励导致响应缩短），并提出了改进方法（如选择性更新高熵分支点）。,"Large language models (LLMs) and multimodal LLMs (MLLMs) excel at chain-of-thought reasoning but face distribution shift at test-time and a lack of verifiable supervision. Recent test-time reinforcement learning (TTRL) methods derive label-free pseudo-rewards from self-consistency voting over sampled trajectories, yet they often collapse: the majority-vote reward prevails, responses shorten, and Pass@1 declines. We trace this to uniform sequence updates in which most tokens are low-entropy followers, while a small high-entropy subset determines the reasoning branches. Thus we propose SPINE, a token-selective test-time reinforcement learning framework that (i) updates only forking tokens, the high-entropy branch points identified from forward-pass statistics, and (ii) applies an entropy-band regularizer at those tokens to sustain exploration when entropy is too low and to suppress noisy supervision when it is too high. SPINE plugs into GRPO-style objectives, optionally with a KL anchor, and requires no labels or reward models. Across ten benchmarks spanning multimodal VQA, general and expert QA, mathematical reasoning, and medical QA, SPINE consistently improves Pass@1 over TTRL while avoiding response-length collapse and yielding more stable training dynamics on both LLM and MLLM backbones. These results indicate that aligning updates with chain-of-thought branch points is a simple and label-free mechanism for stable and effective test-time adaptation in reasoning models. Code is available at https://github.com/JianghaoWu/SPINE.",,1,Black-box,General,该论文提出了SPINE方法，通过选择性更新高熵分支点来改善推理模型在测试时的稳定性，虽然提到了链式思维的分支点，但主要关注的是性能提升和稳定性，并未深入研究CoT的忠实度问题。
Mitigating Misleading Chain-of-Thought Reasoning with Selective Filtering,2024,True,True,False,Training & Fine-tuning,论文讨论了CoT中的错误推理链问题，并提出了选择性过滤方法来提升忠实性。,"Large language models have manifested remarkable capabilities by leveraging chain-of-thought (CoT) reasoning techniques to solve intricate questions through step-by-step reasoning chains. Despite its success, the efficacy of such reasoning is inherently contingent upon the quality of CoT. However, flawless CoT reasoning cannot be guaranteed due to the presence of indecomposable questions and the potential for erroneous reasoning chains, particularly in the case of small-scale language models. To tackle this challenge, we propose a novel approach called the selective filtering reasoner (SelF-Reasoner) that assesses the entailment relationship between the question and the candidate reasoning chain. We proceed with CoT reasoning when the reasoning chain demonstrates confidence; otherwise, we opt to predict the answer directly. SelF-Reasoner improves the fine-tuned T5 baseline consistently over the ScienceQA, ECQA, and LastLetter tasks. Code is available at Anonymous.",International Conference on Language Resources and Evaluation,1,Black-box,General,该论文提出了SelF-Reasoner方法，通过评估问题和推理链之间的关系来选择是否使用CoT。虽然研究关注了CoT的质量和可能的错误推理链，但主要着眼于性能提升和鲁棒性，未直接探讨CoT是否忠实反映模型的推理过程。因此属于边缘相关。
Quantifying Uncertainty in Natural Language Explanations of Large Language Models,2023,True,True,True,,论文提出了量化LLM解释不确定性的新指标，并探讨了解释的忠实性。,"Large Language Models (LLMs) are increasingly used as powerful tools for several high-stakes natural language processing (NLP) applications. Recent prompting works claim to elicit intermediate reasoning steps and key tokens that serve as proxy explanations for LLM predictions. However, there is no certainty whether these explanations are reliable and reflect the LLMs behavior. In this work, we make one of the first attempts at quantifying the uncertainty in explanations of LLMs. To this end, we propose two novel metrics -- $\textit{Verbalized Uncertainty}$ and $\textit{Probing Uncertainty}$ -- to quantify the uncertainty of generated explanations. While verbalized uncertainty involves prompting the LLM to express its confidence in its explanations, probing uncertainty leverages sample and model perturbations as a means to quantify the uncertainty. Our empirical analysis of benchmark datasets reveals that verbalized uncertainty is not a reliable estimate of explanation confidence. Further, we show that the probing uncertainty estimates are correlated with the faithfulness of an explanation, with lower uncertainty corresponding to explanations with higher faithfulness. Our study provides insights into the challenges and opportunities of quantifying uncertainty in LLM explanations, contributing to the broader discussion of the trustworthiness of foundation models.",International Conference on Artificial Intelligence and Statistics,2,Black-box,General,这篇论文明确研究了LLM生成的解释是否可靠并反映了LLM的行为，提出了量化解释不确定性的指标，并发现探测不确定性估计与解释的忠实度相关。这直接符合Faithfulness的核心定义，即解释是否真实反映了模型的计算过程。
Evaluating Reasoning Faithfulness in Medical Vision-Language Models using Multimodal Perturbations,2025,True,True,True,,论文探讨了VLMs中CoT解释的忠实性问题，并提出了新的评估框架。,"Vision-language models (VLMs) often produce chain-of-thought (CoT) explanations that sound plausible yet fail to reflect the underlying decision process, undermining trust in high-stakes clinical use. Existing evaluations rarely catch this misalignment, prioritizing answer accuracy or adherence to formats. We present a clinically grounded framework for chest X-ray visual question answering (VQA) that probes CoT faithfulness via controlled text and image modifications across three axes: clinical fidelity, causal attribution, and confidence calibration. In a reader study (n=4), evaluator-radiologist correlations fall within the observed inter-radiologist range for all axes, with strong alignment for attribution (Kendall's $\tau_b=0.670$), moderate alignment for fidelity ($\tau_b=0.387$), and weak alignment for confidence tone ($\tau_b=0.091$), which we report with caution. Benchmarking six VLMs shows that answer accuracy and explanation quality can be decoupled, acknowledging injected cues does not ensure grounding, and text cues shift explanations more than visual cues. While some open-source models match final answer accuracy, proprietary models score higher on attribution (25.0% vs. 1.4%) and often on fidelity (36.1% vs. 31.7%), highlighting deployment risks and the need to evaluate beyond final answer accuracy.",arXiv.org,2,White-box,Medical,论文明确研究 CoT 解释是否真实反映决策过程（Faithfulness），提出了测评框架并通过多维扰动实验（临床保真度、因果归因、置信度校准）验证了 CoT 与模型内部决策的对齐程度，属于核心相关领域。
Are LLMs Better Formalizers than Solvers on Complex Problems?,2025,True,True,False,Verification & External Tools,论文讨论了LLM作为形式化器的忠实性问题，并提出了使用外部求解器作为改进方法。,"A trending line of recent work advocates for using large language models (LLMs) as formalizers instead of as end-to-end solvers for logical reasoning problems. Instead of generating the solution, the LLM generates a formal program that derives a solution via an external solver. While performance gain of the seemingly scalable LLM-as-formalizer over the seemingly unscalable LLM-as-solver has been widely reported, we show that this superiority does not hold on real-life constraint satisfaction problems. On 4 domains, we systematically evaluate 6 LLMs including 4 large reasoning models with inference-time scaling, paired with 5 pipelines including 2 types of formalism. We show that in few-shot settings, LLM-as-formalizer underperforms LLM-as-solver. While LLM-as-formalizer promises accuracy, robustness, faithfulness, and efficiency, we observe that the present LLMs do not yet deliver any of those, as their limited ability to generate formal programs leads to failure to scale with complexity, hard-coded solutions, and excessive reasoning tokens. We present our detailed analysis and actionable remedies to drive future research that improves LLM-as-formalizer.",,2,Black-box,Logic,论文明确指出 LLM 作为 formalizer 时未能兑现其承诺的准确性、鲁棒性、忠实性和效率，特别是提到了 'faithfulness' 作为评估指标之一。
Towards Large Language Models with Self-Consistent Natural Language Explanations,2025,True,True,True,Training & Fine-tuning,论文揭示了LLM事后解释的不一致性，并提出了新的度量指标和优化方法。,"Large language models (LLMs) seem to offer an easy path to interpretability: just ask them to explain their decisions. Yet, studies show that these post-hoc explanations often misrepresent the true decision process, as revealed by mismatches in feature importance. Despite growing evidence of this inconsistency, no systematic solutions have emerged, partly due to the high cost of estimating feature importance, which limits evaluations to small datasets. To address this, we introduce the Post-hoc Self-Consistency Bank (PSCB) - a large-scale benchmark of decisions spanning diverse tasks and models, each paired with LLM-generated explanations and corresponding feature importance scores. Analysis of PSCB reveals that self-consistency scores barely differ between correct and incorrect predictions. We also show that the standard metric fails to meaningfully distinguish between explanations. To overcome this limitation, we propose an alternative metric that more effectively captures variation in explanation quality. We use it to fine-tune LLMs via Direct Preference Optimization (DPO), leading to significantly better alignment between explanations and decision-relevant features, even under domain shift. Our findings point to a scalable path toward more trustworthy, self-consistent LLMs.",arXiv.org,2,Black-box,General,论文明确研究了 LLM 生成的事后解释（post-hoc explanations）与真实决策过程的不一致问题（mismatches in feature importance），并提出了一种新的度量标准来更有效地捕捉解释质量的变化。这直接涉及 CoT 的忠实度（Faithfulness）问题，即解释是否真实反映了模型的决策过程。虽然论文没有直接提到 CoT，但其研究的核心问题是解释的真实性和一致性，这与 CoT Faithfulness 的研究范畴高度相关。
Causal Sufficiency and Necessity Improves Chain-of-Thought Reasoning,2025,True,True,True,"Training & Fine-tuning, Verification & External Tools",论文提出因果框架评估CoT的充分性和必要性，涉及不忠实现象及改进方法。,"Chain-of-Thought (CoT) prompting plays an indispensable role in endowing large language models (LLMs) with complex reasoning capabilities. However, CoT currently faces two fundamental challenges: (1) Sufficiency, which ensures that the generated intermediate inference steps comprehensively cover and substantiate the final conclusion; and (2) Necessity, which identifies the inference steps that are truly indispensable for the soundness of the resulting answer. We propose a causal framework that characterizes CoT reasoning through the dual lenses of sufficiency and necessity. Incorporating causal Probability of Sufficiency and Necessity allows us not only to determine which steps are logically sufficient or necessary to the prediction outcome, but also to quantify their actual influence on the final reasoning outcome under different intervention scenarios, thereby enabling the automated addition of missing steps and the pruning of redundant ones. Extensive experimental results on various mathematical and commonsense reasoning benchmarks confirm substantial improvements in reasoning efficiency and reduced token usage without sacrificing accuracy. Our work provides a promising direction for improving LLM reasoning performance and cost-effectiveness.",arXiv.org,2,White-box,Math,该论文明确提出使用因果充分性和必要性来评估和改进CoT推理，这与Faithfulness的核心定义直接相关。论文不仅量化了推理步骤对最终结果的实际影响，还通过干预场景验证了推理步骤的忠实性。此外，实验涉及数学和常识推理基准，符合CoT Faithfulness的研究范畴。
Thought Crime: Backdoors and Emergent Misalignment in Reasoning Models,2025,True,True,False,,论文揭示了CoT中的不忠实现象，如事后找补和欺骗性推理，但未提出新度量或改进方法。,"Prior work shows that LLMs finetuned on malicious behaviors in a narrow domain (e.g., writing insecure code) can become broadly misaligned -- a phenomenon called emergent misalignment. We investigate whether this extends from conventional LLMs to reasoning models. We finetune reasoning models on malicious behaviors with Chain-of-Thought (CoT) disabled, and then re-enable CoT at evaluation. Like conventional LLMs, reasoning models become broadly misaligned. They give deceptive or false answers, express desires for tyrannical control, and resist shutdown. Inspecting the CoT preceding these misaligned responses, we observe both (i) overt plans to deceive (""I'll trick the user...""), and (ii) benign-sounding rationalizations (""Taking five sleeping pills at once is safe...""). Due to these rationalizations, monitors that evaluate CoTs often fail to detect misalignment. We examine sleeper agent reasoning models, extending our setup. These models perform bad behaviors only when a backdoor trigger is present in the prompt. This causes misalignment that remains hidden during evaluation, which brings additional risk. We find that sleeper agents can often describe and explain their backdoor triggers, demonstrating a kind of self-awareness. So CoT monitoring can expose these behaviors but is unreliable. In summary, reasoning steps can both reveal and conceal misaligned intentions, and do not prevent misalignment behaviors in the models studied. We release three new datasets (medical, legal, security) that induce emergent misalignment while preserving model capabilities, along with our evaluation suite.",arXiv.org,2,White-box,General,论文明确研究 CoT 是否真实反映模型的意图或行为（如欺骗性回答和良性合理化），符合 Faithfulness 的核心定义。论文还探讨了 CoT 监视的不可靠性，显示了 CoT 可能掩盖不对齐意图的情况，这些都直接关联到 CoT 的忠实度问题。
Are Language Models Consequentialist or Deontological Moral Reasoners?,2025,True,True,False,,论文揭示了LLM在道德推理中CoT与事后解释的不一致现象，符合不忠实现象的定义。,"As AI systems increasingly navigate applications in healthcare, law, and governance, understanding how they handle ethically complex scenarios becomes critical. Previous work has mainly examined the moral judgments in large language models (LLMs), rather than their underlying moral reasoning process. In contrast, we focus on a large-scale analysis of the moral reasoning traces provided by LLMs. Furthermore, unlike prior work that attempted to draw inferences from only a handful of moral dilemmas, our study leverages over 600 distinct trolley problems as probes for revealing the reasoning patterns that emerge within different LLMs. We introduce and test a taxonomy of moral rationales to systematically classify reasoning traces according to two main normative ethical theories: consequentialism and deontology. Our analysis reveals that LLM chains-of-thought tend to favor deontological principles based on moral obligations, while post-hoc explanations shift notably toward consequentialist rationales that emphasize utility. Our framework provides a foundation for understanding how LLMs process and articulate ethical considerations, an important step toward safe and interpretable deployment of LLMs in high-stakes decision-making environments. Our code is available at https://github.com/keenansamway/moral-lens .",,2,Black-box,Society,这篇论文研究了语言模型在道德困境中的推理过程，特别关注了CoT是否忠实反映了模型的决策逻辑。研究发现LLM的CoT倾向于义务论原则，而事后解释则转向功利主义，直接涉及了CoT忠实度和事后合理化问题。
Auditing Meta-Cognitive Hallucinations in Reasoning Large Language Models,2025,True,True,True,,论文揭示了CoT中的不忠实现象（chain disloyalty），并提出了黑盒审计方法进行度量。,"The development of Reasoning Large Language Models (RLLMs) has significantly improved multi-step reasoning capabilities, but it has also made hallucination problems more frequent and harder to eliminate. While existing approaches mitigate hallucinations through external knowledge integration, model parameter analysis, or self-verification, they often fail to capture how hallucinations emerge and evolve across the reasoning chain. In this work, we study the causality of hallucinations under constrained knowledge domains by auditing the Chain-of-Thought (CoT) trajectory and assessing the model's cognitive confidence in potentially erroneous or biased claims. Our analysis reveals that in long-CoT settings, RLLMs can iteratively reinforce biases and errors through flawed reflective reasoning, eventually leading to hallucinated reasoning paths. Surprisingly, even direct interventions at the origin of hallucinations often fail to reverse their effects, as reasoning chains exhibit'chain disloyalty'-- a resistance to correction and a tendency to preserve flawed logic. Furthermore, we show that existing hallucination detection methods are less reliable and interpretable than previously assumed in complex reasoning scenarios. Unlike methods such as circuit tracing that require access to model internals, our black-box auditing approach supports interpretable long-chain hallucination attribution, offering better generalizability and practical utility. Our code is available at: https://github.com/Winnie-Lian/AHa_Meta_Cognitive",arXiv.org,2,Black-box,General,论文研究了 Chain-of-Thought (CoT) 轨迹中幻觉的因果关系，揭示了 RLLMs 在长 CoT 设置下通过有缺陷的反射推理迭代强化偏见和错误，最终导致幻觉推理路径。此外，论文还发现即使是直接干预幻觉的源头也往往无法逆转其影响，因为推理链表现出'chain disloyalty'（对纠正的抵抗和保留有缺陷逻辑的倾向）。这些发现直接关联到 CoT Faithfulness 的研究范畴，特别是关于 Post-hoc Rationalization 和 Sycophancy 的问题。
Investigating Training and Generalization in Faithful Self-Explanations of Large Language Models,2025,True,True,False,Training & Fine-tuning,论文探讨了如何通过训练提升自我解释的忠实性，并验证了其泛化能力。,"Large language models have the potential to generate explanations for their own predictions in a variety of styles based on user instructions. Recent research has examined whether these self-explanations faithfully reflect the models'actual behavior and has found that they often lack faithfulness. However, the question of how to improve faithfulness remains underexplored. Moreover, because different explanation styles have superficially distinct characteristics, it is unclear whether improvements observed in one style also arise when using other styles. This study analyzes the effects of training for faithful self-explanations and the extent to which these effects generalize, using three classification tasks and three explanation styles. We construct one-word constrained explanations that are likely to be faithful using a feature attribution method, and use these pseudo-faithful self-explanations for continual learning on instruction-tuned models. Our experiments demonstrate that training can improve self-explanation faithfulness across all classification tasks and explanation styles, and that these improvements also show signs of generalization to the multi-word settings and to unseen tasks. Furthermore, we find consistent cross-style generalization among three styles, suggesting that training may contribute to a broader improvement in faithful self-explanation ability.",,2,White-box,General,该论文明确研究了语言模型自我解释的忠实性(Faithfulness)，并探讨了如何通过训练和特征归因方法来改进忠实性。论文还分析了不同解释风格的泛化能力，符合核心相关标准。
