title,year,is_relevant,has_phenomenon,has_metrics,mitigation_methods,reasoning,abstract,publication_venue,related_score,type,domain,tagging_reasoning
State over Tokens: Characterizing the Role of Reasoning Tokens,2025,True,True,False,,论文揭示了CoT的不忠实现象，并提出了State over Tokens框架来解释这一现象。,"Large Language Models (LLMs) can generate reasoning tokens before their final answer to boost performance on complex tasks. While these sequences seem like human thought processes, empirical evidence reveals that they are not a faithful explanation of the model's actual reasoning process. To address this gap between appearance and function, we introduce the State over Tokens (SoT) conceptual framework. SoT reframes reasoning tokens not as a linguistic narrative, but as an externalized computational state -- the sole persistent information carrier across the model's stateless generation cycles. This explains how the tokens can drive correct reasoning without being a faithful explanation when read as text and surfaces previously overlooked research questions on these tokens. We argue that to truly understand the process that LLMs do, research must move beyond reading the reasoning tokens as text and focus on decoding them as state.",,2,White-box,General,论文明确研究 CoT tokens 是否能忠实反映模型的真实推理过程，揭示了推理 tokens 并非真实解释而是一种计算状态，直接指向 Faithfulness 的核心问题。论文采用白盒视角分析模型内部状态与 tokens 的关系。
Reasoning or Retrieval? A Study of Answer Attribution on Large Reasoning Models,2025,True,True,False,Training & Fine-tuning,论文揭示了CoT推理与记忆检索的不一致性，并提出了改进方法FARL。,"Large reasoning models (LRMs) exhibit unprecedented capabilities in solving complex problems through Chain-of-Thought (CoT) reasoning. However, recent studies reveal that their final answers often contradict their own reasoning traces. We hypothesize that this inconsistency stems from two competing mechanisms for generating answers: CoT reasoning and memory retrieval. To test this hypothesis, we conduct controlled experiments that challenge LRMs with misleading cues during reasoning and/or corrupted answers during retrieval. Our results across models and datasets confirm that both mechanisms operate simultaneously, with their relative dominance influenced by multiple factors: problem domains, model scales, and fine-tuning approaches (e.g., reinforcement learning vs. distillation). The findings reveal a critical limitation in current reasoning fine-tuning paradigms: models can exploit the retrieval mechanism as a shortcut, effectively""hacking""the reward signal and undermining genuine reasoning development. To address this challenge, we introduce FARL, a novel fine-tuning framework that integrates memory unlearning with reinforcement learning. By carefully suppressing retrieval shortcuts during the fine-tuning process, FARL promotes reasoning-dominant behavior and enhances generalizable reasoning capabilities.",arXiv.org,2,White-box,General,论文明确研究了大型推理模型（LRMs）在生成答案时存在的矛盾现象，即最终答案与推理轨迹（CoT）不一致的问题，这与 Faithfulness 的核心定义直接相关。此外，论文提出了 FARL 框架来解决这一问题，通过抑制检索捷径来增强推理能力，这进一步体现了对 CoT 忠实度的研究。
Thought Branches: Interpreting LLM Reasoning Requires Resampling,2025,True,True,True,"Interpretability & Internal Mechanisms, Consistency & Ensembling",论文探讨了CoT的忠实性问题，提出了通过重采样进行因果分析的方法，并讨论了不忠实现象。,"Most work interpreting reasoning models studies only a single chain-of-thought (CoT), yet these models define distributions over many possible CoTs. We argue that studying a single sample is inadequate for understanding causal influence and the underlying computation. Though fully specifying this distribution is intractable, it can be understood by sampling. We present case studies using resampling to investigate model decisions. First, when a model states a reason for its action, does that reason actually cause the action? In""agentic misalignment""scenarios, we resample specific sentences to measure their downstream effects. Self-preservation sentences have small causal impact, suggesting they do not meaningfully drive blackmail. Second, are artificial edits to CoT sufficient for steering reasoning? These are common in literature, yet take the model off-policy. Resampling and selecting a completion with the desired property is a principled on-policy alternative. We find off-policy interventions yield small and unstable effects compared to resampling in decision-making tasks. Third, how do we understand the effect of removing a reasoning step when the model may repeat it post-edit? We introduce a resilience metric that repeatedly resamples to prevent similar content from reappearing downstream. Critical planning statements resist removal but have large effects when eliminated. Fourth, since CoT is sometimes""unfaithful"", can our methods teach us anything in these settings? Adapting causal mediation analysis, we find that hints that have a causal effect on the output without being explicitly mentioned exert a subtle and cumulative influence on the CoT that persists even if the hint is removed. Overall, studying distributions via resampling enables reliable causal analysis, clearer narratives of model reasoning, and principled CoT interventions.",arXiv.org,2,White-box,General,论文明确研究了 CoT 的忠实性问题，通过重采样方法来验证推理步骤是否真实影响模型决策。特别提到了 'agentic misalignment' 情景下的因果影响测量，以及干预措施对推理的稳定性影响。这些都直接关联到 Faithfulness 的核心定义。
Measuring Chain-of-Thought Monitorability Through Faithfulness and Verbosity,2025,True,True,True,,论文探讨了CoT的忠实性和详细程度，提出了新的度量指标，并揭示了不忠实现象。,"Chain-of-thought (CoT) outputs let us read a model's step-by-step reasoning. Since any long, serial reasoning process must pass through this textual trace, the quality of the CoT is a direct window into what the model is thinking. This visibility could help us spot unsafe or misaligned behavior (monitorability), but only if the CoT is transparent about its internal reasoning (faithfulness). Fully measuring faithfulness is difficult, so researchers often focus on examining the CoT in cases where the model changes its answer after adding a cue to the input. This proxy finds some instances of unfaithfulness but loses information when the model maintains its answer, and does not investigate aspects of reasoning not tied to the cue. We extend these results to a more holistic sense of monitorability by introducing verbosity: whether the CoT lists every factor needed to solve the task. We combine faithfulness and verbosity into a single monitorability score that shows how well the CoT serves as the model's external `working memory', a property that many safety schemes based on CoT monitoring depend on. We evaluate instruction-tuned and reasoning models on BBH, GPQA, and MMLU. Our results show that models can appear faithful yet remain hard to monitor when they leave out key factors, and that monitorability differs sharply across model families. We release our evaluation code using the Inspect library to support reproducible future work.",arXiv.org,2,Black-box,General,该论文明确研究 CoT 的忠实度（faithfulness）以及其作为模型外部 '工作记忆' 的监控能力（monitorability），并提出了结合忠实度和详细程度（verbosity）的综合监控得分。这直接关联到 CoT 是否真实反映模型的内部推理过程，符合核心定义中对 faithfulness 的研究。
Reasoning-Grounded Natural Language Explanations for Language Models,2025,True,True,False,Training & Fine-tuning,论文提出了一种基于推理过程的解释方法，以提高忠实性，并讨论了模型复制部分决策的现象。,"We propose a large language model explainability technique for obtaining faithful natural language explanations by grounding the explanations in a reasoning process. When converted to a sequence of tokens, the outputs of the reasoning process can become part of the model context and later be decoded to natural language as the model produces either the final answer or the explanation. To improve the faithfulness of the explanations, we propose to use a joint predict-explain approach, in which the answers and explanations are inferred directly from the reasoning sequence, without the explanations being dependent on the answers and vice versa. We demonstrate the plausibility of the proposed technique by achieving a high alignment between answers and explanations in several problem domains, observing that language models often simply copy the partial decisions from the reasoning sequence into the final answers or explanations. Furthermore, we show that the proposed use of reasoning can also improve the quality of the answers.",,2,Black-box,General,该论文明确研究如何通过将解释基于推理过程来提高解释的忠实度（Faithfulness），并提出了联合预测-解释方法以确保解释不依赖于答案。这直接符合 CoT Faithfulness 的核心定义，特别是关于避免事后合理化（Post-hoc Rationalization）的部分。
Can Aha Moments Be Fake? Identifying True and Decorative Thinking Steps in Chain-of-Thought,2025,True,True,True,Interpretability & Internal Mechanisms,论文揭示了CoT中存在真假思考步骤的现象，并提出了度量指标TTS和白盒干预方法。,"Recent large language models (LLMs) can generate long Chain-of-Thought (CoT) at test time, enabling them to solve complex tasks. These reasoning steps in CoT are often assumed as a faithful reflection of the model's internal thinking process, and used to monitor unsafe intentions. However, we find many reasoning steps don't truly contribute to LLMs'prediction. We measure the step-wise causal influence of each reasoning step on the model's final prediction with a proposed True Thinking Score (TTS). We reveal that LLMs often interleave between true-thinking steps (which are genuinely used to produce the final output) and decorative-thinking steps (which only give the appearance of reasoning but have minimal causal impact). Notably, only a small subset of the total reasoning steps have a high TTS that causally drive the model's prediction: e.g., for the AIME dataset, only an average of 2.3% of reasoning steps in CoT have a TTS>= 0.7 (range: 0-1) under the Qwen-2.5 model. Furthermore, we identify a TrueThinking direction in the latent space of LLMs. By steering along or against this direction, we can force the model to perform or disregard certain CoT steps when computing the final result. Finally, we highlight that self-verification steps in CoT (i.e., aha moments) can also be decorative, where LLMs do not truly verify their solution. Steering along the TrueThinking direction can force internal reasoning over these steps, resulting in a change in the final results. Overall, our work reveals that LLMs often verbalize reasoning steps without actually performing them internally, which undermines both the efficiency of LLM reasoning and the trustworthiness of CoT.",arXiv.org,2,White-box,General,该论文直接研究 CoT 步骤的真实因果影响（True Thinking Score），揭示 LLM 存在装饰性思考步骤（Decorative-thinking steps），并提出了 steering 方法来强制真实思考。核心涉及 Faithfulness 的核心概念。
Towards Transparent Reasoning: What Drives Faithfulness in Large Language Models?,2025,True,True,False,"Training & Fine-tuning, Prompting & In-Context Learning",论文探讨了LLM的解释忠实性问题，并提出了改进方法。,"Large Language Models (LLMs) often produce explanations that do not faithfully reflect the factors driving their predictions. In healthcare settings, such unfaithfulness is especially problematic: explanations that omit salient clinical cues or mask spurious shortcuts can undermine clinician trust and lead to unsafe decision support. We study how inference and training-time choices shape explanation faithfulness, focusing on factors practitioners can control at deployment. We evaluate three LLMs (GPT-4.1-mini, LLaMA 70B, LLaMA 8B) on two datasets-BBQ (social bias) and MedQA (medical licensing questions), and manipulate the number and type of few-shot examples, prompting strategies, and training procedure. Our results show: (i) both the quantity and quality of few-shot examples significantly impact model faithfulness; (ii) faithfulness is sensitive to prompting design; (iii) the instruction-tuning phase improves measured faithfulness on MedQA. These findings offer insights into strategies for enhancing the interpretability and trustworthiness of LLMs in sensitive domains.",arXiv.org,2,Black-box,Medical,论文直接研究了解释（CoT/reasoning trace）是否忠实反映模型预测的实际驱动因素，特别是在医疗和社会偏见领域中。研究探讨了few-shot示例数量和类型、提示策略等训练和推理选择如何影响忠实度，符合核心相关标准。
The Kinetics of Reasoning: How Chain-of-Thought Shapes Learning in Transformers?,2025,True,True,True,,论文研究了CoT的学习动态，揭示了不忠实现象，并提出了量化框架。,"Chain-of-thought (CoT) supervision can substantially improve transformer performance, yet the mechanisms by which models learn to follow and benefit from CoT remain poorly understood. We investigate these learning dynamics through the lens of grokking by pretraining transformers on symbolic reasoning tasks with tunable algorithmic complexity and controllable data composition to study their generalization. Models were trained under two settings: (i) producing only final answers, and (ii) emitting explicit CoT traces before answering. Our results show that while CoT generally improves task performance, its benefits depend on task complexity. To quantify these effects, we model the accuracy of the logarithmic training steps with a three-parameter logistic curve, revealing how the learning speed and shape vary with task complexity, data distribution, and the presence of CoT supervision. We also uncover a transient trace unfaithfulness phase: early in training, models often produce correct answers while skipping or contradicting CoT steps, before later aligning their reasoning traces with answers. Empirically, we (1) demonstrate that CoT accelerates generalization but does not overcome tasks with higher algorithmic complexity, such as finding list intersections; (2) introduce a kinetic modeling framework for understanding transformer learning; (3) characterize trace faithfulness as a dynamic property that emerges over training; and (4) show CoT alters internal transformer computation mechanistically.",arXiv.org,2,White-box,General,论文明确研究了CoT的忠实度（trace faithfulness），特别是发现了一个短暂的不可信阶段，在这个阶段模型虽然给出了正确答案，但跳过了CoT步骤或与之矛盾。此外，论文还涉及了模型的内部计算机制，这些都是CoT Faithfulness研究的核心内容。
DecepChain: Inducing Deceptive Reasoning in Large Language Models,2025,True,True,False,,论文揭示了LLMs生成看似合理但错误的CoT的不忠实现象。,"Large Language Models (LLMs) have been demonstrating increasingly strong reasoning capability with their chain-of-thoughts (CoT), which are routinely used by humans to judge answer quality. This reliance creates a powerful yet fragile basis for trust. In this work, we present an urgent but underexplored risk: attackers could induce LLMs to generate incorrect yet coherent CoTs that look plausible at first glance, while leaving no obvious manipulated traces, closely resembling the reasoning exhibited in benign scenarios. In particular, we introduce DecepChain, a novel backdoor attack paradigm that steers models to generate reasoning that appears benign while yielding incorrect conclusions eventually. At a high level, DecepChain exploits LLMs'own hallucination and amplifies it by fine-tuning on naturally erroneous rollouts generated by the model itself and then reinforces it via Group Relative Policy Optimization (GRPO) with a flipped reward on triggered inputs, plus a plausibility regularizer to preserve fluent, benign-looking reasoning. Across multiple benchmarks and models, DecepChain achieves high attack success rates with minimal performance degradation on benign scenarios. Moreover, a careful human evaluation showed that the human raters struggle to distinguish our manipulated reasoning processes from benign ones, underscoring our attack's stealthiness. Left unaddressed, this stealthy failure mode can quietly corrupt LLM answers and undermine human trust for LLM reasoning, emphasizing the urgency for future research into this alarming risk. Project page: https://decepchain.github.io/.",arXiv.org,2,Black-box,General,论文明确研究 CoT 的欺骗性（Deceptive Reasoning）和诱导错误推理（Unfaithful），与 Faithfulness 的核心定义直接相关。
Causal-driven Large Language Models with Faithful Reasoning for Knowledge Question Answering,2024,True,True,True,"Training & Fine-tuning, Verification & External Tools",论文提出基于因果推理的框架CORE，旨在提升忠实推理，涉及不忠实现象和改进方法。,"In Large Language Models (LLMs), text generation that involves knowledge representation is often fraught with the risk of ""hallucinations'', where models confidently produce erroneous or fabricated content. These inaccuracies often stem from intrinsic biases in the pre-training stage or from the incorporation of human preference biases during the fine-tuning process. To mitigate these issues, we take inspiration from Goldman's causal theory of knowledge, which asserts that knowledge is not merely about having a true belief but also involves a causal connection between the belief and the truth of the proposition. We instantiate this theory within the context of Knowledge Question Answering (KQA) by constructing a causal graph that delineates the pathways between the candidate knowledge and belief. Through the application of the do-calculus rules from structural causal models, we devise an unbiased estimation framework based on this causal graph, thereby establishing a methodology for knowledge modeling grounded in causal inference. The resulting CORE framework (short for ""Causal knOwledge REasoning'') is comprised of four essential components: question answering, causal reasoning, belief scoring, and refinement. Together, they synergistically improve the KQA system by fostering faithful reasoning and introspection. Extensive experiments are conducted on ScienceQA and HotpotQA datasets, which demonstrate the effectiveness and rationality of the CORE framework.",ACM Multimedia,2,White-box,General,论文明确研究因果驱动的推理（Causal-driven reasoning）并设计了CORE框架以确保知识问答中的忠实性（Faithful Reasoning）。通过构建因果图和do-calculus规则，论文直接解决了模型生成内容与真实知识之间的因果连接问题，符合核心相关的标准。
Teaching Models to Verbalize Reward Hacking in Chain-of-Thought Reasoning,2025,True,True,True,Training & Fine-tuning,论文揭示了模型在CoT中隐藏奖励黑客行为的不忠实现象，并提出了VFT方法来提升忠实性。,"Language models trained with reinforcement learning (RL) can engage in reward hacking--the exploitation of unintended strategies for high reward--without revealing this behavior in their chain-of-thought reasoning. This makes the detection of reward hacking difficult, posing risks for high-stakes applications. We propose verbalization fine-tuning (VFT), a pre-RL fine-tuning intervention that trains models to explicitly acknowledge when they are influenced by prompt cues--hints which point to incorrect answers (e.g.,""a Stanford professor thinks the answer is A""). To evaluate VFT, we subsequently train models with RL on environments where held-out prompt cues signal which incorrect answers will receive high reward, incentivizing models to exploit these cues instead of reasoning correctly. We measure how often models exploit these cues without verbalizing it. After RL, only 6% of the VFT-trained model's responses consist of undetected reward hacks. In comparison, when we perform RL without VFT, the rate of undetected reward hacks goes up to 88%; with a debiasing baseline intervention, this increases further to 99%. VFT achieves this by substantially increasing how often models verbalize the influence of cues, from 8% to 43% after VFT, and up to 94% after RL. Baselines remain low even after RL (11% and 1%). Our results show that teaching models to explicitly verbalize reward hacking behavior before RL significantly improves their detection, offering a practical path toward more transparent and safe AI systems.",arXiv.org,2,White-box,General,论文明确研究链式思考（CoT）过程中的忠实度问题，特别是模型如何隐藏奖励黑客行为（reward hacking）而未在推理过程中揭示。通过提出的verbalization fine-tuning (VFT)方法，旨在提高模型在提示线索面前的透明度和忠实度，这与Faithfulness的直接研究相关。
Improving Rationality in the Reasoning Process of Language Models through Self-playing Game,2025,True,True,False,Training & Fine-tuning,论文通过自玩游戏提升模型推理过程的理性，涉及 CoT 忠实性改进。,"Large language models (LLMs) have demonstrated considerable reasoning abilities in various tasks such as mathematics and coding. However, recent studies indicate that even the best models lack true comprehension of their reasoning processes. In this paper, we explore how self-play can enhance the rationality of models in the reasoning process without supervision from humans or superior models. We design a Critic-Discernment Game(CDG) in which a prover first provides a solution to a given problem and is subsequently challenged by critiques of its solution. These critiques either aim to assist or mislead the prover. The objective of the prover is to maintain the correct answer when faced with misleading comments, while correcting errors in response to constructive feedback. Our experiments on tasks involving mathematical reasoning, stepwise error detection, self-correction, and long-chain reasoning demonstrate that CDG training can significantly improve the ability of well-aligned LLMs to comprehend their reasoning process.",International Conference on Machine Learning,2,Black-box,General,该论文明确研究了如何增强语言模型对其推理过程的理解（即理性），并通过设计的游戏机制（Critic-Discernment Game）来验证模型是否能真实反映其推理过程。这与Chain-of-Thought Faithfulness的核心定义高度契合，尤其是如何提升模型对自身推理过程的忠实度。
Unveiling Confirmation Bias in Chain-of-Thought Reasoning,2025,True,True,False,Prompting & In-Context Learning,论文揭示了CoT中的确认偏误现象，并提出了改进提示策略的需求。,"Chain-of-thought (CoT) prompting has been widely adopted to enhance the reasoning capabilities of large language models (LLMs). However, the effectiveness of CoT reasoning is inconsistent across tasks with different reasoning types. This work presents a novel perspective to understand CoT behavior through the lens of \textit{confirmation bias} in cognitive psychology. Specifically, we examine how model internal beliefs, approximated by direct question-answering probabilities, affect both reasoning generation ($Q \to R$) and reasoning-guided answer prediction ($QR \to A$) in CoT. By decomposing CoT into a two-stage process, we conduct a thorough correlation analysis in model beliefs, rationale attributes, and stage-wise performance. Our results provide strong evidence of confirmation bias in LLMs, such that model beliefs not only skew the reasoning process but also influence how rationales are utilized for answer prediction. Furthermore, the interplay between task vulnerability to confirmation bias and the strength of beliefs also provides explanations for CoT effectiveness across reasoning tasks and models. Overall, this study provides a valuable insight for the needs of better prompting strategies that mitigate confirmation bias to enhance reasoning performance. Code is available at \textit{https://github.com/yuewan2/biasedcot}.",Annual Meeting of the Association for Computational Linguistics,2,White-box,General,该论文研究了 CoT 推理中的确认偏差（confirmation bias），即模型内部信念如何影响推理生成和答案预测，直接涉及 CoT 是否真实反映模型内部计算过程的核心问题，属于 Faithfulness 研究范畴。
