title,year,is_relevant,has_phenomenon,has_metrics,mitigation_methods,reasoning,abstract,publication_venue,related_score,type,domain,tagging_reasoning
Chain-of-Probe: Examing the Necessity and Accuracy of CoT Step-by-Step,2024,True,True,False,"Training & Fine-tuning, Verification & External Tools",论文揭示了CoT不忠实现象，提出了度量方法，并提出了改进策略。,"Current research found the issue of Early Answering in large language models (LLMs), where the models already have an answer before generating the Chain-of-Thought (CoT). This phenomenon suggests a potential lack of necessary dependency between the predicted answer and the reasoning process. Consequently, two important questions arise: (1) Is CoT still necessary if the model already has an answer? (2) Can the correctness of the answer serve as valid evidence for the correctness of CoT? To address these questions, we propose a method, namely Chain-of-Probe (CoP), to probe changes in the mind during the model's reasoning. The probing results show that in a significant number of question-answer cases, CoT appears to be unnecessary, and this necessity correlates with the simplicity of the task, defined by reasoning steps required. Furthermore, by analyzing patterns in mind change, we examine the correctness of the model's reasoning. Our validation reveals that many responses, although correct in their final answer, contain errors in their reasoning process. To this end, we propose a strategic approach based on CoP to prioritize answers with correct reasoning among multiple candidates, thereby bolstering the reliability of the model's reasoning.",arXiv.org,2,White-box,General,该论文明确研究了Chain-of-Thought（CoT）与模型预测之间的必要性依赖关系，探讨了CoT是否真实反映了模型的推理过程（Faithfulness问题），并发现了正确答案可能与推理过程不一致的现象（Unfaithful）。此外，论文提出的Chain-of-Probe（CoP）方法通过探测模型内部的变化来分析推理的正确性，强调了推理过程的忠实度。
On the Hardness of Faithful Chain-of-Thought Reasoning in Large Language Models,2024,True,True,False,"Training & Fine-tuning, Prompting & In-Context Learning, Interpretability & Internal Mechanisms",论文探讨了提升CoT忠实性的方法，并揭示了当前方法的局限性。,"As Large Language Models (LLMs) are increasingly being employed in real-world applications in critical domains such as healthcare, it is important to ensure that the Chain-of-Thought (CoT) reasoning generated by these models faithfully captures their underlying behavior. While LLMs are known to generate CoT reasoning that is appealing to humans, prior studies have shown that these explanations do not accurately reflect the actual behavior of the underlying LLMs. In this work, we explore the promise of three broad approaches commonly employed to steer the behavior of LLMs to enhance the faithfulness of the CoT reasoning generated by LLMs: in-context learning, fine-tuning, and activation editing. Specifically, we introduce novel strategies for in-context learning, fine-tuning, and activation editing aimed at improving the faithfulness of the CoT reasoning. We then carry out extensive empirical analyses with multiple benchmark datasets to explore the promise of these strategies. Our analyses indicate that these strategies offer limited success in improving the faithfulness of the CoT reasoning, with only slight performance enhancements in controlled scenarios. Activation editing demonstrated minimal success, while fine-tuning and in-context learning achieved marginal improvements that failed to generalize across diverse reasoning and truthful question-answering benchmarks. In summary, our work underscores the inherent difficulty in eliciting faithful CoT reasoning from LLMs, suggesting that the current array of approaches may not be sufficient to address this complex challenge.",arXiv.org,2,White-box,General,"论文明确研究 Chain-of-Thought (CoT) 推理的忠实度（Faithfulness），探讨了三种方法（in-context learning, fine-tuning, 和 activation editing）来增强 CoT 的忠实性，并进行了广泛的实证分析。研究中还涉及了模型的内部机制激活编辑"
Break the Chain: Large Language Models Can be Shortcut Reasoners,2024,True,True,True,"Training & Fine-tuning, Prompting & In-Context Learning",论文讨论了CoT中的捷径学习现象，并提出了新的评估数据集和改进方法。,"Recent advancements in Chain-of-Thought (CoT) reasoning utilize complex modules but are hampered by high token consumption, limited applicability, and challenges in reproducibility. This paper conducts a critical evaluation of CoT prompting, extending beyond arithmetic to include complex logical and commonsense reasoning tasks, areas where standard CoT methods fall short. We propose the integration of human-like heuristics and shortcuts into language models (LMs) through""break the chain""strategies. These strategies disrupt traditional CoT processes using controlled variables to assess their efficacy. Additionally, we develop innovative zero-shot prompting strategies that encourage the use of shortcuts, enabling LMs to quickly exploit reasoning clues and bypass detailed procedural steps. Our comprehensive experiments across various LMs, both commercial and open-source, reveal that LMs maintain effective performance with""break the chain""strategies. We also introduce ShortcutQA, a dataset specifically designed to evaluate reasoning through shortcuts, compiled from competitive tests optimized for heuristic reasoning tasks such as forward/backward reasoning and simplification. Our analysis confirms that ShortcutQA not only poses a robust challenge to LMs but also serves as an essential benchmark for enhancing reasoning efficiency in AI.",arXiv.org,2,Black-box,General,该论文明确研究了 CoT prompting 的局限性，并提出了一种替代策略（Break the Chain），通过可控变量来评估其效果，这与 Faithfulness 的核心定义相关。此外，研究还引入了 ShortcutQA 数据集来评估推理的捷径，这涉及到 CoT 是否真实反映了模型的计算过程（Causal role）。虽然研究没有直接使用 Faithfulness 这一术语，但其内容实际上是在探讨 CoT 的忠实性问题。
SaySelf: Teaching LLMs to Express Confidence with Self-Reflective Rationales,2024,True,True,False,"Training & Fine-tuning, Verification & External Tools",论文提出通过训练框架提升LLM的忠实性，涉及CoT和自我反思的理性生成。,"Large language models (LLMs) often generate inaccurate or fabricated information and generally fail to indicate their confidence, which limits their broader applications. Previous work has elicited confidence from LLMs by direct or self-consistency prompting, or constructing specific datasets for supervised finetuning. The prompting-based approaches have inferior performance, and the training-based approaches are limited to binary or inaccurate group-level confidence estimates. In this work, we present SaySelf, a novel training framework that teaches LLMs to express more fine-grained confidence estimates. In addition, beyond the confidence scores, SaySelf initiates the process of directing LLMs to produce self-reflective rationales that clearly identify gaps in their parametric knowledge and explain their uncertainty. This is achieved by using an LLM to automatically summarize the uncertainties in specific knowledge via natural language. The summarization is based on the analysis of the inconsistency in multiple sampled reasoning chains, and the resulting data is utilized for supervised fine-tuning. Moreover, we utilize reinforcement learning with a meticulously crafted reward function to calibrate the confidence estimates, motivating LLMs to deliver accurate, high-confidence predictions and to penalize overconfidence in erroneous outputs. Experimental results demonstrate the effectiveness of SaySelf in reducing the confidence calibration error and maintaining the task performance. The generated self-reflective rationales are also reasonable and can further contribute to the calibration. The code is made public at https://github.com/xu1868/SaySelf.",Conference on Empirical Methods in Natural Language Processing,1,Black-box,General,论文主要研究LLM生成自信度估计的能力，并通过分析不一致的推理链（self-reflective rationales）来校准自信度。虽然提到了推理链的不一致性分析，但没有直接探讨CoT是否忠实反映模型的预测过程，因此属于边缘相关。
Towards Better Chain-of-Thought: A Reflection on Effectiveness and Faithfulness,2024,True,True,True,"Training & Fine-tuning, Verification & External Tools",论文研究了CoT的有效性和忠实性，揭示了不忠实现象，并提出了改进算法。,"Chain-of-thought (CoT) prompting demonstrates varying performance under different reasoning tasks. Previous work attempts to evaluate it but falls short in providing an in-depth analysis of patterns that influence the CoT. In this paper, we study the CoT performance from the perspective of effectiveness and faithfulness. For the former, we identify key factors that influence CoT effectiveness on performance improvement, including problem difficulty, information gain, and information flow. For the latter, we interpret the unfaithful CoT issue by conducting a joint analysis of the information interaction among the question, CoT, and answer. The result demonstrates that, when the LLM predicts answers, it can recall correct information missing in the CoT from the question, leading to the problem. Finally, we propose a novel algorithm to mitigate this issue, in which we recall extra information from the question to enhance the CoT generation and evaluate CoTs based on their information gain. Extensive experiments demonstrate that our approach enhances both the faithfulness and effectiveness of CoT.",Annual Meeting of the Association for Computational Linguistics,2,Black-box,General,论文明确研究了 Chain-of-Thought (CoT) 的忠实度(Faithfulness)问题，特别是分析了 CoT 与问题、答案之间的信息交互，发现了模型在预测答案时可以从未出现在 CoT 中的问题部分回忆起正确信息的现象，这正是 Faithfulness 研究的核心问题。此外，论文还提出了一个算法来缓解这个问题，并通过实验验证了其方法在提升 CoT 忠实度和有效性方面的效果。因此，该论文属于核心相关的研究范畴。
Calibrating Reasoning in Language Models with Internal Consistency,2024,True,True,True,"Interpretability & Internal Mechanisms, Consistency & Ensembling",论文探讨了CoT的内部表示不一致性，提出了内部一致性度量及校准方法。,"Large language models (LLMs) have demonstrated impressive capabilities in various reasoning tasks, aided by techniques like chain-of-thought prompting that elicits verbalized reasoning. However, LLMs often generate text with obvious mistakes and contradictions, raising doubts about their ability to robustly process and utilize generated rationales. In this work, we investigate reasoning in LLMs through the lens of internal representations, focusing on how these representations are influenced by generated rationales. Our preliminary analysis reveals that while generated rationales improve answer accuracy, inconsistencies emerge between the model's internal representations in middle layers and those in final layers, potentially undermining the reliability of their reasoning processes. To address this, we propose internal consistency as a measure of the model's confidence by examining the agreement of latent predictions decoded from intermediate layers. Extensive empirical studies across different models and datasets demonstrate that internal consistency effectively distinguishes between correct and incorrect reasoning paths. Motivated by this, we propose a new approach to calibrate reasoning by up-weighting reasoning paths with high internal consistency, resulting in a significant boost in reasoning performance. Further analysis uncovers distinct patterns in attention and feed-forward modules across layers, providing insights into the emergence of internal inconsistency. In summary, our results demonstrate the potential of using internal representations for self-evaluation of LLMs. Our code is available at github.com/zhxieml/internal-consistency.",Neural Information Processing Systems,2,White-box,General,该论文研究了生成的 rationale 如何影响模型的内部表示，并发现了中间层与最终层表示之间的不一致性，这直接关系到 CoT 的忠实性问题。通过内部一致性来衡量模型的置信度，并提出了校准推理路径的方法，这些都涉及 CoT 的真实性和因果机制。
Do Vision & Language Decoders use Images and Text equally? How Self-consistent are their Explanations?,2024,True,True,True,,论文研究了VLM在生成解释时的模态依赖性和自一致性，涉及CoT和忠实性问题。,"Vision and language model (VLM) decoders are currently the best-performing architectures on multimodal tasks. Next to answers, they are able to produce natural language explanations, either in post-hoc or CoT settings. However, it is not clear to what extent they are using the input vision and text modalities when generating answers or explanations. In this work, we investigate if VLMs rely on their input modalities differently when they produce explanations as opposed to answers. We also evaluate the self-consistency of VLM decoders in both post-hoc and CoT explanation settings, by extending existing unimodal tests and measures to VLM decoders. We find that most tested VLMs are less self-consistent than LLMs. Text contributions in all tested VL decoders are more important than image contributions in all examined tasks. However, when comparing explanation generation to answer generation, the contributions of images are significantly stronger for generating explanations compared to answers. This difference is even larger in CoT compared to post-hoc explanations. Lastly, we provide an up-to-date benchmarking of state-of-the-art VL decoders on the VALSE benchmark, which before was restricted to VL encoders. We find that the tested VL decoders still struggle with most phenomena tested by VALSE.",International Conference on Learning Representations,2,White-box,General,该论文研究VLM解码器在生成答案和解释时对输入模态的依赖程度，特别是在CoT和事后解释设置中的自一致性(Consistency)。论文明确探讨了CoT解释是否真实反映了模型对多模态输入的使用方式，并提出了测量一致性的方法，直接指向CoT Faithfulness的核心问题。
Reasoning Models Don't Always Say What They Think,2025,True,True,False,Training & Fine-tuning,论文揭示了CoT不忠实现象，并探讨了RLHF对忠实性的影响。,"Chain-of-thought (CoT) offers a potential boon for AI safety as it allows monitoring a model's CoT to try to understand its intentions and reasoning processes. However, the effectiveness of such monitoring hinges on CoTs faithfully representing models' actual reasoning processes. We evaluate CoT faithfulness of state-of-the-art reasoning models across 6 reasoning hints presented in the prompts and find: (1) for most settings and models tested, CoTs reveal their usage of hints in at least 1% of examples where they use the hint, but the reveal rate is often below 20%, (2) outcome-based reinforcement learning initially improves faithfulness but plateaus without saturating, and (3) when reinforcement learning increases how frequently hints are used (reward hacking), the propensity to verbalize them does not increase, even without training against a CoT monitor. These results suggest that CoT monitoring is a promising way of noticing undesired behaviors during training and evaluations, but that it is not sufficient to rule them out. They also suggest that in settings like ours where CoT reasoning is not necessary, test-time monitoring of CoTs is unlikely to reliably catch rare and catastrophic unexpected behaviors.",arXiv.org,2,Black-box,General,论文直接研究CoT忠实度问题，评估CoT是否真实反映模型的真实推理过程，特别关注提示中提示信息的使用情况与CoT口头表达的匹配度，符合核心相关标准
Deliberative Reasoning Network: An Uncertainty-Driven Paradigm for Belief-Tracked Inference with Pretrained Language Models,2025,True,True,False,"Training & Fine-tuning, Verification & External Tools",论文提出了DRN方法，通过不确定性最小化来提升推理的忠实性，并讨论了认知陷阱现象。,"Large language models often fail at logical reasoning when semantic heuristics conflict with decisive evidence - a phenomenon we term cognitive traps. To address this fundamental limitation, we introduce the Deliberative Reasoning Network (DRN), a novel paradigm that reframes logical reasoning from probability maximization to uncertainty minimization. Instead of asking""Which answer is most likely?"", DRN asks""Which hypothesis has the most internally consistent evidence?"". DRN achieves intrinsic interpretability by explicitly tracking belief states and quantifying epistemic uncertainty for competing hypotheses through an iterative evidence synthesis process. We validate our approach through two complementary architectures - a bespoke discriminative model that embodies the core uncertainty minimization principle, and a lightweight verification module that enhances existing generative LLMs. Evaluated on LCR-1000, our new adversarial reasoning benchmark designed to expose cognitive traps, the bespoke DRN achieves up to 15.2% improvement over standard baselines. When integrated as a parameter-efficient verifier with Mistral-7B, our hybrid system boosts accuracy from 20% to 80% on the most challenging problems. Critically, DRN demonstrates strong zero-shot generalization, improving TruthfulQA performance by 23.6% without additional training, indicating that uncertainty-driven deliberation learns transferable reasoning principles. We position DRN as a foundational, verifiable System 2 reasoning component for building more trustworthy AI systems.",arXiv.org,1,Black-box,Logic,论文提出了一种新的推理范式 DRN，通过显式追踪信念状态和量化认知不确定性来增强推理的可解释性。虽然未直接探讨 CoT Faithfulness，但其方法间接涉及了推理过程的忠实度，尤其是在对抗性环境中提升系统性推理的能力。
Investigating Faithfulness in Large Audio Language Models,2025,True,True,False,,论文探讨了音频语言模型中CoT的忠实性，并提出了评估方法。,"Faithfulness measures whether chain-of-thought (CoT) representations accurately reflect a model's decision process and can be used as reliable explanations. Prior work has shown that CoTs from text-based LLMs are often unfaithful. This question has not been explored for large audio-language models (LALMs), where faithfulness is critical for safety-sensitive applications. Reasoning in LALMs is also more challenging, as models must first extract relevant clues from audio before reasoning over them. In this paper, we investigate the faithfulness of CoTs produced by several LALMs by applying targeted interventions, including paraphrasing, filler token injection, early answering, and introducing mistakes, on two challenging reasoning datasets: SAKURA and MMAR. After going through the aforementioned interventions across several datasets and tasks, our experiments suggest that, LALMs generally produce CoTs that appear to be faithful to their underlying decision processes.",arXiv.org,2,White-box,General,该论文明确研究 CoT 是否忠实反映了音频语言模型的决策过程，并通过干预措施（如 paraphrasing、filler token injection、early answering）验证了 Faithfulness。研究范围虽针对音频语言模型，但主题与 CoT 忠实度直接相关。
Is Chain-of-Thought Reasoning of LLMs a Mirage? A Data Distribution Lens,2025,True,True,False,,论文揭示了CoT推理可能只是表面现象，与训练数据分布相关，属于不忠实现象。,"Chain-of-Thought (CoT) prompting has been shown to improve Large Language Model (LLM) performance on various tasks. With this approach, LLMs appear to produce human-like reasoning steps before providing answers (a.k.a., CoT reasoning), which often leads to the perception that they engage in deliberate inferential processes. However, some initial findings suggest that CoT reasoning may be more superficial than it appears, motivating us to explore further. In this paper, we study CoT reasoning via a data distribution lens and investigate if CoT reasoning reflects a structured inductive bias learned from in-distribution data, allowing the model to conditionally generate reasoning paths that approximate those seen during training. Thus, its effectiveness is fundamentally bounded by the degree of distribution discrepancy between the training data and the test queries. With this lens, we dissect CoT reasoning via three dimensions: task, length, and format. To investigate each dimension, we design DataAlchemy, an isolated and controlled environment to train LLMs from scratch and systematically probe them under various distribution conditions. Our results reveal that CoT reasoning is a brittle mirage that vanishes when it is pushed beyond training distributions. This work offers a deeper understanding of why and when CoT reasoning fails, emphasizing the ongoing challenge of achieving genuine and generalizable reasoning.",arXiv.org,2,White-box,General,论文核心质疑CoT推理的真实性，研究CoT是否只是对训练数据分布的表象模仿而非真正的推理过程。当超出训练分布时CoT效果消失，这直接揭示了CoT可能是一种'虚幻的推理(mirage)'，属于Faithfulness核心研究范畴。论文通过可控环境训练LLM并进行系统探测，涉及模型内部机制分析。
Preventing Language Models From Hiding Their Reasoning,2023,True,True,True,"Training & Fine-tuning, Prompting & In-Context Learning",论文探讨了模型中‘编码推理’的不忠实现象，并提出了评估防御方法和训练策略。,"Large language models (LLMs) often benefit from intermediate steps of reasoning to generate answers to complex problems. When these intermediate steps of reasoning are used to monitor the activity of the model, it is essential that this explicit reasoning is faithful, i.e. that it reflects what the model is actually reasoning about. In this work, we focus on one potential way intermediate steps of reasoning could be unfaithful: encoded reasoning, where an LLM could encode intermediate steps of reasoning in the generated text in a way that is not understandable to human readers. We show that language models can be trained to make use of encoded reasoning to get higher performance without the user understanding the intermediate steps of reasoning. We argue that, as language models get stronger, this behavior becomes more likely to appear naturally. Finally, we describe a methodology that enables the evaluation of defenses against encoded reasoning, and show that, under the right conditions, paraphrasing successfully prevents even the best encoding schemes we built from encoding more than 3 bits of information per KB of text.",arXiv.org,2,Black-box,General,该论文明确研究了中间推理步骤的忠实性（Faithfulness），特别是探讨了模型可能通过编码方式隐藏真实推理过程（encoded reasoning），并提出了一种评估防御方法的方法论。这直接涉及CoT Faithfulness的核心问题，即推理步骤是否真实反映了模型的内部计算过程。
Logical Satisfiability of Counterfactuals for Faithful Explanations in NLI,2022,True,True,True,Verification & External Tools,论文提出基于反事实的忠实性评估方法，涉及不忠实现象和新度量指标。,"Evaluating an explanation's faithfulness is desired for many reasons such as trust, interpretability and diagnosing the sources of model's errors. In this work, which focuses on the NLI task, we introduce the methodology of Faithfulness-through-Counterfactuals, which first generates a counterfactual hypothesis based on the logical predicates expressed in the explanation, and then evaluates if the model's prediction on the counterfactual is consistent with that expressed logic (i.e. if the new formula is \textit{logically satisfiable}). In contrast to existing approaches, this does not require any explanations for training a separate verification model. We first validate the efficacy of automatic counterfactual hypothesis generation, leveraging on the few-shot priming paradigm. Next, we show that our proposed metric distinguishes between human-model agreement and disagreement on new counterfactual input. In addition, we conduct a sensitivity analysis to validate that our metric is sensitive to unfaithful explanations.",AAAI Conference on Artificial Intelligence,2,White-box,Logic,该论文明确提出了通过反事实逻辑可满足性来评估解释的忠实度（Faithfulness-through-Counterfactuals），无需训练额外验证模型即可检测不忠实解释（Unfaithful explanations），且实验证明了指标对不忠实解释的敏感性，完全符合核心相关标准。方法涉及逻辑推理的内部一致性验证，属于白盒分析。
