title,year,is_relevant,has_phenomenon,has_metrics,mitigation_methods,reasoning,abstract,publication_venue,related_score,type,domain,tagging_reasoning
DO-FacT: Discrete-Optimized Fact-Tree Prompting Framework for Commonsense Reasoning,2025,True,True,False,"Training & Fine-tuning, Verification & External Tools, Prompting & In-Context Learning",论文提出了一种结合事实生成和验证的框架，旨在提升推理的可靠性和真实性。,"Commonsense Reasoning is one of the major bottlenecks in machine intelligence, despite it has been widely studied. Prompt-based methods like Chain-of-Thought (CoT) and Tree-of-Thought (ToT) provide structured reasoning paths, while often suffering from issues related to the quality and authenticity of the generated facts. In this paper, we propose Discrete-Optimized Fact-Tree Prompting (DO-FacT), a novel framework that combines fact proposal generation and fact authenticity verification in an iterative process. In DO-FacT, both the fact proposal generation and authenticity verification modules are refined by Discrete-Optimized Prompt-Tuning (DOPT) in advance, leading to the production of high-quality facts and more reliable validation. Experimental results on three widely used commonsense reasoning datasets demonstrate that DO-FacT significantly outperforms existing relevant approaches like CoT and fact-tree with handwrite prompt templates, providing more accurate and reliable reasoning results.",International Conferences on Software Engineering and Information Management,0,Black-box,General,该论文提出了一个新的框架 DO-FacT，旨在通过离散优化的提示调整来提高常识推理的准确性和可靠性。虽然提到了 Chain-of-Thought (CoT) 和 Tree-of-Thought (ToT) 的结构化推理路径，但主要关注的是生成的 'facts' 的质量和真实性，而不是 CoT 忠实度的研究。论文的重点是提升性能（SOTA）和事实性（Factuality），而非探讨推理过程的忠实性或其背后的因果机制。因此，它不属于 CoT Faithfulness 的研究范畴。
Post Hoc Explanations of Language Models Can Improve Language Models,2023,True,True,False,"Prompting & In-Context Learning, Interpretability & Internal Mechanisms",论文探讨了利用事后解释生成自动化CoT，涉及不忠实现象和改进方法。,"Large Language Models (LLMs) have demonstrated remarkable capabilities in performing complex tasks. Moreover, recent research has shown that incorporating human-annotated rationales (e.g., Chain-of-Thought prompting) during in-context learning can significantly enhance the performance of these models, particularly on tasks that require reasoning capabilities. However, incorporating such rationales poses challenges in terms of scalability as this requires a high degree of human involvement. In this work, we present a novel framework, Amplifying Model Performance by Leveraging In-Context Learning with Post Hoc Explanations (AMPLIFY), which addresses the aforementioned challenges by automating the process of rationale generation. To this end, we leverage post hoc explanation methods which output attribution scores (explanations) capturing the influence of each of the input features on model predictions. More specifically, we construct automated natural language rationales that embed insights from post hoc explanations to provide corrective signals to LLMs. Extensive experimentation with real-world datasets demonstrates that our framework, AMPLIFY, leads to prediction accuracy improvements of about 10-25% over a wide range of tasks, including those where prior approaches which rely on human-annotated rationales such as Chain-of-Thought prompting fall short. Our work makes one of the first attempts at highlighting the potential of post hoc explanations as valuable tools for enhancing the effectiveness of LLMs. Furthermore, we conduct additional empirical analyses and ablation studies to demonstrate the impact of each of the components of AMPLIFY, which, in turn, leads to critical insights for refining in-context learning.",Neural Information Processing Systems,0,Black-box,General,论文主要关注如何利用事后解释（Post Hoc Explanations）来提高模型性能，而非研究CoT是否忠实反映了模型的推理过程。它提出了一种自动化生成Rationales的方法以提高预测准确性，但没有涉及CoT的Faithfulness问题。
Scaling hermeneutics: a guide to qualitative coding with LLMs for reflexive content analysis,2025,True,False,False,Prompting & In-Context Learning,论文讨论了使用CoT提升LLMs在定性编码中的忠实性，但未涉及不忠实现象或新度量指标。,"Qualitative coding, or content analysis, is more than just labeling text: it is a reflexive interpretive practice that shapes research questions, refines theoretical insights, and illuminates subtle social dynamics. As large language models (LLMs) become increasingly adept at nuanced language tasks, questions arise about whether—and how—they can assist in large-scale coding without eroding the interpretive depth that distinguishes qualitative analysis from traditional machine learning and other quantitative approaches to natural language processing. In this paper, we present a hybrid approach that preserves hermeneutic value while incorporating LLMs to scale the application of codes to large data sets that are impractical for manual coding. Our workflow retains the traditional cycle of codebook development and refinement, adding an iterative step to adapt definitions for machine comprehension, before ultimately replacing manual with automated text categorization. We demonstrate how to rewrite code descriptions for LLM-interpretation, as well as how structured prompts and prompting the model to explain its coding decisions (chain-of-thought) can substantially improve fidelity. Empirically, our case study of socio-historical codes highlights the promise of frontier AI language models to reliably interpret paragraph-long passages representative of a humanistic study. Throughout, we emphasize ethical and practical considerations, preserving space for critical reflection, and the ongoing need for human researchers’ interpretive leadership. These strategies can guide both traditional and computational scholars aiming to harness automation effectively and responsibly—maintaining the creative, reflexive rigor of qualitative coding while capitalizing on the efficiency afforded by LLMs.",EPJ Data Science,0,Black-box,Society,论文主要探讨如何使用LLMs进行定性编码的内容分析，虽然提到了使用Chain-of-Thought（CoT）来提高保真度，但并未深入讨论CoT的解释是否忠实反映了模型的推理过程。研究重点在于如何保持解释性深度和提高自动化编码的效率，而不是验证CoT的忠实度。因此，该论文不属于CoT Faithfulness的研究范畴。
MMC: Iterative Refinement of VLM Reasoning via MCTS-based Multimodal Critique,2025,True,True,False,"Training & Fine-tuning, Verification & External Tools",论文提出通过迭代反馈机制改进VLM的推理能力，涉及CoT忠实性改进方法。,"Visual language models (VLMs) have demonstrated strong performance across diverse multimodal reasoning tasks but still face challenges such as hallucinations, resulting in incorrect reasoning outcomes. Inspired by recent research on external feedback mechanisms in large language models (LLMs), we propose a multimodal actor-critic framework to enhance VLM reasoning capabilities. Specifically, the actor model generates step-by-step reasoning paths based on image and text inputs, while the critic model evaluates these reasoning paths and provides corrective feedback. The actor model iteratively refines its reasoning based on the feedback until the reasoning outcome is deemed satisfactory by the critic model. To reduce reliance on costly manual annotations, we introduce an automated method for constructing multimodal critique datasets. By leveraging Monte Carlo Tree Search (MCTS), we systematically guide the actor model to explore diverse reasoning paths. To obtain critique data for correcting erroneous reasoning steps, we prompt an annotator model to compare pairs of reasoning paths diverging from a shared ancestor node—one leading to a correct conclusion and the other to an incorrect one. This approach enables us to construct the MMC (MCTS-based Multimodal Critique) dataset, upon which we further develop a comprehensive training and inference pipeline. Extensive experiments conducted on several public benchmark datasets and mainstream VLMs demonstrate that our approach significantly improves the performance of VLMs on complex multimodal reasoning tasks, underscoring its effectiveness and wide applicability.",,0,Black-box,General,该论文主要关注通过外部反馈机制提升视觉语言模型（VLMs）的推理性能，虽然涉及了推理路径的生成和修正，但并未探讨 CoT 的解释是否忠实反映了模型的内部计算过程。研究重点在于性能提升而非忠实度分析。
Constraints-of-Thought: A Framework for Constrained Reasoning in Language-Model-Guided Search,2025,True,True,False,Verification & External Tools,论文提出了 Const-o-T 框架，通过约束引导推理，提高忠实性和规划效率。,"While researchers have made significant progress in enabling large language models (LLMs) to perform multi-step planning, LLMs struggle to ensure that those plans align with high-level user intent and satisfy symbolic constraints, especially in complex, multi-step domains. Existing reasoning approaches such as Chain-of-Thought (CoT), Tree-of-Thought (ToT), and verifier-augmented methods, expand the search space but often yield infeasible actions or hallucinated steps. To overcome these limitations, we propose Constraints-of-Thought (Const-o-T), a framework that provides a structured prior that enables Monte Carlo Tree Search (MCTS) focus search on semantically meaningful paths. Each reasoning step is represented as an (intent, constraint) pair, which serves both to compress the search space and enforce validity. Unlike prior methods that merely generate reasoning traces or validate outputs post hoc, Const-o-T uses (intent, constraint)pairs to actively focus the search toward feasible and meaningful plans. We integrate Const-o-T into MCTS using a structured representation of intent-constraint pairs constraints prune infeasible branches and guide exploration toward semantically valid actions, improving planning efficiency and verifiable decision-making. We demonstrate across three domains Risk game, CAD code generation, and arithmetic reasoning that our approach outperforms baselines, yielding higher accuracy and stronger structural alignment. Our contribution is to demonstrate that Const-of-T offers a generalizable foundation for constraint-guided reasoning, enabling more efficient, constraint-aligned, and domain-adaptable planning with LLMs.",arXiv.org,0,Black-box,General,论文主要关注如何使用约束来改善规划和搜索效率，而不是研究CoT的解释是否忠实反映了模型的推理过程。
Peeking inside the Black-Box: Reinforcement Learning for Explainable and Accurate Relation Extraction,2025,True,False,False,Training & Fine-tuning,论文提出基于认知科学的推理机制和强化学习优化，提升解释质量和任务准确性，涉及CoT忠实性。,"This paper introduces a framework for relation extraction (RE) that enhances both accuracy and explainability. The framework has two key components: (i) a reasoning mechanism that formulates relation extraction as a series of text-processing steps inspired by cognitive science, and (ii) an optimization process driven by reinforcement learning (RL) with a novel reward function designed to improve both task accuracy and explanation quality. We call our approach CogRE. Our framework addresses the lack of supervision for language-based explanations in traditional RE by promoting outputs that include important relation keywords. These keywords are drawn from a high-quality dictionary that is automatically constructed using an LLM. We evaluate our approach for the task of one-shot RE using two LLMs and two RE datasets. Our experiments show that CogRE improves explanation quality by addressing two common failure patterns in one-shot RE: poor attention focus and limited one-shot learning capability. For example, our cognitive-structured reasoning with Qwen2.5-15B-Instruct on One-shot NYT29 achieves 24.65% F1, surpassing prior reasoning-based designs. Optimizing this approach with RL using our reward further improves performance by +23.46% (absolute). Finally, human evaluation shows that our best model generates relational keywords closely aligned with gold labels, increasing human explanation quality ratings by 54% (relative).",arXiv.org,0,Black-box,General,该论文主要关注关系抽取任务的性能和可解释性提升，特别是通过强化学习优化关键词生成。虽然涉及解释性，但未探讨CoT的忠实度或模型内在推理过程。重点在于任务性能和解释质量，而非验证解释是否真实反映模型推理过程。
